Title,ID,Author,URL,Score,Comment Count,Created
I learned that if men don't masturbate 7 days their testosterone levels increase by 45.7%. Will this have an effect on strength or muscle? ,12l2gw,ToJackOrNotToJack,https://www.reddit.com/r/Fitness/comments/12l2gw/i_learned_that_if_men_dont_masturbate_7_days/,6,40,1351982340.0
How does your body not get use to doing the big 3?,dw16qr,Ep1cH3ro,https://www.reddit.com/r/Fitness/comments/dw16qr/how_does_your_body_not_get_use_to_doing_the_big_3/,0,35,1573691043.0
Self-Promotion Saturday,4t3yrq,AutoModerator,https://www.reddit.com/r/Fitness/comments/4t3yrq/selfpromotion_saturday/,2,31,1468663342.0
just a girl tryin to get in bikini shape,1yzwaa,snowguuuuuuuuurl,https://www.reddit.com/r/Fitness/comments/1yzwaa/just_a_girl_tryin_to_get_in_bikini_shape/,1,44,1393430183.0
Will someone tell me to stop feeling guilty about eating?(trying to bulk),16tf8h,mkirklions,https://www.reddit.com/r/Fitness/comments/16tf8h/will_someone_tell_me_to_stop_feeling_guilty_about/,2,41,1358519201.0
Stopping By Woods On a Bro-y Evening,n3ryl,splorng,https://www.reddit.com/r/Fitness/comments/n3ryl/stopping_by_woods_on_a_broy_evening/,2,2,1323252733.0
"Why exercise may be protective against cancer, neurodegenerative disorders, infections, inflammatory diseases, ageing and insulin resistance",1ko3z2,drjkiel,https://www.reddit.com/r/Fitness/comments/1ko3z2/why_exercise_may_be_protective_against_cancer/,5,7,1376924773.0
Are steroids common at your gym? Any horror stories of steroid use (story inside)?,1707fu,None,https://www.reddit.com/r/Fitness/comments/1707fu/are_steroids_common_at_your_gym_any_horror/,0,57,1358796814.0
Is walking better for our metabolism than going to the gym?,eqvj8n,None,https://www.reddit.com/r/Fitness/comments/eqvj8n/is_walking_better_for_our_metabolism_than_going/,0,29,1579435873.0
"Rate my beginner, full body routine - 26/M/143 lb",4gnli3,None,https://www.reddit.com/r/Fitness/comments/4gnli3/rate_my_beginner_full_body_routine_26m143_lb/,0,25,1461746499.0
A new safety system for MAX bench press. Hydraulic seat saves you from being trapped under the bar.,3dlsai,Lewhasreddit,https://www.reddit.com/r/Fitness/comments/3dlsai/a_new_safety_system_for_max_bench_press_hydraulic/,0,12,1437121951.0
"LPT: When ordering new protein, etc. Save the scoop from the previous container. That way you don't have to dig through the new powered trying to find the new scoop.",2asqbv,Truckyouinthebutt,https://www.reddit.com/r/Fitness/comments/2asqbv/lpt_when_ordering_new_protein_etc_save_the_scoop/,2,5,1405458191.0
[Serious]Question about... etiquette... in the changing room...,24jr73,In_da_faust,https://www.reddit.com/r/Fitness/comments/24jr73/seriousquestion_about_etiquette_in_the_changing/,0,39,1399045113.0
looking for a machine only routine?,yv300,puashared,https://www.reddit.com/r/Fitness/comments/yv300/looking_for_a_machine_only_routine/,0,42,1346007198.0
What is the best way to burn fat rapidly?,ns7se,Jaxcen,https://www.reddit.com/r/Fitness/comments/ns7se/what_is_the_best_way_to_burn_fat_rapidly/,0,51,1324987355.0
"""Work hard in the gym"" seems to be contradictory to ""keep good form"" and I'd like help understanding this",dy1iyi,None,https://www.reddit.com/r/Fitness/comments/dy1iyi/work_hard_in_the_gym_seems_to_be_contradictory_to/,2,31,1574073331.0
"I am 17, I am a boy, and I'm wanting to imporve myself. Can anyone help me?",y9z4t,BubbaJosh,https://www.reddit.com/r/Fitness/comments/y9z4t/i_am_17_i_am_a_boy_and_im_wanting_to_imporve/,4,88,1345058760.0
Dont Be That Awkward Runner,km27o,johnwaynesworld,https://www.reddit.com/r/Fitness/comments/km27o/dont_be_that_awkward_runner/,165,217,1316557386.0
Female to male transgender 2 year progress: from small and girly to hairy and burly,3gendo,None,https://www.reddit.com/r/Fitness/comments/3gendo/female_to_male_transgender_2_year_progress_from/,4657,1057,1439166449.0
Free weights 'found to have 362 TIMES more bacteria than a toilet seat',4ea2qz,ktkps,https://www.reddit.com/r/Fitness/comments/4ea2qz/free_weights_found_to_have_362_times_more/,18,80,1460368833.0
"Is it just me, or is r/Fitness overrun with ""i'm fat and need motivation"" posts?",as0r5,dizzle67,https://www.reddit.com/r/Fitness/comments/as0r5/is_it_just_me_or_is_rfitness_overrun_with_im_fat/,14,35,1264011328.0
Muscle Haters Club... reddit? ,fkj7o,Leviathan_86,https://www.reddit.com/r/Fitness/comments/fkj7o/muscle_haters_club_reddit/,6,73,1297602880.0
Experience with bullying in the gym? Embarrassing incident happened earlier,1vvudw,elijah300,https://www.reddit.com/r/Fitness/comments/1vvudw/experience_with_bullying_in_the_gym_embarrassing/,0,87,1390425939.0
The secret to a big chest is...,1hp6xi,grindcore4lyfe,https://www.reddit.com/r/Fitness/comments/1hp6xi/the_secret_to_a_big_chest_is/,48,62,1373043784.0
"Stalled OHP, not sure what to do?",8xucb9,None,https://www.reddit.com/r/Fitness/comments/8xucb9/stalled_ohp_not_sure_what_to_do/,0,38,1531264617.0
[Form Check] Weighted assisted Chin-up 45lbs x8,2c8keh,Dmainie,https://www.reddit.com/r/Fitness/comments/2c8keh/form_check_weighted_assisted_chinup_45lbs_x8/,0,43,1406813908.0
"For those starting there weight loss journey, don't just do cardio.",29fc0r,Jason-Genova,https://www.reddit.com/r/Fitness/comments/29fc0r/for_those_starting_there_weight_loss_journey_dont/,0,30,1404081237.0
I'm 21 and want to start working out. I know absolutely nothing and would love some help.,1t1ukt,Newbie568,https://www.reddit.com/r/Fitness/comments/1t1ukt/im_21_and_want_to_start_working_out_i_know/,0,12,1387241708.0
Should I increase or decrease my protein intake if I want to build muscle while losing fat?,16fug1,ultranumb_360,https://www.reddit.com/r/Fitness/comments/16fug1/should_i_increase_or_decrease_my_protein_intake/,2,23,1358006192.0
"My mom has worked really hard on a grant proposal for her business (a health club), which has been hit hard by the recession, but she needs 250 votes to be eligible. Can you help?  ",vspm2,hyperside89,https://www.reddit.com/r/Fitness/comments/vspm2/my_mom_has_worked_really_hard_on_a_grant_proposal/,30,29,1340982041.0
"I'm what you would call a curlbro, AMA.",dz13m,tempaccnt10,https://www.reddit.com/r/Fitness/comments/dz13m/im_what_you_would_call_a_curlbro_ama/,0,27,1288521697.0
"My mom is developing a form of sparring equipment, to combat childhood obesity.  If you like it, contribute!",10y9rg,MacXTag,https://www.reddit.com/r/Fitness/comments/10y9rg/my_mom_is_developing_a_form_of_sparring_equipment/,5,15,1349378724.0
For all the female fitness gurus out their.  Can I ask a question...,10i5jn,SerialRappist,https://www.reddit.com/r/Fitness/comments/10i5jn/for_all_the_female_fitness_gurus_out_their_can_i/,8,46,1348664186.0
"""I won 6 Mr Olympia titles and I didn't do a single free-weight squat"" - Dorian Yates [around 6:00 mark] - [13:07] (xpost from /r/bodybuilding)",1f73hq,OsiemPiec,https://www.reddit.com/r/Fitness/comments/1f73hq/i_won_6_mr_olympia_titles_and_i_didnt_do_a_single/,5,36,1369746612.0
Fittit: I curl in the squat rack. AMA. ,d8w5r,beacon_,https://www.reddit.com/r/Fitness/comments/d8w5r/fittit_i_curl_in_the_squat_rack_ama/,23,197,1283466102.0
Self-Promotion Saturday,4i9glm,AutoModerator,https://www.reddit.com/r/Fitness/comments/4i9glm/selfpromotion_saturday/,3,40,1462615350.0
Diet Coke - why is it unhealthy?,3lfg4q,None,https://www.reddit.com/r/Fitness/comments/3lfg4q/diet_coke_why_is_it_unhealthy/,0,67,1442581986.0
My 7 month progress! tell me what you think.,1sswer,None,https://www.reddit.com/r/Fitness/comments/1sswer/my_7_month_progress_tell_me_what_you_think/,0,41,1386951147.0
"Can we get ""Moronic Monday - Your weekly stupid question thread"" back? ",scfh9,officerha,https://www.reddit.com/r/Fitness/comments/scfh9/can_we_get_moronic_monday_your_weekly_stupid/,4,21,1334587517.0
"If I'm a MTF trans girl, is a bikini body achievable?",2s6wd6,None,https://www.reddit.com/r/Fitness/comments/2s6wd6/if_im_a_mtf_trans_girl_is_a_bikini_body_achievable/,45,86,1421088774.0
Poll shows fit men subject to negative stereotypes from the opposite sex,2fuj20,None,https://www.reddit.com/r/Fitness/comments/2fuj20/poll_shows_fit_men_subject_to_negative/,109,301,1410213142.0
Girls of r/Fitness I'm just wondering if..,3ad8t1,GymTanLoiter,https://www.reddit.com/r/Fitness/comments/3ad8t1/girls_of_rfitness_im_just_wondering_if/,16,81,1434687096.0
Yoga for people that hate hippies,2fm5ct,brain739,https://www.reddit.com/r/Fitness/comments/2fm5ct/yoga_for_people_that_hate_hippies/,4,17,1409979198.0
Anyone ever have a drip of whatever you are drinking from your shaker cup drip from the lid cover right into your eye?,20sxky,None,https://www.reddit.com/r/Fitness/comments/20sxky/anyone_ever_have_a_drip_of_whatever_you_are/,0,8,1395229418.0
Looking for the best way to get definition in my arms and chest,zg1de,WaKa_,https://www.reddit.com/r/Fitness/comments/zg1de/looking_for_the_best_way_to_get_definition_in_my/,2,20,1346931649.0
Karma whoring for 200. Courage Panda.,dxv0t,SergeiGolos,http://i.imgur.com/fn3tj.jpg,0,4,1288293335.0
Want muscle?  Stop The guessing game,9dd7x,44magnum,http://www.bottomlinefitness.com/2009/08/23/want-muscle-stop-the-quessing-game/,0,28,1251055263.0
Flexing session,1m0xnz,jksdvb8,https://www.reddit.com/r/Fitness/comments/1m0xnz/flexing_session/,17,28,1378722153.0
Weirdo at my gym...,mmi45,oustej,https://www.reddit.com/r/Fitness/comments/mmi45/weirdo_at_my_gym/,65,64,1322033228.0
Another Fittit success story!,gnh3f,fartcityallstars,http://i.imgur.com/7EdG6.png,22,31,1302538142.0
"Do you really have to walk 10,000 steps a day?",c45ixz,None,https://www.reddit.com/r/Fitness/comments/c45ixz/do_you_really_have_to_walk_10000_steps_a_day/,0,44,1561300193.0
The Periodic Table of Bodyweight Exercises,1dvbkt,Thevolkinator,https://www.reddit.com/r/Fitness/comments/1dvbkt/the_periodic_table_of_bodyweight_exercises/,3,10,1367944221.0
"Squats, even performed with strict form, cause stress fractures.",lxpwu,garth_vader79,https://www.reddit.com/r/Fitness/comments/lxpwu/squats_even_performed_with_strict_form_cause/,1,30,1320245215.0
"People who workout with 3+ people, I despise you",if13i,None,https://www.reddit.com/r/Fitness/comments/if13i/people_who_workout_with_3_people_i_despise_you/,0,40,1309621047.0
r/Fitness why do you hate us so much? ,m13vd,fitter_than_you,https://www.reddit.com/r/Fitness/comments/m13vd/rfitness_why_do_you_hate_us_so_much/,284,252,1320465789.0
My GF just found out she's at 40% body fat. We really need your help!,1govfd,weRborg,https://www.reddit.com/r/Fitness/comments/1govfd/my_gf_just_found_out_shes_at_40_body_fat_we/,9,123,1371684423.0
"Why you should leave your ""Globo Gym"".",18t97h,None,https://www.reddit.com/r/Fitness/comments/18t97h/why_you_should_leave_your_globo_gym/,16,79,1361270704.0
Why is the Jackson/Pollock 3 Caliper Method so wrong?,t5vexd,cardtrees4,https://www.reddit.com/r/Fitness/comments/t5vexd/why_is_the_jacksonpollock_3_caliper_method_so/,1,10,1646324926.0
Get gains without proper nutrition?,8jamoz,chichilover,https://www.reddit.com/r/Fitness/comments/8jamoz/get_gains_without_proper_nutrition/,0,19,1526285614.0
Lifting doesn't feel the same anymore.,8bujx3,realitycompl3x,https://www.reddit.com/r/Fitness/comments/8bujx3/lifting_doesnt_feel_the_same_anymore/,1,28,1523574397.0
Way too complicated...,6srwty,JR6857,https://www.reddit.com/r/Fitness/comments/6srwty/way_too_complicated/,2,43,1502352512.0
4Weeks2Shred Results 25/M,4pgzo3,Latapoxy,https://www.reddit.com/r/Fitness/comments/4pgzo3/4weeks2shred_results_25m/,0,18,1466692015.0
Do NOT underestimate the importance of sleep,3c1btr,None,https://www.reddit.com/r/Fitness/comments/3c1btr/do_not_underestimate_the_importance_of_sleep/,0,14,1435958397.0
30 min Workouts: Jillian's Ripped in 30 or Focus T25? Which one will get people in better shape?,34ndrk,redditnicole,https://www.reddit.com/r/Fitness/comments/34ndrk/30_min_workouts_jillians_ripped_in_30_or_focus/,0,8,1430594147.0
Help a skinny guy out!,33t7e2,mistaknomore,https://www.reddit.com/r/Fitness/comments/33t7e2/help_a_skinny_guy_out/,0,10,1429961648.0
Is r/Fitness in denial about calories in calories out?,333z5b,Hmmmmaybenot,https://www.reddit.com/r/Fitness/comments/333z5b/is_rfitness_in_denial_about_calories_in_calories/,0,28,1429431661.0
New Broscience: How to Fix Injuries and Imbalances,32hlu5,DetGordon,https://www.reddit.com/r/Fitness/comments/32hlu5/new_broscience_how_to_fix_injuries_and_imbalances/,0,1,1428960807.0
PSA: if you are doing leg raises for abs and feel a slightly pain in your lower back sont forget to place your hands besides your hips,2p61i3,ramatopia,https://www.reddit.com/r/Fitness/comments/2p61i3/psa_if_you_are_doing_leg_raises_for_abs_and_feel/,2,13,1418472253.0
People question my manhood when I refuse to drink alcohol,2eq9g8,2pacoclock,https://www.reddit.com/r/Fitness/comments/2eq9g8/people_question_my_manhood_when_i_refuse_to_drink/,2,40,1409151044.0
Girlfriend's getting a little plump...,1yems7,duders93,https://www.reddit.com/r/Fitness/comments/1yems7/girlfriends_getting_a_little_plump/,0,27,1392865275.0
In 1 year I achieved my weight goal...,151x2i,None,https://www.reddit.com/r/Fitness/comments/151x2i/in_1_year_i_achieved_my_weight_goal/,0,15,1355842133.0
I Finally Did It!!,tvmhc,treeliver2,https://www.reddit.com/r/Fitness/comments/tvmhc/i_finally_did_it/,1,5,1337488420.0
Does ohp count for the 1000 club?,2phaqz,FrujuJackers,https://www.reddit.com/r/Fitness/comments/2phaqz/does_ohp_count_for_the_1000_club/,6,31,1418747350.0
"If you come to r/fitness looking for advice or feedback, don't get your undergarments all in a bunch when the response you get isn't what you expected. ",j3bs3,RedAnarchist,https://www.reddit.com/r/Fitness/comments/j3bs3/if_you_come_to_rfitness_looking_for_advice_or/,126,260,1311956581.0
My Anti-Rippetoe Write-up and Experience,2647k7,weightgain,https://www.reddit.com/r/Fitness/comments/2647k7/my_antirippetoe_writeup_and_experience/,0,171,1400678077.0
"I'm tired of being dismissed because i'm younger and therefore ""higher metabolism"" etc",qnzkg,switzerland,https://www.reddit.com/r/Fitness/comments/qnzkg/im_tired_of_being_dismissed_because_im_younger/,7,24,1331246705.0
"1 Year Progress. (Male, Age 19-20, Natural)",7xgslp,Daddy_Patty,https://www.reddit.com/r/Fitness/comments/7xgslp/1_year_progress_male_age_1920_natural/,8,36,1518599310.0
A gay guy (M18) told me(M18) I have no ass today.,3q7zv5,pm_me_nsfw_selfies_,https://www.reddit.com/r/Fitness/comments/3q7zv5/a_gay_guy_m18_told_mem18_i_have_no_ass_today/,6,23,1445822494.0
Cycling for Reddit: Will bike 2 miles for every upvote.,idf2f,CycleStache,https://www.reddit.com/r/Fitness/comments/idf2f/cycling_for_reddit_will_bike_2_miles_for_every/,0,23,1309454630.0
People asking legit questions on this subreddit are often downvoted a lot. I think some of you are beginning to live up to that douchey stereotype weightlifters sometimes have.,hohcv,backpackwayne,https://www.reddit.com/r/Fitness/comments/hohcv/people_asking_legit_questions_on_this_subreddit/,13,73,1306872230.0
The hardest part of getting to the gym is not taking a nap instead,3p8mp2,dino_td,https://www.reddit.com/r/Fitness/comments/3p8mp2/the_hardest_part_of_getting_to_the_gym_is_not/,0,9,1445184487.0
"These foods are Natural, but they're still packed with sugar: my analysis on the nutritional profiles of award-winning natural foods",3au777,stat_schwartz,https://www.reddit.com/r/Fitness/comments/3au777/these_foods_are_natural_but_theyre_still_packed/,3,23,1435073018.0
Am I gaining weight wrong?,2jili8,AlexiPwns,https://www.reddit.com/r/Fitness/comments/2jili8/am_i_gaining_weight_wrong/,0,49,1413553837.0
"For all you body builders out there on a strict diet regimen, how can I cut fat, and fast?",2f8st8,Calking2009,https://www.reddit.com/r/Fitness/comments/2f8st8/for_all_you_body_builders_out_there_on_a_strict/,1,10,1409648392.0
Teenager who needs to be able to do ten push-ups by Tuesday. Looking for advice.,1lhewo,Pushupkid,https://www.reddit.com/r/Fitness/comments/1lhewo/teenager_who_needs_to_be_able_to_do_ten_pushups/,0,36,1377985367.0
Does anyone else drive a manual vehicle?,k9jnb,mmnp,https://www.reddit.com/r/Fitness/comments/k9jnb/does_anyone_else_drive_a_manual_vehicle/,0,18,1315533754.0
"Age 21M, TDEE of 1900. How screwed am I?",4jfcs0,y08hci0299,https://www.reddit.com/r/Fitness/comments/4jfcs0/age_21m_tdee_of_1900_how_screwed_am_i/,0,13,1463302629.0
How many calories did you eat this Christmas and how are you going to make up for it?,3y6t2z,ErikAoki,https://www.reddit.com/r/Fitness/comments/3y6t2z/how_many_calories_did_you_eat_this_christmas_and/,0,46,1451057897.0
How important is nutrition to building muscle mass?,3txyw9,None,https://www.reddit.com/r/Fitness/comments/3txyw9/how_important_is_nutrition_to_building_muscle_mass/,1,15,1448287821.0
Am I Douche for Wearing Scrubs When Working Out,3sdr44,None,https://www.reddit.com/r/Fitness/comments/3sdr44/am_i_douche_for_wearing_scrubs_when_working_out/,1,45,1447225883.0
How is it that very strong NBA players like LeBron don't look that buff?,3mlnbi,alphadog3939,https://www.reddit.com/r/Fitness/comments/3mlnbi/how_is_it_that_very_strong_nba_players_like/,0,22,1443377374.0
How do people do this?,2ipijb,None,https://www.reddit.com/r/Fitness/comments/2ipijb/how_do_people_do_this/,3,57,1412809992.0
Cdingo is sleeping in. Here is your Moronic Monday thread.,2eimyf,BruceLeeSaid,https://www.reddit.com/r/Fitness/comments/2eimyf/cdingo_is_sleeping_in_here_is_your_moronic_monday/,6,83,1408960496.0
How can I transform myself into the top 10% of people as far as fitness?,285arf,WhispererInDarkness,https://www.reddit.com/r/Fitness/comments/285arf/how_can_i_transform_myself_into_the_top_10_of/,4,42,1402770539.0
Possible to get in shape in 4 months?,14iyeg,nelsam95,https://www.reddit.com/r/Fitness/comments/14iyeg/possible_to_get_in_shape_in_4_months/,3,32,1355017139.0
"""Don't skip leg day"" they say. I already have huge legs. What should I do on leg day?",9t29v0,TheConeIsReturned,https://www.reddit.com/r/Fitness/comments/9t29v0/dont_skip_leg_day_they_say_i_already_have_huge/,4,52,1541015826.0
"Hi r/Fitness, I'm an obese Highschooler trying to change my life.",32selg,Bulrushes,https://www.reddit.com/r/Fitness/comments/32selg/hi_rfitness_im_an_obese_highschooler_trying_to/,1,20,1429177632.0
There was a shooting at the gym I workout at. Please send your prayers to the members and the families of the lost ones.,22y73n,gabeg10,https://www.reddit.com/r/Fitness/comments/22y73n/there_was_a_shooting_at_the_gym_i_workout_at/,2,6,1397422720.0
Family Staged Intervention Protesting My Gym And Eating Habits Despite Me Being A Healthy Height and Not Overdoing Myself At The Gym (rant),1uc9sn,Infinitemistress,https://www.reddit.com/r/Fitness/comments/1uc9sn/family_staged_intervention_protesting_my_gym_and/,0,46,1388784314.0
[m] 3 Year Transformation,1k4oow,imfitnesschallengeme,https://www.reddit.com/r/Fitness/comments/1k4oow/m_3_year_transformation/,0,17,1376197304.0
Why the hate? It's getting people to exercise!! [x-post from r/crossfit],1gk41e,fifteenkinds,https://www.reddit.com/r/Fitness/comments/1gk41e/why_the_hate_its_getting_people_to_exercise_xpost/,5,78,1371520930.0
Bane...fuck Bane...not literally though,x6cf3,None,https://www.reddit.com/r/Fitness/comments/x6cf3/banefuck_banenot_literally_though/,0,6,1343281127.0
How do I prevent my arms from getting bigger? (F16),a5t12p,alexzoeymarlenbonnie,https://www.reddit.com/r/Fitness/comments/a5t12p/how_do_i_prevent_my_arms_from_getting_bigger_f16/,0,61,1544703724.0
Getting laid tonight,1plsg4,monkeymugshot,https://www.reddit.com/r/Fitness/comments/1plsg4/getting_laid_tonight/,0,13,1383213237.0
Why You'd Probably Suck Less If You Deadlifted,25d3uu,drdeadlift800,https://www.reddit.com/r/Fitness/comments/25d3uu/why_youd_probably_suck_less_if_you_deadlifted/,0,9,1399907431.0
Has anyone here shat themselves doing deadlifts?,1vnzxz,Boredassstudent,https://www.reddit.com/r/Fitness/comments/1vnzxz/has_anyone_here_shat_themselves_doing_deadlifts/,0,28,1390219048.0
Apparently /r/loseit has become /r/bodyacceptance...,1963qm,TheFatFuck,https://www.reddit.com/r/Fitness/comments/1963qm/apparently_rloseit_has_become_rbodyacceptance/,0,14,1361761184.0
How do I work a barbell? ,18v20c,Omgshinyobject,https://www.reddit.com/r/Fitness/comments/18v20c/how_do_i_work_a_barbell/,0,38,1361329393.0
Made it through my first day of P90x,16l1ik,CynicalAssassin,https://www.reddit.com/r/Fitness/comments/16l1ik/made_it_through_my_first_day_of_p90x/,3,34,1358208853.0
"Alright, Livestrong officially is a piece of crap",xy9cn,dbag127,https://www.reddit.com/r/Fitness/comments/xy9cn/alright_livestrong_officially_is_a_piece_of_crap/,4,52,1344536489.0
Why CrossFit isn't for Athletes. ,epxz8,eric_twinge,http://dangerouslyhardcore.com/636/go-crossfit/,3,48,1293034731.0
Why I am no longer a YMCA member,clhfc,angryboy,https://www.reddit.com/r/Fitness/comments/clhfc/why_i_am_no_longer_a_ymca_member/,0,68,1278114813.0
"My LSD experience, and the epiphany I had about our body and fitness.",1d0977,I_Am_Vladimir_Putin,https://www.reddit.com/r/Fitness/comments/1d0977/my_lsd_experience_and_the_epiphany_i_had_about/,127,221,1366808935.0
Just in case you forget your gym bag and only have a Dollar Store nearby...,3lgu50,itshercule,https://www.reddit.com/r/Fitness/comments/3lgu50/just_in_case_you_forget_your_gym_bag_and_only/,8,35,1442602873.0
"""The Last Conversation You’ll Ever Need to Have About Eating Right""",86af4v,aboustayyef,https://www.reddit.com/r/Fitness/comments/86af4v/the_last_conversation_youll_ever_need_to_have/,5,51,1521713792.0
I did 3x5 press with the bar today!,rqjwo,molliemander05,https://www.reddit.com/r/Fitness/comments/rqjwo/i_did_3x5_press_with_the_bar_today/,11,29,1333419753.0
"""The most common misconception about fat people... [is] that they overeat and that's why they're obese.""",17lo1w,GeoM56,https://www.reddit.com/r/Fitness/comments/17lo1w/the_most_common_misconception_about_fat_people_is/,16,172,1359597304.0
"I call this ""bodybuilder pizza"" and it is easy and delicious.",o728e,adam6923,https://www.reddit.com/r/Fitness/comments/o728e/i_call_this_bodybuilder_pizza_and_it_is_easy_and/,18,48,1325967792.0
Does anybody else do this at their gym?,g6hrc,motfok,http://imgur.com/9JuxW,267,134,1300462681.0
Help. How many Km/hours of Cycling Per Day Do I need For Healthy Heart?,g9vbfw,csprogpy,https://www.reddit.com/r/Fitness/comments/g9vbfw/help_how_many_kmhours_of_cycling_per_day_do_i/,0,14,1588107000.0
Losing “gains”,fzlqc1,metrozoominz,https://www.reddit.com/r/Fitness/comments/fzlqc1/losing_gains/,0,16,1586648586.0
"Been bulking for months without issue, but I just gained noticeable fat out of the blue.",ap48si,BentPuka,https://www.reddit.com/r/Fitness/comments/ap48si/been_bulking_for_months_without_issue_but_i_just/,0,13,1549808214.0
Has anyone followed the “Man of Steel” diet and workout routine Henry Cavill used to bulk up?,9ncq9q,NordWitcher,https://www.reddit.com/r/Fitness/comments/9ncq9q/has_anyone_followed_the_man_of_steel_diet_and/,0,26,1539283796.0
Changed my protein now I'm not sore.,7gfkyq,glowinthedark,https://www.reddit.com/r/Fitness/comments/7gfkyq/changed_my_protein_now_im_not_sore/,0,19,1511981223.0
Self-Promotion Saturday,6w4sbv,AutoModerator,https://www.reddit.com/r/Fitness/comments/6w4sbv/selfpromotion_saturday/,1,35,1503741928.0
Fellow lifters! Would you please put your weights and especially dumbbells back on the racks.,4k1o42,SilverWolf9300,https://www.reddit.com/r/Fitness/comments/4k1o42/fellow_lifters_would_you_please_put_your_weights/,0,5,1463650190.0
Is the 1k club possible for someone like me?,4egyci,None,https://www.reddit.com/r/Fitness/comments/4egyci/is_the_1k_club_possible_for_someone_like_me/,0,44,1460479567.0
Is it possible to lose 40ish pounds by may?,44rchg,Foureyeschan,https://www.reddit.com/r/Fitness/comments/44rchg/is_it_possible_to_lose_40ish_pounds_by_may/,0,44,1454944975.0
Why does it seem that the people most obsessed with deadlifts at the gym are the most out of shape?,3qxx7t,None,https://www.reddit.com/r/Fitness/comments/3qxx7t/why_does_it_seem_that_the_people_most_obsessed/,2,14,1446275485.0
Keep Everything in Moderation,3gvvxh,Thats_Justice,https://www.reddit.com/r/Fitness/comments/3gvvxh/keep_everything_in_moderation/,0,6,1439493934.0
So my grandpa just promised me if I lose 60lbs 1 year from now he will...,2ljrex,jokore,https://www.reddit.com/r/Fitness/comments/2ljrex/so_my_grandpa_just_promised_me_if_i_lose_60lbs_1/,0,55,1415333508.0
Grip strength like Chuck Norris..,1ky144,Xeppen,https://www.reddit.com/r/Fitness/comments/1ky144/grip_strength_like_chuck_norris/,0,12,1377269595.0
Started Rehab after shoulder surgery,1ko2tf,Thorse,https://www.reddit.com/r/Fitness/comments/1ko2tf/started_rehab_after_shoulder_surgery/,0,11,1376923766.0
This is the max ripped (6% bf) and max LBM you can possibly obtain naturally (X-post /r/gainit).,1jbims,kimcheekumquat,https://www.reddit.com/r/Fitness/comments/1jbims/this_is_the_max_ripped_6_bf_and_max_lbm_you_can/,2,20,1375149130.0
Can you get fat with a calorie surplus while on Atkins?,13u3pe,Artivist,https://www.reddit.com/r/Fitness/comments/13u3pe/can_you_get_fat_with_a_calorie_surplus_while_on/,0,49,1353968228.0
"Dear Nike, make this shirt for men. Thanks.",usjbj,Mr_Pickle,https://www.reddit.com/r/Fitness/comments/usjbj/dear_nike_make_this_shirt_for_men_thanks/,1,8,1339205586.0
Some genuine tips on reducing belly fat,cwjxm,MaxCorbin,http://www.iblogfitness.com/reducing-your-belly-fat/,0,19,1280781860.0
How can I increase my height?,cgu5v,shortpaki,https://www.reddit.com/r/Fitness/comments/cgu5v/how_can_i_increase_my_height/,2,21,1276980468.0
