Title,ID,Author,URL,Score,Comment Count,Created
"FAQ ""Myth: My metabolism is higher/lower/different than other people"" is misleading.",1osf1y,dark567,https://www.reddit.com/r/Fitness/comments/1osf1y/faq_myth_my_metabolism_is_higherlowerdifferent/,0,48,1382207530.0
A list with over 100 exercises and how many calories you can burn with them per hour in order to destroy unlimited amounts of fat!,1ge9c4,GeorgeConte,https://www.reddit.com/r/Fitness/comments/1ge9c4/a_list_with_over_100_exercises_and_how_many/,0,14,1371296520.0
Why do no fast food chains have no regard for us fitness junkies?,1ash23,None,https://www.reddit.com/r/Fitness/comments/1ash23/why_do_no_fast_food_chains_have_no_regard_for_us/,0,72,1363943673.0
Newest motivational addition to my temple (X-Post from r/swoleacceptance),15myqe,realmccoy_ucf,https://www.reddit.com/r/Fitness/comments/15myqe/newest_motivational_addition_to_my_temple_xpost/,0,6,1356812148.0
I have just had a five day gap from the gym. Will it have made a big impact?,116tfv,notsopro,https://www.reddit.com/r/Fitness/comments/116tfv/i_have_just_had_a_five_day_gap_from_the_gym_will/,0,15,1349776339.0
"Sites like Reddit, not doctors, hold the answers to obesity",y1uka,dicktalens,https://www.reddit.com/r/Fitness/comments/y1uka/sites_like_reddit_not_doctors_hold_the_answers_to/,0,0,1344700420.0
"Need some help. I'm a thirty year old female, and I used to be over weight. You guys will hate this-I'm a vegetarian, and over the past year I've been doing my own patchwork program. I've read the FAQ, and I still have no idea what I'm doing. NSFWish pics inside. ",vju5b,Evil_ash,https://www.reddit.com/r/Fitness/comments/vju5b/need_some_help_im_a_thirty_year_old_female_and_i/,1,48,1340589726.0
Intredasting....,t3chy,finkicare,https://www.reddit.com/r/Fitness/comments/t3chy/intredasting/,0,17,1335971008.0
DIY Dumbell Project,qqh3f,None,https://www.reddit.com/r/Fitness/comments/qqh3f/diy_dumbell_project/,3,25,1331402803.0
"Mark Rippetoe on ""Core"" Stability ""Training"". ",nvaiu,moses_the_red,https://www.reddit.com/r/Fitness/comments/nvaiu/mark_rippetoe_on_core_stability_training/,1,21,1325192046.0
How to get muscles like Wolverine’s on a vegan diet ,dx99m,None,http://www.healthzone.ca/health/dietfitness/diet/article/881430--how-to-get-muscles-like-wolverine-s-on-a-vegan-diet,0,25,1288199167.0
The 50 very unlikely - but medically proven - diet tips,cpelm,Danarky,http://www.dailymail.co.uk/health/article-1294170/How-laugh-slim-The-50-unlikely--medically-proven--diet-tips.html,2,21,1279102756.0
More is only better when it comes to sex or money,9li9f,44magnum,http://www.bottomlinefitness.com/2009/09/17/more-is-only-better-when-it-comes-to-sex-and-money/,0,5,1253199826.0
MightyTrainer - Which Lifter Will Survive the Zombie Apocalypse?,151yjp,AhmedF,https://www.reddit.com/r/Fitness/comments/151yjp/mightytrainer_which_lifter_will_survive_the/,16,29,1355844048.0
What weight do you need to lift to be classed as strong?,3tyjnm,Capri-Tsun,https://www.reddit.com/r/Fitness/comments/3tyjnm/what_weight_do_you_need_to_lift_to_be_classed_as/,10,110,1448297326.0
Got told today that I'm squatting to much for a girl...,3a7pvf,ialmostwon,https://www.reddit.com/r/Fitness/comments/3a7pvf/got_told_today_that_im_squatting_to_much_for_a/,37,246,1434577884.0
"You asked, we delivered: if you help sign up gyms on Gymsurfing, we will pay you, and you can help people book gym passes for as low as $5",27b42m,kevinbracken,https://www.reddit.com/r/Fitness/comments/27b42m/you_asked_we_delivered_if_you_help_sign_up_gyms/,114,74,1401903971.0
Strategies For Achieving 10% Body Fat and Pushing Through a Plateau,tf0rpt,Bonzai_Monkey,https://www.reddit.com/r/Fitness/comments/tf0rpt/strategies_for_achieving_10_body_fat_and_pushing/,0,108,1647379489.0
A guy from my gym just sent this to me. As a girl I hate this kind of mentality! (picture),zcrt2,raacchel,https://www.reddit.com/r/Fitness/comments/zcrt2/a_guy_from_my_gym_just_sent_this_to_me_as_a_girl/,77,247,1346791496.0
Is this anyone else's favorite subreddit? Seems I spend most of my time here....,rjisa,bullbear420,https://www.reddit.com/r/Fitness/comments/rjisa/is_this_anyone_elses_favorite_subreddit_seems_i/,63,55,1333042549.0
"Dear skinny people: When I say I'm trying to lose weight, DON'T ever respond by saying  something like ""Yeah, I can eat whatever I want and never get fat.""",i9229,None,https://www.reddit.com/r/Fitness/comments/i9229/dear_skinny_people_when_i_say_im_trying_to_lose/,474,368,1309028126.0
"I'm transgender, (Female-to-Male) and having trouble switching my diet and exercise from women's to men's. Could use some guidance.",ui4tz,Migrane_Eyes,https://www.reddit.com/r/Fitness/comments/ui4tz/im_transgender_femaletomale_and_having_trouble/,36,49,1338695049.0
One of the best transformations I've seen [x-post from r/Paleo],n8j44,Eskoe,https://www.reddit.com/r/Fitness/comments/n8j44/one_of_the_best_transformations_ive_seen_xpost/,21,44,1323619975.0
"Fittit, it is Sunday. Tell us your Victory this week.",ldwb9,real_menuitem,https://www.reddit.com/r/Fitness/comments/ldwb9/fittit_it_is_sunday_tell_us_your_victory_this_week/,4,9,1318747230.0
Car buffer vs jigsaw,f3prkm,Bujwua,https://www.reddit.com/r/Fitness/comments/f3prkm/car_buffer_vs_jigsaw/,2,37,1581672019.0
"I'm skipping one night of sleep every week purposely, are there any negative effects to that, which I should know?",64hu0j,jobboyjob,https://www.reddit.com/r/Fitness/comments/64hu0j/im_skipping_one_night_of_sleep_every_week/,5,27,1491802829.0
Former D3 Defensive end here. After my mother passed away in 2011 from a terminal illness I became depressed and reclusive. I went from being super fit happy and healthy 220lbs 6'1 to 250 over the course of four years.,3d9ra8,ZTrain90,https://www.reddit.com/r/Fitness/comments/3d9ra8/former_d3_defensive_end_here_after_my_mother/,5,17,1436891925.0
"Ever since I went on a diet, it dramatically changed my relationship with food. I've learned to respect what's on my plate by eating with mindfulness and savoring every morsel rather than mindlessly shoveling food in my mouth.",1lktle,Antranik,https://www.reddit.com/r/Fitness/comments/1lktle/ever_since_i_went_on_a_diet_it_dramatically/,5,11,1378132703.0
Potentially stupid jump rope question--please be gentle!,12g6y5,None,https://www.reddit.com/r/Fitness/comments/12g6y5/potentially_stupid_jump_rope_questionplease_be/,0,226,1351759224.0
FINALLY got my copy of Starting Strength,lywm3,None,https://www.reddit.com/r/Fitness/comments/lywm3/finally_got_my_copy_of_starting_strength/,4,19,1320323658.0
How do I convince my brother to train his legs?,29qur8,De_Lille_D2,https://www.reddit.com/r/Fitness/comments/29qur8/how_do_i_convince_my_brother_to_train_his_legs/,34,119,1404400205.0
Does delaying water until after cardio help your endurance?,86w78k,eehoe,https://www.reddit.com/r/Fitness/comments/86w78k/does_delaying_water_until_after_cardio_help_your/,30,42,1521927453.0
When to increase weights?,slf0o,kojak488,https://www.reddit.com/r/Fitness/comments/slf0o/when_to_increase_weights/,0,80,1335026805.0
Request for Today's Mark Rippetoe AMA-,n11wo,steelerman82,https://www.reddit.com/r/Fitness/comments/n11wo/request_for_todays_mark_rippetoe_ama/,9,37,1323089683.0
The perils of exercising outside,gdy34,None,https://www.reddit.com/r/Fitness/comments/gdy34/the_perils_of_exercising_outside/,89,324,1301408974.0
Out of shape personal trainers really piss me off. ,vrqf0,cttouch,https://www.reddit.com/r/Fitness/comments/vrqf0/out_of_shape_personal_trainers_really_piss_me_off/,71,150,1340929607.0
Any tips or tricks for a guy starting his fitness journey?,3aflm6,jewbagel005,https://www.reddit.com/r/Fitness/comments/3aflm6/any_tips_or_tricks_for_a_guy_starting_his_fitness/,5,21,1434740577.0
"Just out of a 3 year relationship, would appreciate some tips on how to lose weight for a redditor whose feeling pretty down",w6awy,Needsallthehelp,https://www.reddit.com/r/Fitness/comments/w6awy/just_out_of_a_3_year_relationship_would/,8,56,1341660309.0
I did it Fittit. I successfully biked the Boston Marathon.,sc6el,heyitztimmeh,https://www.reddit.com/r/Fitness/comments/sc6el/i_did_it_fittit_i_successfully_biked_the_boston/,9,13,1334569752.0
What things annoy you at the gym?,v5csv,dickermp,https://www.reddit.com/r/Fitness/comments/v5csv/what_things_annoy_you_at_the_gym/,19,268,1339874449.0
Why isn't fitness equipment designed more like arcade games?,145u1k,justalawstudent,https://www.reddit.com/r/Fitness/comments/145u1k/why_isnt_fitness_equipment_designed_more_like/,5,34,1354476530.0
"Creatine- Is it good for cutting down, or just bulking?",13axig,None,https://www.reddit.com/r/Fitness/comments/13axig/creatine_is_it_good_for_cutting_down_or_just/,3,20,1353082494.0
I hate this...,et67q,Loch_ness,http://i.imgur.com/g5GpV.jpg,0,12,1293643745.0
"If you don't re-rack your weights at the gym, I hate you.",ckhxj,werdage,https://www.reddit.com/r/Fitness/comments/ckhxj/if_you_dont_rerack_your_weights_at_the_gym_i_hate/,2,9,1277895508.0
Malcolm Gladwell on Low Carb Diets.,cjnf6,None,http://feedproxy.google.com/~r/Leangains/~3/LU0c1cQiA_I/malcolm-gladwell-on-low-carb-diets.html,3,10,1277681569.0
"How do I lose a beer belly without quitting delicious, delicious beer?",3m6n54,LordHuntyboad,https://www.reddit.com/r/Fitness/comments/3m6n54/how_do_i_lose_a_beer_belly_without_quitting/,4,55,1443091296.0
How to stop making pooping faces?,3bdzfd,impracticalIdeas,https://www.reddit.com/r/Fitness/comments/3bdzfd/how_to_stop_making_pooping_faces/,1,27,1435482615.0
Rude Personal Trainer ?,1vip4l,idwaltz,https://www.reddit.com/r/Fitness/comments/1vip4l/rude_personal_trainer/,5,19,1390047311.0
"Don't feel my ab workout the next days, normal?",1vobb7,sueshishi,https://www.reddit.com/r/Fitness/comments/1vobb7/dont_feel_my_ab_workout_the_next_days_normal/,4,27,1390230844.0
"Fat is officially incurable according to ""science""",w4i8t,SilentLettersSuck,https://www.reddit.com/r/Fitness/comments/w4i8t/fat_is_officially_incurable_according_to_science/,26,115,1341574963.0
"Today I found out I'm generally very weak, despite thinking otherwise for years",pi7cv,slazar4,https://www.reddit.com/r/Fitness/comments/pi7cv/today_i_found_out_im_generally_very_weak_despite/,25,110,1328817113.0
Coldness may burn fat,1hkgp0,match369,https://www.reddit.com/r/Fitness/comments/1hkgp0/coldness_may_burn_fat/,10,43,1372861639.0
How to accomodate insanity with other sports,ggjhv6,ToineMP,https://www.reddit.com/r/Fitness/comments/ggjhv6/how_to_accomodate_insanity_with_other_sports/,1,14,1589044886.0
What's the best way to incorporate Olympic lifts in training for other sports to develop power?,ehnmuv,n00dl3boy,https://www.reddit.com/r/Fitness/comments/ehnmuv/whats_the_best_way_to_incorporate_olympic_lifts/,0,17,1577720871.0
Is it okay if my bench press is comparable to my deadlift?,e966a9,chatrishillnumberone,https://www.reddit.com/r/Fitness/comments/e966a9/is_it_okay_if_my_bench_press_is_comparable_to_my/,0,44,1576065409.0
Creating your own plan vs using a pre-made one.,duahlm,Farmerobot,https://www.reddit.com/r/Fitness/comments/duahlm/creating_your_own_plan_vs_using_a_premade_one/,0,15,1573386380.0
Is 10-11 hours enough as an intermittent fast?,dqkff3,NYCambition21,https://www.reddit.com/r/Fitness/comments/dqkff3/is_1011_hours_enough_as_an_intermittent_fast/,0,21,1572702655.0
"Doing a 10km (6 mile) run this weekend, but I am not a runner. Details inside.",chl2z8,UpSideSunny,https://www.reddit.com/r/Fitness/comments/chl2z8/doing_a_10km_6_mile_run_this_weekend_but_i_am_not/,1,35,1564044230.0
How much time is *too* much treadmill time?,afgm5s,TheFatalWound,https://www.reddit.com/r/Fitness/comments/afgm5s/how_much_time_is_too_much_treadmill_time/,1,29,1547360022.0
"How can i get all 250 grams of protein needed in my diet, without having constipation issues?",9delap,commandercody95,https://www.reddit.com/r/Fitness/comments/9delap/how_can_i_get_all_250_grams_of_protein_needed_in/,1,54,1536206675.0
"Is 10,000 steps a day enough exercise?",8chkrd,not_cinderella,https://www.reddit.com/r/Fitness/comments/8chkrd/is_10000_steps_a_day_enough_exercise/,0,11,1523820791.0
"After 5 months since my first workout ever, stuck at a plateau for 2 months. EXTREMELY FRUSTRATED",7n4fpj,-The_King_Of_Kings-,https://www.reddit.com/r/Fitness/comments/7n4fpj/after_5_months_since_my_first_workout_ever_stuck/,2,36,1514671684.0
WHY is it so hard to get proper squat form?,77iza3,mrfunbun,https://www.reddit.com/r/Fitness/comments/77iza3/why_is_it_so_hard_to_get_proper_squat_form/,0,22,1508463420.0
"Just read an article about how any reps over rep 6 is all ""slop"" to powerlifters?",76vmnf,DaMinchansta,https://www.reddit.com/r/Fitness/comments/76vmnf/just_read_an_article_about_how_any_reps_over_rep/,0,99,1508207688.0
Is middle-age belly inevitable?,4upf5u,DillonBeach,https://www.reddit.com/r/Fitness/comments/4upf5u/is_middleage_belly_inevitable/,1,20,1469549580.0
I dick around too much at the gym. How do I manage my time to fit under an hour and a half or less?,45fcmw,deletetemptemp,https://www.reddit.com/r/Fitness/comments/45fcmw/i_dick_around_too_much_at_the_gym_how_do_i_manage/,0,25,1455292631.0
Help a pothead out...,43rfoi,Duunadain,https://www.reddit.com/r/Fitness/comments/43rfoi/help_a_pothead_out/,0,45,1454370860.0
How long until people stop coming to the gym after New Years?,3z3kkw,_msavvy,https://www.reddit.com/r/Fitness/comments/3z3kkw/how_long_until_people_stop_coming_to_the_gym/,0,20,1451707043.0
Want your squat or deadlift form checked?,3o1xn5,Firecaller,https://www.reddit.com/r/Fitness/comments/3o1xn5/want_your_squat_or_deadlift_form_checked/,0,4,1444358236.0
Questions about excess skin.,3iywkj,Rounddance,https://www.reddit.com/r/Fitness/comments/3iywkj/questions_about_excess_skin/,0,28,1440952334.0
I[F22] have been working out for ~3 months and I'm not really seeing any progress. What am I doing wrong?,3ey46i,kittensbarnacle,https://www.reddit.com/r/Fitness/comments/3ey46i/if22_have_been_working_out_for_3_months_and_im/,0,19,1438117737.0
Is anyone here actually ripped?,35bkvu,NAZology,https://www.reddit.com/r/Fitness/comments/35bkvu/is_anyone_here_actually_ripped/,1,28,1431112501.0
On week 2 of 20 pullups and 100 pushups. Who wants to join me?,2aovyr,anotherbaldguy,https://www.reddit.com/r/Fitness/comments/2aovyr/on_week_2_of_20_pullups_and_100_pushups_who_wants/,1,7,1405364462.0
I'm having trouble eliminating excess belly flab,29je4r,mbtags,https://www.reddit.com/r/Fitness/comments/29je4r/im_having_trouble_eliminating_excess_belly_flab/,0,12,1404190354.0
"Bulked for 8 months, about to go on my first cut.",25s7c0,Mellur,https://www.reddit.com/r/Fitness/comments/25s7c0/bulked_for_8_months_about_to_go_on_my_first_cut/,3,9,1400321897.0
Hurting my back,250jp5,porcupinee,https://www.reddit.com/r/Fitness/comments/250jp5/hurting_my_back/,0,17,1399522005.0
I just started drinking whey and I have a couple questions,2416ai,Spyderbro,https://www.reddit.com/r/Fitness/comments/2416ai/i_just_started_drinking_whey_and_i_have_a_couple/,0,17,1398523203.0
Before and After pics + need a little advice,21iqzv,Avalonis,https://www.reddit.com/r/Fitness/comments/21iqzv/before_and_after_pics_need_a_little_advice/,0,21,1395941391.0
Too much protein?,1yzq0b,ErinGrey,https://www.reddit.com/r/Fitness/comments/1yzq0b/too_much_protein/,0,18,1393426367.0
Does anyone else here use group fitness classes as their primary form of exercise?,1y3dgf,None,https://www.reddit.com/r/Fitness/comments/1y3dgf/does_anyone_else_here_use_group_fitness_classes/,2,56,1392589846.0
First day at the gym in 4 years,1w1hzt,Grimmloch,https://www.reddit.com/r/Fitness/comments/1w1hzt/first_day_at_the_gym_in_4_years/,0,7,1390580890.0
Is being attractive to the opposite sex all about low body fat?,1rawq5,Fallingoutart,https://www.reddit.com/r/Fitness/comments/1rawq5/is_being_attractive_to_the_opposite_sex_all_about/,0,14,1385235602.0
How strong are you?,1ngu7e,breakingrobertsrules,https://www.reddit.com/r/Fitness/comments/1ngu7e/how_strong_are_you/,0,84,1380577627.0
Kind of shocked this was said to me. Caught me at a bad time and I'm very insulted.,1k9gzl,XXTannerDXX,https://www.reddit.com/r/Fitness/comments/1k9gzl/kind_of_shocked_this_was_said_to_me_caught_me_at/,1,35,1376374371.0
Fitness side effect? Can't touch my shoulder.,1k0ljc,lexreflex,https://www.reddit.com/r/Fitness/comments/1k0ljc/fitness_side_effect_cant_touch_my_shoulder/,0,50,1376039011.0
Whats the difference between eating 900 calories of junk food and 900 calories of vegetables or other recommended diet food low in fat sugar and such?,1ekab5,edtheoverlander,https://www.reddit.com/r/Fitness/comments/1ekab5/whats_the_difference_between_eating_900_calories/,0,44,1368853366.0
Are free weights better than resistance machines?,1dxe0d,None,https://www.reddit.com/r/Fitness/comments/1dxe0d/are_free_weights_better_than_resistance_machines/,0,44,1368014979.0
I just quit smoking today !!!,1dcx5v,emmalcolm,https://www.reddit.com/r/Fitness/comments/1dcx5v/i_just_quit_smoking_today/,0,13,1367265085.0
Does Creatine really cause hairloss? What other negative side effect is there?,139lzq,Art_of_Creation,https://www.reddit.com/r/Fitness/comments/139lzq/does_creatine_really_cause_hairloss_what_other/,0,12,1353021222.0
How I felt after trying out foam rolling for the first time,z5ul2,aliensheep,https://www.reddit.com/r/Fitness/comments/z5ul2/how_i_felt_after_trying_out_foam_rolling_for_the/,0,12,1346456939.0
My exact reaction waking up on squat day.  ,xi7iy,GoodLuckLetsFuck,https://www.reddit.com/r/Fitness/comments/xi7iy/my_exact_reaction_waking_up_on_squat_day/,1,11,1343829348.0
Why pull ups hit biceps more than chin ups.,t3m0f,Lindrian,https://www.reddit.com/r/Fitness/comments/t3m0f/why_pull_ups_hit_biceps_more_than_chin_ups/,0,34,1335981760.0
Just about to go jogging for the first time on my sparetime,swmly,None,https://www.reddit.com/r/Fitness/comments/swmly/just_about_to_go_jogging_for_the_first_time_on_my/,0,6,1335605572.0
"Eggs, every single day?",okjl2,None,https://www.reddit.com/r/Fitness/comments/okjl2/eggs_every_single_day/,0,39,1326782444.0
So what songs get you pumped to wanna work out?,nl5oc,Xavion_Zenovka,https://www.reddit.com/r/Fitness/comments/nl5oc/so_what_songs_get_you_pumped_to_wanna_work_out/,0,17,1324467239.0
It looks like I'm a very weak person. What supplements can I use before workout to boost my performance?,l97lx,None,https://www.reddit.com/r/Fitness/comments/l97lx/it_looks_like_im_a_very_weak_person_what/,1,29,1318394888.0
"How do you guys feel about Planet Fitness' ""Lunk Alarm"" ?",kho0f,None,https://www.reddit.com/r/Fitness/comments/kho0f/how_do_you_guys_feel_about_planet_fitness_lunk/,0,21,1316183967.0
How to get 19% stronger through proper hydration.,i4l0x,None,http://www.youtube.com/watch?v=XF620V-4L0Q,1,7,1308598363.0
TIL: Ghetto Workout's are intense!,i3l6c,None,http://www.youtube.com/watch?v=IvhjIKjBcJg&hd=1,0,3,1308494677.0
Deadlifted my bodyweight for the first time!,hy9h2,mackstann,http://i.imgur.com/gZq9o.png,0,11,1307940460.0
Shaming the obese - with photos like these ,fauoh,None,http://www.theglobeandmail.com/life/health/andre-picard/shaming-the-obese---with-photos-like-these---isnt-working/article1883947/,0,76,1296237139.0
"To all the wankers who are slamming the weights on the floor/machine, fuck you! Either drop weight or get a spot. /rant",eytqp,another-work-acct,https://www.reddit.com/r/Fitness/comments/eytqp/to_all_the_wankers_who_are_slamming_the_weights/,1,16,1294550940.0
"Just letting you know, a PaleoDiet subreddit has been created",c04d8,Slippy-Toad,http://www.reddit.com/r/paleodiet/,1,11,1273009057.0
Body Makeup Instead of Fitness?,8mj1c,beautlife,http://geniusbeauty.com/cosmetics/body-makeup-look-hot-summer/,0,4,1243017850.0
Hey r/Fitness......I fucked up.,23txma,rc_w,https://www.reddit.com/r/Fitness/comments/23txma/hey_rfitnessi_fucked_up/,2,14,1398311224.0
So. Sore.,236glg,adamsdayoff,https://www.reddit.com/r/Fitness/comments/236glg/so_sore/,0,39,1397654928.0
How bad can a cheat day really be?,1zbtj6,None,https://www.reddit.com/r/Fitness/comments/1zbtj6/how_bad_can_a_cheat_day_really_be/,3,44,1393740813.0
"The poor, misunderstood kilowatt•hour (calories)",1jhwwl,AhmedF,https://www.reddit.com/r/Fitness/comments/1jhwwl/the_poor_misunderstood_kilowatthour_calories/,0,14,1375369302.0
Done being fat!,1ch9qm,Chefwilliam,https://www.reddit.com/r/Fitness/comments/1ch9qm/done_being_fat/,2,24,1366139669.0
"Doctor shocked that I eat at least a pound of meat a day, advising me to cut back straight away.",18jtse,bigskymind,https://www.reddit.com/r/Fitness/comments/18jtse/doctor_shocked_that_i_eat_at_least_a_pound_of/,0,72,1360887622.0
I am an idiot,oxef0,None,https://www.reddit.com/r/Fitness/comments/oxef0/i_am_an_idiot/,2,18,1327568556.0
"I'm 21 years old and 320 lbs, extremely unfit. Today I began to change my ways.",ifiwb,olivered,https://www.reddit.com/r/Fitness/comments/ifiwb/im_21_years_old_and_320_lbs_extremely_unfit_today/,4,25,1309677979.0
Studies show diet soda CAN make you fat (As if any of us here didn't know that already),ice5d,artimas2,http://www.cbsnews.com/8301-504763_162-20075358-10391704.html,0,15,1309363134.0
I am level 3 on fitocracy,h4lul,IamAwesomePanda,http://imgur.com/4SVIs,0,4,1304573276.0
"You know what would really be a good start? Don't force children to finish their meal when they don't want to eat anymore. Seriously, what the fuck.",go064,None,https://www.reddit.com/r/Fitness/comments/go064/you_know_what_would_really_be_a_good_start_dont/,0,31,1302587024.0
Announcing /r/intermediatefitness/,f1lx3,teamwaffle,http://www.reddit.com/r/intermediatefitness/,3,10,1294934187.0
The backwards baseball cap supplement?,db86j,Smipims,https://www.reddit.com/r/Fitness/comments/db86j/the_backwards_baseball_cap_supplement/,0,10,1283971546.0
Can you overtrain the biceps and triceps with a push/pull/leg?,deipmh,lllIIIIIIIlIIIIIlll,https://www.reddit.com/r/Fitness/comments/deipmh/can_you_overtrain_the_biceps_and_triceps_with_a/,0,17,1570451086.0
"I am feeling ... kinda sad, like am not a good body type",bcsrp5,GodReviews,https://www.reddit.com/r/Fitness/comments/bcsrp5/i_am_feeling_kinda_sad_like_am_not_a_good_body/,1,46,1555175751.0
Is it true that a low carb and high protein diet is bad?,9jkoic,None,https://www.reddit.com/r/Fitness/comments/9jkoic/is_it_true_that_a_low_carb_and_high_protein_diet/,2,42,1538117047.0
"I'm going to do 500 push-ups a day challenge for 30 days, has anyone ever done a challenge like this before? If so what happened?",82azw6,PS2DREW,https://www.reddit.com/r/Fitness/comments/82azw6/im_going_to_do_500_pushups_a_day_challenge_for_30/,0,18,1520297409.0
Why do we have to eat so much to bulk?,7pz6ty,MurderLizard,https://www.reddit.com/r/Fitness/comments/7pz6ty/why_do_we_have_to_eat_so_much_to_bulk/,1,34,1515786836.0
"Fitness Journey Progress (5'7"" M 180 --> 133)",730z4h,joshth1997,https://www.reddit.com/r/Fitness/comments/730z4h/fitness_journey_progress_57_m_180_133/,3,12,1506613871.0
Why the 400m Sprint Should be in your program,4n108u,Coolestdudentwn,https://www.reddit.com/r/Fitness/comments/4n108u/why_the_400m_sprint_should_be_in_your_program/,2,26,1465329755.0
How do I build strength not muscle?,43t48t,thecanadiancast,https://www.reddit.com/r/Fitness/comments/43t48t/how_do_i_build_strength_not_muscle/,1,34,1454395922.0
"Help me build r/fitcouples--A subreddit for couples that are fit, looking to get fit, or willing to share advice about their ""relationfit.""",1ofuxu,FanofPawl,https://www.reddit.com/r/Fitness/comments/1ofuxu/help_me_build_rfitcouplesa_subreddit_for_couples/,1,6,1381773909.0
Talking to girls in the gym: do's and don'ts:,yg2eb,RunningNeuroNerd,https://www.reddit.com/r/Fitness/comments/yg2eb/talking_to_girls_in_the_gym_dos_and_donts/,3,33,1345328070.0
Going an entire day without eating... 32-36 hour fast. Opinions?,kbfzj,SilverRaine,https://www.reddit.com/r/Fitness/comments/kbfzj/going_an_entire_day_without_eating_3236_hour_fast/,0,85,1315688765.0
Why I hate the gym (and can you help please?),29w926,funkless_eck,https://www.reddit.com/r/Fitness/comments/29w926/why_i_hate_the_gym_and_can_you_help_please/,56,196,1404566027.0
A solid routine for consistent strength and mass gains at any level,2dvnmr,walkingfarmer,https://www.reddit.com/r/Fitness/comments/2dvnmr/a_solid_routine_for_consistent_strength_and_mass/,14,54,1408364285.0
Anyone else afraid to do Deadlifts?,1ky8dy,duelpro,https://www.reddit.com/r/Fitness/comments/1ky8dy/anyone_else_afraid_to_do_deadlifts/,7,79,1377275614.0
"Hey Fittit, Can We Stop Needlessly Bashing on Crossfit-style Workouts?",egkle,None,https://www.reddit.com/r/Fitness/comments/egkle/hey_fittit_can_we_stop_needlessly_bashing_on/,13,102,1291564410.0
Why It Was Easier to Be Skinny in the 1980s,3n1tk7,atomicpete,https://www.reddit.com/r/Fitness/comments/3n1tk7/why_it_was_easier_to_be_skinny_in_the_1980s/,6,74,1443665534.0
This is why I don't have a six pack.,hblev,tlr86,http://imgur.com/VUZNE,4,22,1305424742.0
Is diet soda ok to drink?,12zloq,None,https://www.reddit.com/r/Fitness/comments/12zloq/is_diet_soda_ok_to_drink/,35,140,1352595823.0
Sprinting?,gcssvk,grapejelly7212,https://www.reddit.com/r/Fitness/comments/gcssvk/sprinting/,0,11,1588521003.0
Fitness for the everyday man?,g468e9,mnky95,https://www.reddit.com/r/Fitness/comments/g468e9/fitness_for_the_everyday_man/,2,14,1587296027.0
5 overrated exercises and what to do instead,dr807k,VULn3R,https://www.reddit.com/r/Fitness/comments/dr807k/5_overrated_exercises_and_what_to_do_instead/,2,24,1572820698.0
Where to do sprints?,d25l5t,crayon_jambe,https://www.reddit.com/r/Fitness/comments/d25l5t/where_to_do_sprints/,1,39,1568110853.0
