Title,ID,Author,URL,Score,Comment Count,Created
Is there an optimal BMI for optimal health?,tvazoq,A-Sky905,https://www.reddit.com/r/Fitness/comments/tvazoq/is_there_an_optimal_bmi_for_optimal_health/,3,72,1648997481.0
"Do you have to choose between ""speed"" and ""strength"" muscles?",gg51fi,clockdaddy,https://www.reddit.com/r/Fitness/comments/gg51fi/do_you_have_to_choose_between_speed_and_strength/,5,31,1588983520.0
"How can I encourage ""Popeye arms""?",946z8e,IAmASeeker,https://www.reddit.com/r/Fitness/comments/946z8e/how_can_i_encourage_popeye_arms/,3,51,1533274941.0
"F/22/5'2"" June to September 123-->118 or how five pounds can make a huge change on a small frame.",525r47,ScoobyDoobieBlue,https://www.reddit.com/r/Fitness/comments/525r47/f2252_june_to_september_123118_or_how_five_pounds/,5,9,1473549539.0
Cyanide and Happiness short: Fitness Buff,1m8ncy,None,https://www.reddit.com/r/Fitness/comments/1m8ncy/cyanide_and_happiness_short_fitness_buff/,0,2,1378984415.0
I keep seeing people do weird motions while lifting,1e1urn,Axpp,https://www.reddit.com/r/Fitness/comments/1e1urn/i_keep_seeing_people_do_weird_motions_while/,3,28,1368160548.0
The 5 Most Terrifying Side Effects of Exercise,h2a1r,NiKnights,http://www.cracked.com/article_19186_the-5-most-terrifying-side-effects-exercise.html,4,14,1304347244.0
"ITT: I, the former King of Fittit and current Manlet of the Mountain, declare the next King of Fittit. Bring me offerings of your fitness accomplishments and subject yourself to my whims if you wish to be in the running. No vid, no did.",29yz3k,None,https://www.reddit.com/r/Fitness/comments/29yz3k/itt_i_the_former_king_of_fittit_and_current/,27,77,1404659489.0
Today I learned there is no such thing as a 'Hard Gainer',vkqje,Nishta,https://www.reddit.com/r/Fitness/comments/vkqje/today_i_learned_there_is_no_such_thing_as_a_hard/,5,58,1340638936.0
Question about the scientific necessity of bulking.,1asnv6,SeanBites,https://www.reddit.com/r/Fitness/comments/1asnv6/question_about_the_scientific_necessity_of_bulking/,20,172,1363956476.0
Do not sign up for Pro-Fit/National Fitness!!!!,2z9dcl,None,https://www.reddit.com/r/Fitness/comments/2z9dcl/do_not_sign_up_for_profitnational_fitness/,12,9,1426531252.0
4 years of apathy is ENOUGH! Serious changes happening [pics possibly NSFW]...,z2nrw,tossout819,https://www.reddit.com/r/Fitness/comments/z2nrw/4_years_of_apathy_is_enough_serious_changes/,13,53,1346329026.0
The REAL Effects of Alcohol On Your Body,chfsr,beacon_,http://www.buzzle.com/articles/real-effects-alcohol-body.html,32,19,1277147410.0
Question about pre workout thing,1abwna,TehZach,https://www.reddit.com/r/Fitness/comments/1abwna/question_about_pre_workout_thing/,131,88,1363318893.0
Why are you all afraid of trying?,2emc2g,12InchesOfSlave,https://www.reddit.com/r/Fitness/comments/2emc2g/why_are_you_all_afraid_of_trying/,108,108,1409055312.0
I'm [21F] too scared to go to the gym,1vlds6,fearoffitness,https://www.reddit.com/r/Fitness/comments/1vlds6/im_21f_too_scared_to_go_to_the_gym/,8,49,1390141588.0
You have GOT to be kidding me.  CNN article stating being fat is healthy,15wznf,AccipiterQ,https://www.reddit.com/r/Fitness/comments/15wznf/you_have_got_to_be_kidding_me_cnn_article_stating/,1336,1404,1357255073.0
A quick vent: Stop telling me diet sodas will make me fat!,pp07e,MyManD,https://www.reddit.com/r/Fitness/comments/pp07e/a_quick_vent_stop_telling_me_diet_sodas_will_make/,476,1004,1329222176.0
DAE Smoke weed before working out?,u8wye,shaft0,https://www.reddit.com/r/Fitness/comments/u8wye/dae_smoke_weed_before_working_out/,25,80,1338224790.0
STUDY : There is a clear differences between organic and non-organic food,2q3ngi,goldman_ct,https://www.reddit.com/r/Fitness/comments/2q3ngi/study_there_is_a_clear_differences_between/,18,36,1419279603.0
"Made my own (fake) energy supplement, going to stick it in the stack that my housemate has to see if he notices",w183p,kibitzor,https://www.reddit.com/r/Fitness/comments/w183p/made_my_own_fake_energy_supplement_going_to_stick/,43,70,1341414946.0
Finally dumbbell pressed 80's for 5 yesterday!  Made my day.,l8a8z,rektumlacerations,https://www.reddit.com/r/Fitness/comments/l8a8z/finally_dumbbell_pressed_80s_for_5_yesterday_made/,11,37,1318342371.0
Is it ok to feel bad that you skipped a day at the gym?,2jp8ly,daviee,https://www.reddit.com/r/Fitness/comments/2jp8ly/is_it_ok_to_feel_bad_that_you_skipped_a_day_at/,0,31,1413735949.0
What are your thoughts about working out in swimware?,1bex36,hunkyhank98,https://www.reddit.com/r/Fitness/comments/1bex36/what_are_your_thoughts_about_working_out_in/,0,18,1364811280.0
My strength and conditioning coach is getting sued by Under Armour. Please help him out by signing this petition! ,wsrpn,toddski11,https://www.reddit.com/r/Fitness/comments/wsrpn/my_strength_and_conditioning_coach_is_getting/,5,12,1342668711.0
"I've abused my body for 10 years, now I have 8 weeks to shape up for the holiday of a lifetime. Please help. ",rr57s,GetFitQuick,https://www.reddit.com/r/Fitness/comments/rr57s/ive_abused_my_body_for_10_years_now_i_have_8/,4,64,1333460323.0
Anyone else have high HR when running? Should I worry?,12960t7,BobbyFe,https://www.reddit.com/r/Fitness/comments/12960t7/anyone_else_have_high_hr_when_running_should_i/,2,38,1680399654.0
"Why do people subscribe to the idea of a ""cheat meal"" ?",c0e4mz,E46M54,https://www.reddit.com/r/Fitness/comments/c0e4mz/why_do_people_subscribe_to_the_idea_of_a_cheat/,0,24,1560475479.0
Caffeine is the only ingredient in a pre-workout that is worth a dam. Stop wasting your money.,5wpkwz,Beastious,https://www.reddit.com/r/Fitness/comments/5wpkwz/caffeine_is_the_only_ingredient_in_a_preworkout/,0,85,1488305457.0
So my mum threw out my first tub of whey protein,25uwrc,None,https://www.reddit.com/r/Fitness/comments/25uwrc/so_my_mum_threw_out_my_first_tub_of_whey_protein/,4,41,1400416174.0
Your shirt is too small!,1pohyg,None,https://www.reddit.com/r/Fitness/comments/1pohyg/your_shirt_is_too_small/,0,31,1383303900.0
anyone get very strong but still have yet to meet a girl?,ueyqx,questionablematerial,https://www.reddit.com/r/Fitness/comments/ueyqx/anyone_get_very_strong_but_still_have_yet_to_meet/,6,57,1338517707.0
"Can i just bring something to your attention, that sounded a few alarm bells when i read it.",1fcljl,None,https://www.reddit.com/r/Fitness/comments/1fcljl/can_i_just_bring_something_to_your_attention_that/,16,22,1369936533.0
Sleep vs Sex,4ro62v,Doitallforyou,https://www.reddit.com/r/Fitness/comments/4ro62v/sleep_vs_sex/,28,119,1467892564.0
Is it OK to refuse to spot when...,22i3od,redstovely,https://www.reddit.com/r/Fitness/comments/22i3od/is_it_ok_to_refuse_to_spot_when/,26,54,1396946867.0
Why does Fittit insist that everyone that is above normal strength or physique is using steroids?,jotbm,None,https://www.reddit.com/r/Fitness/comments/jotbm/why_does_fittit_insist_that_everyone_that_is/,7,67,1313845508.0
Self-Promotion Saturday,4c0owx,AutoModerator,https://www.reddit.com/r/Fitness/comments/4c0owx/selfpromotion_saturday/,0,41,1458986528.0
Benched 225 Today.,1j65fj,ShepPawnch,https://www.reddit.com/r/Fitness/comments/1j65fj/benched_225_today/,10,22,1374948221.0
The Myth about Muscle and Metabolism: One extra pound of muscle burns only an extra of 6 calories a day,zlm9b,yhelothere,https://www.reddit.com/r/Fitness/comments/zlm9b/the_myth_about_muscle_and_metabolism_one_extra/,47,75,1347196192.0
Is jogging going to have an impact on my sprinting performance?,ghmqw8,AltieMcAlt,https://www.reddit.com/r/Fitness/comments/ghmqw8/is_jogging_going_to_have_an_impact_on_my/,0,12,1589200608.0
How to find your working weights after all this is over?,g06xna,StarKanon,https://www.reddit.com/r/Fitness/comments/g06xna/how_to_find_your_working_weights_after_all_this/,0,19,1586733047.0
How hard should I push myself as a smoker?,edch0s,Ultima-Hallowed,https://www.reddit.com/r/Fitness/comments/edch0s/how_hard_should_i_push_myself_as_a_smoker/,0,27,1576859700.0
"Does ""muscle memory"" also mean that I can build muscle mass faster?",dkv287,nrrrrr,https://www.reddit.com/r/Fitness/comments/dkv287/does_muscle_memory_also_mean_that_i_can_build/,0,25,1571631202.0
How old is too old to compete?,cy3zxi,Ares95,https://www.reddit.com/r/Fitness/comments/cy3zxi/how_old_is_too_old_to_compete/,0,24,1567301828.0
Cable deadlifts?,9pz6q8,firefly6345,https://www.reddit.com/r/Fitness/comments/9pz6q8/cable_deadlifts/,1,14,1540080831.0
"Please clarify: if you train with weights on a cut, you won't get bulky?",8nhavd,amplebottomjeans,https://www.reddit.com/r/Fitness/comments/8nhavd/please_clarify_if_you_train_with_weights_on_a_cut/,0,13,1527762232.0
Self-Promotion Saturday,6dmxty,AutoModerator,https://www.reddit.com/r/Fitness/comments/6dmxty/selfpromotion_saturday/,0,27,1495879520.0
Computer Geek Butt,4l4dh7,deb_on_air,https://www.reddit.com/r/Fitness/comments/4l4dh7/computer_geek_butt/,0,33,1464251536.0
Is going to gym at 15 y/o bad?,3z7mz3,chlfg,https://www.reddit.com/r/Fitness/comments/3z7mz3/is_going_to_gym_at_15_yo_bad/,0,53,1451782499.0
is a mass 10-12 day binge gonna kill me?,3jcvdj,Cocunutmilk,https://www.reddit.com/r/Fitness/comments/3jcvdj/is_a_mass_1012_day_binge_gonna_kill_me/,0,19,1441201718.0
Greek yoghurt + whey protein = heaven #foodforgainz,3df6pr,theportugeezer,https://www.reddit.com/r/Fitness/comments/3df6pr/greek_yoghurt_whey_protein_heaven_foodforgainz/,1,19,1436990962.0
"Beer is a part of my life, and it's not hurting my fitness goals.",2cz3ti,CriticalThink,https://www.reddit.com/r/Fitness/comments/2cz3ti/beer_is_a_part_of_my_life_and_its_not_hurting_my/,0,18,1407501531.0
"Used and Abused by Ex, more motivated than ever. Thank you /r/fitness",21ifpp,SandiegoJack,https://www.reddit.com/r/Fitness/comments/21ifpp/used_and_abused_by_ex_more_motivated_than_ever/,0,6,1395934765.0
A start.,1zj3xd,tehrealneon,https://www.reddit.com/r/Fitness/comments/1zj3xd/a_start/,0,7,1393943429.0
Just benched 135lbs for the first time!,1ln1er,riccarjo,https://www.reddit.com/r/Fitness/comments/1ln1er/just_benched_135lbs_for_the_first_time/,0,12,1378211827.0
When can I start my little brother into a lifting regiment?,1ik4lo,None,https://www.reddit.com/r/Fitness/comments/1ik4lo/when_can_i_start_my_little_brother_into_a_lifting/,0,27,1374156060.0
Weightlifting vs. Cardio: The Facts,1gimqj,AhmedF,https://www.reddit.com/r/Fitness/comments/1gimqj/weightlifting_vs_cardio_the_facts/,1,12,1371479937.0
"Just joined a gym, but already an avid p90x/Insanity user. Looking to find a nice hybrid that incorporates the use of heavy weights (goals written inside)",1fx810,countdamoney,https://www.reddit.com/r/Fitness/comments/1fx810/just_joined_a_gym_but_already_an_avid/,1,10,1370693330.0
"Dear American Consumers: Please don’t start eating healthfully. Sincerely, the Food Industry",1enwr8,jedi_stannis,https://www.reddit.com/r/Fitness/comments/1enwr8/dear_american_consumers_please_dont_start_eating/,1,5,1369010164.0
"Im 16, 5""8 and 200 pound boy and i want to learn how to weight lift and become athletic.",1ecxfo,ContortedCashew,https://www.reddit.com/r/Fitness/comments/1ecxfo/im_16_58_and_200_pound_boy_and_i_want_to_learn/,0,8,1368585542.0
Just maxed on deadlift today: 315lbs!,1d2jrl,MittRomneysPlatform,https://www.reddit.com/r/Fitness/comments/1d2jrl/just_maxed_on_deadlift_today_315lbs/,0,10,1366874991.0
What do you think about women-only hours at the gym?,1crqfj,Kourakis,https://www.reddit.com/r/Fitness/comments/1crqfj/what_do_you_think_about_womenonly_hours_at_the_gym/,1,17,1366501037.0
Do any other (probably male) lifters have this problem? feel skinny and small even though you know you aren't?,1bt114,None,https://www.reddit.com/r/Fitness/comments/1bt114/do_any_other_probably_male_lifters_have_this/,1,65,1365271180.0
Help me build a routine and tell me how should I eat (required information included),1aqdqa,Ashmedai314,https://www.reddit.com/r/Fitness/comments/1aqdqa/help_me_build_a_routine_and_tell_me_how_should_i/,0,3,1363875337.0
"Look at this pic, should I bulk up or lose weight?",114yhv,None,https://www.reddit.com/r/Fitness/comments/114yhv/look_at_this_pic_should_i_bulk_up_or_lose_weight/,0,19,1349704917.0
"""Fat people don't need to be punished""",xoo24,diesel828,https://www.reddit.com/r/Fitness/comments/xoo24/fat_people_dont_need_to_be_punished/,0,24,1344113134.0
How many of you here use /fit/?,xjt6l,retarded_horse_shit,https://www.reddit.com/r/Fitness/comments/xjt6l/how_many_of_you_here_use_fit/,0,15,1343885874.0
Went jogging for 30mins for the first time last night,udpvj,kramit,https://www.reddit.com/r/Fitness/comments/udpvj/went_jogging_for_30mins_for_the_first_time_last/,0,4,1338464275.0
"Facial exercises.  Fact or Myth?  If fact, what are some good ones?",rt4og,J3ipolarGod,https://www.reddit.com/r/Fitness/comments/rt4og/facial_exercises_fact_or_myth_if_fact_what_are/,0,21,1333559099.0
Improvement with women after lifting?,qzd24,captainregularr,https://www.reddit.com/r/Fitness/comments/qzd24/improvement_with_women_after_lifting/,1,47,1331906224.0
Where can I find more of these rippetoe comics?,ng84f,SpiderFan,https://www.reddit.com/r/Fitness/comments/ng84f/where_can_i_find_more_of_these_rippetoe_comics/,0,5,1324115289.0
Broke PR today just had to tell the people who helped motivate me to do it!,mr723,DT10,https://www.reddit.com/r/Fitness/comments/mr723/broke_pr_today_just_had_to_tell_the_people_who/,0,1,1322429686.0
How do I squat in [this](http://i.imgur.com/sIclC.jpg)?,l94jp,None,https://www.reddit.com/r/Fitness/comments/l94jp/how_do_i_squat_in_thishttpiimgurcomsiclcjpg/,0,35,1318389673.0
Whoooo Garage sale! ,imfh5,Anaesthesia,https://www.reddit.com/r/Fitness/comments/imfh5/whoooo_garage_sale/,0,5,1310394744.0
Lifting interruptions (Crosspost from /r/funny),hwetg,DoctorCube,http://i.imgur.com/TIBTQ.gif,0,3,1307717579.0
Some of you suggested an AMA so I made one; link inside :),hlguo,None,https://www.reddit.com/r/Fitness/comments/hlguo/some_of_you_suggested_an_ama_so_i_made_one_link/,0,8,1306500225.0
"Hello, I'm Not the Enemy (Dan Savage responds to ""Hello, I am 
fat"")",flqau,None,http://slog.thestranger.com/slog/archives/2011/02/14/hello-im-not-the-enemy,0,0,1297760853.0
I just made double chocolate cookies ... and I can't eat them. They just don't taste good anymore.,d113t,None,https://www.reddit.com/r/Fitness/comments/d113t/i_just_made_double_chocolate_cookies_and_i_cant/,0,10,1281759761.0
How do you hit on people at the gym?,1lam7n,TheSharpestTool,https://www.reddit.com/r/Fitness/comments/1lam7n/how_do_you_hit_on_people_at_the_gym/,0,62,1377733024.0
"Body image, self-improvement, and people who just don't get it",1gnqpi,sometimethewolf,https://www.reddit.com/r/Fitness/comments/1gnqpi/body_image_selfimprovement_and_people_who_just/,5,45,1371654995.0
"Small victory! 24M, 5'7, 160lbs",1dhdgm,BloodyWanka,https://www.reddit.com/r/Fitness/comments/1dhdgm/small_victory_24m_57_160lbs/,3,6,1367418521.0
Anyone else find it hard to keep up in December?,14o433,simsedotdk,https://www.reddit.com/r/Fitness/comments/14o433/anyone_else_find_it_hard_to_keep_up_in_december/,4,58,1355242005.0
A new idea for gamers..,n1tw8,Aehs01,https://www.reddit.com/r/Fitness/comments/n1tw8/a_new_idea_for_gamers/,0,28,1323132758.0
How Do We Become Fat?  The 'calorie is a calorie' paradigm has been proven wrong over and over.  It's insulin taking on excessive carbohydrates.,9dr0y,charlatan,http://www.huffingtonpost.com/fred-hahn/how-emdoem-we-become-fat_b_250233.html,3,21,1251154930.0
Should I follow this advice from a gym guy?,e2y4gf,HyperKingK,https://www.reddit.com/r/Fitness/comments/e2y4gf/should_i_follow_this_advice_from_a_gym_guy/,2,26,1574948267.0
Am I missing out by doing calisthenics only?,b7nwk1,YesVeryKewl,https://www.reddit.com/r/Fitness/comments/b7nwk1/am_i_missing_out_by_doing_calisthenics_only/,1,58,1554039930.0
Rhabdomyolysis is serious and really can happen to beginners. Be careful.,1nahnf,tediousbreakdown,https://www.reddit.com/r/Fitness/comments/1nahnf/rhabdomyolysis_is_serious_and_really_can_happen/,0,11,1380337870.0
Build ‘Real-World Strength’ With Uneven Load Weight Training,rv29nx,b22152,https://www.reddit.com/r/Fitness/comments/rv29nx/build_realworld_strength_with_uneven_load_weight/,13,55,1641218209.0
Am I wrong to be taking up squat rack so long,abn9p8,taimurtomato,https://www.reddit.com/r/Fitness/comments/abn9p8/am_i_wrong_to_be_taking_up_squat_rack_so_long/,8,152,1546385075.0
Question: Cashew Butter / Nut Butters as part of a high protein diet...,1cuxn9,TheObrien,https://www.reddit.com/r/Fitness/comments/1cuxn9/question_cashew_butter_nut_butters_as_part_of_a/,7,15,1366632894.0
So you're thinking about doing a couple 'roid cycles?,hw1c2,okkk27,http://i.imgur.com/4yq5S.jpg,130,133,1307671452.0
Self-Promotion Saturday,4f1b2e,AutoModerator,https://www.reddit.com/r/Fitness/comments/4f1b2e/selfpromotion_saturday/,0,34,1460800949.0
I was the fat kid in Gym Class who ran a 13 minute mile.,sx5iz,brandaustin,https://www.reddit.com/r/Fitness/comments/sx5iz/i_was_the_fat_kid_in_gym_class_who_ran_a_13/,12,13,1335642269.0
Self-Promotion Saturday,4rzq99,AutoModerator,https://www.reddit.com/r/Fitness/comments/4rzq99/selfpromotion_saturday/,5,34,1468058542.0
Has anyone else noticed this trend?,1rah2x,SquirtleGurdle,https://www.reddit.com/r/Fitness/comments/1rah2x/has_anyone_else_noticed_this_trend/,3,33,1385222574.0
The Most Beautiful Dream (Scooby's Apprentice),1ms6rk,None,https://www.reddit.com/r/Fitness/comments/1ms6rk/the_most_beautiful_dream_scoobys_apprentice/,5,13,1379691608.0
Just PR'd with a 300lb Deadlift. When did first notice your training was worth it and you were getting strong as hell?,114upb,None,https://www.reddit.com/r/Fitness/comments/114upb/just_prd_with_a_300lb_deadlift_when_did_first/,0,50,1349699140.0
25 Beautiful Women and 2 Frantic Photographers,jwoea,None,https://www.reddit.com/r/Fitness/comments/jwoea/25_beautiful_women_and_2_frantic_photographers/,4,26,1314499431.0
"She went from overweight law student to bikini competitor. Fittit, if you ever needed proof for why women should lift ...",g9rwb,QuestBar,http://blog.questproteinbar.com/the-rachel-mac-transformation-part-1/,6,38,1300895333.0
PUBMED- Whey Protein Before and During Resistance Exercise Has No Effect on Muscle Mass and Strength,xtrtn,vixtt,https://www.reddit.com/r/Fitness/comments/xtrtn/pubmed_whey_protein_before_and_during_resistance/,216,346,1344353281.0
You cannot help that you will fail a rep. You can help that you *must* be prepared for this.,qej24,castironfoodie,https://www.reddit.com/r/Fitness/comments/qej24/you_cannot_help_that_you_will_fail_a_rep_you_can/,25,77,1330701670.0
Having a shower after gym,83331i,GoogleDriveMeDicen,https://www.reddit.com/r/Fitness/comments/83331i/having_a_shower_after_gym/,1,62,1520560471.0
Self-Promotion Saturday,69kgpb,AutoModerator,https://www.reddit.com/r/Fitness/comments/69kgpb/selfpromotion_saturday/,0,29,1494064940.0
"[serious discussion] What are the ""bad things"" of CrossFit?",257i6f,h4tt0ri,https://www.reddit.com/r/Fitness/comments/257i6f/serious_discussion_what_are_the_bad_things_of/,0,27,1399731725.0
Self-Promotion Saturday,522hfl,AutoModerator,https://www.reddit.com/r/Fitness/comments/522hfl/selfpromotion_saturday/,0,42,1473501742.0
"37 Male 1 yr progress, from 163 to 165. Bonus shirtless bathroom selfies included.",47e9kj,BobSacramanto,https://www.reddit.com/r/Fitness/comments/47e9kj/37_male_1_yr_progress_from_163_to_165_bonus/,3,21,1456340977.0
Should I be concerned about slowing my metabolism by only drinking protein shakes in the mornings and just generally eating less?,3gyy49,None,https://www.reddit.com/r/Fitness/comments/3gyy49/should_i_be_concerned_about_slowing_my_metabolism/,2,8,1439556326.0
I have created a new sub to warn and share stories about the use of creatine...,1l0o8w,monkfishbandana,https://www.reddit.com/r/Fitness/comments/1l0o8w/i_have_created_a_new_sub_to_warn_and_share/,0,7,1377374397.0
I got the starting strength book and studied it last night...,1hra1k,FunkMast3r,https://www.reddit.com/r/Fitness/comments/1hra1k/i_got_the_starting_strength_book_and_studied_it/,2,12,1373132787.0
I am gonna die trying.,1fqaf0,capatiller,https://www.reddit.com/r/Fitness/comments/1fqaf0/i_am_gonna_die_trying/,0,13,1370450365.0
"Do you listen to music while you work out? If so, what?",zpw6s,ecp12,https://www.reddit.com/r/Fitness/comments/zpw6s/do_you_listen_to_music_while_you_work_out_if_so/,1,32,1347385828.0
"I have coined a new term: ""brahdybuilder""",hqirl,jacques_chester,https://www.reddit.com/r/Fitness/comments/hqirl/i_have_coined_a_new_term_brahdybuilder/,0,15,1307074631.0
Smoking weed before a workout?,gh39n,None,https://www.reddit.com/r/Fitness/comments/gh39n/smoking_weed_before_a_workout/,0,15,1301753255.0
6 Fitness Tips Everyone's Heard (That Don't Work at All),ge2ks,downtown_toontown,http://www.cracked.com/article_19130_6-fitness-tips-everyones-heard-that-dont-work-at-all.html,4,42,1301420193.0
I lost 120 pounds and it's all thanks to Fittit! (pics inside),fgv7q,None,https://www.reddit.com/r/Fitness/comments/fgv7q/i_lost_120_pounds_and_its_all_thanks_to_fittit/,1,5,1297089613.0
Hey Fittit! I started /r/fasting! Join us and share your fasting stories!,f3ag2,areich,http://fasting.reddit.com,0,0,1295191671.0
Exercise hormone confirmed; we now know what turns fat into energy.,3hlfts,mattmyersjr,https://www.reddit.com/r/Fitness/comments/3hlfts/exercise_hormone_confirmed_we_now_know_what_turns/,52,50,1439998425.0
I'm always so exhausted after a workout for the rest of the day.,e3moxu,durantt0,https://www.reddit.com/r/Fitness/comments/e3moxu/im_always_so_exhausted_after_a_workout_for_the/,0,25,1575068643.0
Should I switch to bodyweight exercises for now?,drr9ze,GoodStalker,https://www.reddit.com/r/Fitness/comments/drr9ze/should_i_switch_to_bodyweight_exercises_for_now/,0,17,1572914582.0
Opinions on Jason Blaha's training advice?,cf5432,californication760,https://www.reddit.com/r/Fitness/comments/cf5432/opinions_on_jason_blahas_training_advice/,0,34,1563526087.0
Why do my dietician and professor tell me that diets don’t work for losing weight ? Yet my personal trainer recommends limiting my caloric intake daily (because i tend to overeat) ? Who is right or wrong? i'm a guy who wants to lose weight and gradually gain strength,b45mgt,MajesticListen,https://www.reddit.com/r/Fitness/comments/b45mgt/why_do_my_dietician_and_professor_tell_me_that/,0,77,1553264400.0
Is it a bad idea to work NECK on CHEST day?,9m9nno,XGPfresh,https://www.reddit.com/r/Fitness/comments/9m9nno/is_it_a_bad_idea_to_work_neck_on_chest_day/,0,20,1538953672.0
Does Vaping Effect Gains?,92osji,Creeperpoop12,https://www.reddit.com/r/Fitness/comments/92osji/does_vaping_effect_gains/,0,32,1532806595.0
How long does it take to get benefits from quitting smoking?,8lllrj,helemaal,https://www.reddit.com/r/Fitness/comments/8lllrj/how_long_does_it_take_to_get_benefits_from/,0,26,1527099392.0
2 year transformation - 18/M/5'11/ 160lb --> 159lb,5l6kjy,Xtreme_kocic,https://www.reddit.com/r/Fitness/comments/5l6kjy/2_year_transformation_18m511_160lb_159lb/,3,13,1483140631.0
I lost 2kg in a week,3rwmg1,None,https://www.reddit.com/r/Fitness/comments/3rwmg1/i_lost_2kg_in_a_week/,2,7,1446916389.0
Hey Fittit! How many supplements are you currently taking?,3l25aa,Iwannab_abillionaire,https://www.reddit.com/r/Fitness/comments/3l25aa/hey_fittit_how_many_supplements_are_you_currently/,0,94,1442334680.0
One year of Wendler 5/3/1 - and why you shouldn't do it (for that long).,36xymo,SleepEatLift,https://www.reddit.com/r/Fitness/comments/36xymo/one_year_of_wendler_531_and_why_you_shouldnt_do/,0,30,1432344253.0
Stop doing ab workouts. just run!,31x27b,zbplot,https://www.reddit.com/r/Fitness/comments/31x27b/stop_doing_ab_workouts_just_run/,0,16,1428526167.0
1 Year Calisthenics Transformation: 16 Years Old,30sty9,BarStarzzMarko,https://www.reddit.com/r/Fitness/comments/30sty9/1_year_calisthenics_transformation_16_years_old/,0,15,1427719144.0
How exactly do I 'flex' my abs?,25lpkv,rotarycontrolswitch,https://www.reddit.com/r/Fitness/comments/25lpkv/how_exactly_do_i_flex_my_abs/,0,28,1400129903.0
Missed a day of eating. Double calories next day?,1tgy5n,kfit37,https://www.reddit.com/r/Fitness/comments/1tgy5n/missed_a_day_of_eating_double_calories_next_day/,2,31,1387734930.0
"Hoodies, what's up with 'em",1a59fp,None,https://www.reddit.com/r/Fitness/comments/1a59fp/hoodies_whats_up_with_em/,0,40,1363095111.0
r/fitness saved my marriage!,he0cu,awesometownsman,https://www.reddit.com/r/Fitness/comments/he0cu/rfitness_saved_my_marriage/,0,5,1305699136.0
Before starting Strong Lifts 5x5 my one rep max on the bench press was 170lbs. Knowing this could anyone tell me whether or not they think I will make it to 200lbs bench press before I fail a set?,3bddt3,None,https://www.reddit.com/r/Fitness/comments/3bddt3/before_starting_strong_lifts_5x5_my_one_rep_max/,1,10,1435463900.0
A Complete Guide to Dominating Tough Mudder,24kfhd,N8C,https://www.reddit.com/r/Fitness/comments/24kfhd/a_complete_guide_to_dominating_tough_mudder/,0,14,1399060050.0
I finally have observed it: Curling in the squat rack. How do you deal with it?,24dr5c,stupidrobots,https://www.reddit.com/r/Fitness/comments/24dr5c/i_finally_have_observed_it_curling_in_the_squat/,1,27,1398878025.0
I made a fool of myself at the gym today...,22vkmi,DeepHorse,https://www.reddit.com/r/Fitness/comments/22vkmi/i_made_a_fool_of_myself_at_the_gym_today/,1,60,1397334790.0
Advice on using the gym,21iyrv,LookAMoose,https://www.reddit.com/r/Fitness/comments/21iyrv/advice_on_using_the_gym/,1,18,1395945880.0
