Title,ID,Author,URL,Score,Comment Count,Created
"Really, Planet Fitness?",1w4bux,None,https://www.reddit.com/r/Fitness/comments/1w4bux/really_planet_fitness/,57,298,1390664908.0
"Beach Season, 1 Month Quick Cut",22ya8b,None,https://www.reddit.com/r/Fitness/comments/22ya8b/beach_season_1_month_quick_cut/,105,303,1397424804.0
What I've learned so far in 4 years of trying to slowly get more fit...,39c7h6,BikerJared,https://www.reddit.com/r/Fitness/comments/39c7h6/what_ive_learned_so_far_in_4_years_of_trying_to/,0,139,1433966268.0
"Are ""minimalist"" shoes ok for lifting?",vhr4v,None,https://www.reddit.com/r/Fitness/comments/vhr4v/are_minimalist_shoes_ok_for_lifting/,12,108,1340478775.0
"I'm getting sick of the 'fat tolerance' movement I'm seeing recently. Being 'fat' is not something you were born with; 99.9% of the time, it's a condition created through the individuals own weakness, and no tolerance shall be given.",rvwvj,americanpegasus,https://www.reddit.com/r/Fitness/comments/rvwvj/im_getting_sick_of_the_fat_tolerance_movement_im/,630,1197,1333690919.0
"[Progress] Ladies and Gentlemen, I present to you my 4 year transformation from skinny to BEAST (21 years old)",2r79aw,BilHameed,https://www.reddit.com/r/Fitness/comments/2r79aw/progress_ladies_and_gentlemen_i_present_to_you_my/,3,111,1420290767.0
150lbs lost. My story before/after pictures Female.,35hdo5,TheRealTabbyanne,https://www.reddit.com/r/Fitness/comments/35hdo5/150lbs_lost_my_story_beforeafter_pictures_female/,0,72,1431256999.0
Abs Progress [NSFW],2ckafi,PaulTrap,https://www.reddit.com/r/Fitness/comments/2ckafi/abs_progress_nsfw/,669,450,1407129333.0
Throwaway rant: I'm your Huckleberry,1djk4f,huckleberryheffer,https://www.reddit.com/r/Fitness/comments/1djk4f/throwaway_rant_im_your_huckleberry/,0,71,1367489342.0
"M/25/6ft 175lbs to155 no cardio. Progress pic as well as detailed layout with list of workouts, and supps.",2noa8p,Fameiscomin,https://www.reddit.com/r/Fitness/comments/2noa8p/m256ft_175lbs_to155_no_cardio_progress_pic_as/,0,180,1417190068.0
Progress (nsfw) x-post from r/xxfitness,1z6xmd,Infinitemistress,https://www.reddit.com/r/Fitness/comments/1z6xmd/progress_nsfw_xpost_from_rxxfitness/,0,88,1393607738.0
Busted my callus deadlifting...,20sp70,heatfanatic03,https://www.reddit.com/r/Fitness/comments/20sp70/busted_my_callus_deadlifting/,0,52,1395218945.0
Cliche question: Is Brad Pitt Fight Club body achievable?,12pztpp,rzlinda,https://www.reddit.com/r/Fitness/comments/12pztpp/cliche_question_is_brad_pitt_fight_club_body/,1,122,1681770960.0
"Hi Fittit, I'm a new girl here and I wanted to say that this makes me feel very welcomed here...",t2xdc,sweatsalty,https://www.reddit.com/r/Fitness/comments/t2xdc/hi_fittit_im_a_new_girl_here_and_i_wanted_to_say/,0,66,1335940090.0
Multivitamin researchers find no health benefits,1t38tm,gunch,https://www.reddit.com/r/Fitness/comments/1t38tm/multivitamin_researchers_find_no_health_benefits/,5,56,1387290604.0
From Auschwitz to AWW SHIIIIIT. 6 months progress and my first progress post!,ouzp9,mycreativeusername,https://www.reddit.com/r/Fitness/comments/ouzp9/from_auschwitz_to_aww_shiiiiit_6_months_progress/,0,45,1327439648.0
"I'm sure I'll get down voted for being vegetarian, but here is my dinner for Saturday night. Mandarin orange soy protein and basmati rice!",dfrze,jwiddle,http://i.imgur.com/gNuK5.jpg?ref=nf,17,79,1284851350.0
Anybody who Takes Advice From /r/fitness Has A Death Wish,anoa1,sanrabb,https://www.reddit.com/r/Fitness/comments/anoa1/anybody_who_takes_advice_from_rfitness_has_a/,0,66,1263081531.0
Help me win an argument.,1cj20m0,Cloud_Lionhart,https://www.reddit.com/r/Fitness/comments/1cj20m0/help_me_win_an_argument/,0,264,1714718265.0
I was told you guys may enjoy my grandpa. He is 80 and still competes (and wins) in powerlifting competitions.,1qediw,Lillibeth,https://www.reddit.com/r/Fitness/comments/1qediw/i_was_told_you_guys_may_enjoy_my_grandpa_he_is_80/,6,27,1384200405.0
I've lost 44 pounds in 7 months and am competing in my first Fitness Competition next month.. UNREAL,z9c2a,AmanduhCali,https://www.reddit.com/r/Fitness/comments/z9c2a/ive_lost_44_pounds_in_7_months_and_am_competing/,0,68,1346638032.0
Wanted to share this: I broke up four fights last night,nyvmx,None,https://www.reddit.com/r/Fitness/comments/nyvmx/wanted_to_share_this_i_broke_up_four_fights_last/,57,80,1325450381.0
F/146lbs/5'6''/31 ~7 years progress (pics),3thj3n,zbplot,https://www.reddit.com/r/Fitness/comments/3thj3n/f146lbs5631_7_years_progress_pics/,0,82,1447968961.0
One Elite Powerlifter's Thoughts on CrossFit,3u35uu,gzcl,https://www.reddit.com/r/Fitness/comments/3u35uu/one_elite_powerlifters_thoughts_on_crossfit/,44,293,1448379133.0
"""Take your tampon out and go run.""  Sexist statements like this ought to be downvoted, not up voted.  Women are welcome on /r/fittit. ",d1rvf,menuitem,http://www.reddit.com/r/Fitness/comments/d1nnr/running_in_the_rain_how_do_you_do_it/c0ww9u7,12,92,1281976994.0
My friend and her boyfriend starting doing P90X. It had some unforeseen benefits. (X-post from r/funny),mxjap,devourerkwi,https://www.reddit.com/r/Fitness/comments/mxjap/my_friend_and_her_boyfriend_starting_doing_p90x/,0,22,1322836450.0
A brief guide to safe overhead pressing,3fv8y2,None,https://www.reddit.com/r/Fitness/comments/3fv8y2/a_brief_guide_to_safe_overhead_pressing/,2,81,1438777389.0
I feel like an idiot for not doing this before...,376klb,samvyt,https://www.reddit.com/r/Fitness/comments/376klb/i_feel_like_an_idiot_for_not_doing_this_before/,1,65,1432541846.0
Has the number of progress posts gotten out of hand?,uq2k6,justinmeister,https://www.reddit.com/r/Fitness/comments/uq2k6/has_the_number_of_progress_posts_gotten_out_of/,5,49,1339090517.0
Critique my shake? Don't up vote,2p7ttc,ASS_MONKEYS,https://www.reddit.com/r/Fitness/comments/2p7ttc/critique_my_shake_dont_up_vote/,1,19,1418516109.0
Does it bother anyone else that 4 out of the top 5 posts on fittit right now are minor victory reports?,lg0os,moontruck,https://www.reddit.com/r/Fitness/comments/lg0os/does_it_bother_anyone_else_that_4_out_of_the_top/,36,70,1318916805.0
Don’t Make this One Mistake when Taking Protein,205gng,AhmedF,https://www.reddit.com/r/Fitness/comments/205gng/dont_make_this_one_mistake_when_taking_protein/,3,53,1394557375.0
Year and half transformation,1k69g5,itsyaboyeric,https://www.reddit.com/r/Fitness/comments/1k69g5/year_and_half_transformation/,0,20,1376265667.0
"This is my thought process whenever I hear anything about ""eating paleo""",fvl69,gatsby365,http://i.imgur.com/gqrDV.png,12,63,1299043149.0
Can some of you please get off your high horses?,f27m5,omfgstopit,https://www.reddit.com/r/Fitness/comments/f27m5/can_some_of_you_please_get_off_your_high_horses/,0,31,1295013144.0
Just got my BF% tested. Calipers say 6.8% and hydrostatic says 10.4%. Why don't I look leaner?,5tukhh,None,https://www.reddit.com/r/Fitness/comments/5tukhh/just_got_my_bf_tested_calipers_say_68_and/,8,86,1487010575.0
"Meat, dairy may be as detrimental to your health as smoking cigarettes, study says",1zm1h0,bitcoinbanana,https://www.reddit.com/r/Fitness/comments/1zm1h0/meat_dairy_may_be_as_detrimental_to_your_health/,7,96,1394008156.0
High carb is so fucking incredible.,26e0u9,Faustoo,https://www.reddit.com/r/Fitness/comments/26e0u9/high_carb_is_so_fucking_incredible/,18,127,1400954120.0
Does weight lifting burn very many calories?,15o83c,None,https://www.reddit.com/r/Fitness/comments/15o83c/does_weight_lifting_burn_very_many_calories/,0,47,1356874868.0
FIRE UP YOUR MS PAINT/TAX CALCULATING MACHINES FOR THE AMA OF A LIFETIME. JAMIE LEWIS. TODAY. 5PM EST. WE'RE COMING AT YOU HOT HOT HOT. /r/SHITTYASKFITNESS IS GOING TO DROP A STEAMER. 5PMESTJAMIELEWISAMA/r/SHITTYASKFITNESS,1qzk8y,None,https://www.reddit.com/r/Fitness/comments/1qzk8y/fire_up_your_ms_painttax_calculating_machines_for/,8,28,1384880597.0
My personal goal has been met and boy am I unphotogenic!,1ohigf,Numbers43,https://www.reddit.com/r/Fitness/comments/1ohigf/my_personal_goal_has_been_met_and_boy_am_i/,72,67,1381818025.0
"People who ""help"" at the gym are actually really annoying",1se8zn,throway122,https://www.reddit.com/r/Fitness/comments/1se8zn/people_who_help_at_the_gym_are_actually_really/,10,101,1386524899.0
My personal experiences with a wide variety of fat burning supplements,3nen05,yellow_pellow,https://www.reddit.com/r/Fitness/comments/3nen05/my_personal_experiences_with_a_wide_variety_of/,0,38,1443921735.0
5 Cardio Myths and Misconceptions that Need to Stop Being Spewed.,oh03pg,Bohner1,https://www.reddit.com/r/Fitness/comments/oh03pg/5_cardio_myths_and_misconceptions_that_need_to/,1259,745,1625850886.0
Does anyone know what this machine is called and what is is for?,1wncyn,devperez,https://www.reddit.com/r/Fitness/comments/1wncyn/does_anyone_know_what_this_machine_is_called_and/,7,24,1391181324.0
"Dude, just keep lifting and legs will follow I'm telling ya",gqdpt,ranza,http://i.imgur.com/rqPkq.jpg,0,68,1302830322.0
How to squat deeper and build more muscle without hurting your knees,2tykvp,badgolfer828,https://www.reddit.com/r/Fitness/comments/2tykvp/how_to_squat_deeper_and_build_more_muscle_without/,1140,853,1422451784.0
Should /r/fitness implement downvote hovertext?,m1fn7,None,https://www.reddit.com/r/Fitness/comments/m1fn7/should_rfitness_implement_downvote_hovertext/,11,35,1320506098.0
Nice app for capturing body transformation time line﻿,1bui00,dangalg,https://www.reddit.com/r/Fitness/comments/1bui00/nice_app_for_capturing_body_transformation_time/,0,21,1365330523.0
The Strongest Man in the World eats how much per day?! The Mountain's Workout and Food Plan. (Article from 2014).,3l6iy2,BoringNormalGuy,https://www.reddit.com/r/Fitness/comments/3l6iy2/the_strongest_man_in_the_world_eats_how_much_per/,0,47,1442416824.0
Diet Guide on r/Fitness FAQ - Overly Simplistic/Incorrect in Some Areas...?,2a5905,rushdy_worm,https://www.reddit.com/r/Fitness/comments/2a5905/diet_guide_on_rfitness_faq_overly/,2,89,1404829758.0
"It's my reddit birthday and I have lost 30 lbs!  Gimme my Karma! (ps- those are 34DD and yes, they are real)",gu6o1,bensgrl1974,http://i.imgur.com/6ZFsH.jpg,0,33,1303273655.0
Cool thing happened at the gym yesterday...,1xq9iu,moldontheceiling,https://www.reddit.com/r/Fitness/comments/1xq9iu/cool_thing_happened_at_the_gym_yesterday/,0,29,1392231035.0
"So, working legs is cool.",1m8edt,None,https://www.reddit.com/r/Fitness/comments/1m8edt/so_working_legs_is_cool/,0,143,1378968733.0
Is Bacon Healthy? Don't Be Stupid,25y0ji,AhmedF,https://www.reddit.com/r/Fitness/comments/25y0ji/is_bacon_healthy_dont_be_stupid/,3,88,1400510921.0
I lol'd for five fucking minutes,h4zxy,None,http://i.imgur.com/LJZgq.png,15,56,1304620049.0
"22 year old overweight woman, starting back at the gym after more than a year of almost no exercise. Any advice; machine use, eating advice, or any tips to help me get healthy again would be greatly appreciated!",2nrapq,Super-Sneaky-Spy,https://www.reddit.com/r/Fitness/comments/2nrapq/22_year_old_overweight_woman_starting_back_at_the/,4,49,1417270760.0
"Doing SS, my forearms cannot handle the weight.",18b70b,mkirklions,https://www.reddit.com/r/Fitness/comments/18b70b/doing_ss_my_forearms_cannot_handle_the_weight/,6,99,1360595014.0
"Would like to revisit the question of ""farmer strength""",adbu0f,None,https://www.reddit.com/r/Fitness/comments/adbu0f/would_like_to_revisit_the_question_of_farmer/,10,72,1546820587.0
"For those watching the debates right now, which Presidential candidate actually lifts? Whose policies will be more pro-swole?",11lrcm,brah-ntosaurus,https://www.reddit.com/r/Fitness/comments/11lrcm/for_those_watching_the_debates_right_now_which/,49,119,1350436921.0
do you look down upon people who don't workout?,22fq0j,None,https://www.reddit.com/r/Fitness/comments/22fq0j/do_you_look_down_upon_people_who_dont_workout/,271,528,1396888525.0
"This will most likely get downvoted to hell, but I just wanted to say that, for a beginner, you are a fantastic community.",iqnyw,CalebMadison,https://www.reddit.com/r/Fitness/comments/iqnyw/this_will_most_likely_get_downvoted_to_hell_but_i/,0,6,1310756791.0
"Ok, let's cut the shit: self-esteem and health and feeling better and all that jazz is great and everything, but THIS is the real reason I go to the gym, and I suspect it's the main reason, or at least one of them, for most of the other guys in this subreddit.",h6h2r,ohstrangeone,http://i.imgur.com/WKp5G.jpg,20,65,1304825410.0
Is it ok to do legs 3 days a week?,1bqu4h1,Tarotcards444,https://www.reddit.com/r/Fitness/comments/1bqu4h1/is_it_ok_to_do_legs_3_days_a_week/,49,259,1711731247.0
"1 and 1/3 year progress (M, 17, 5'4, 117lbs~-143lbs), and debunking common misconceptions",32d4ss,Scatcycle,https://www.reddit.com/r/Fitness/comments/32d4ss/1_and_13_year_progress_m_17_54_117lbs143lbs_and/,7,82,1428869356.0
Self-Promotion Saturday,45jnud,AutoModerator,https://www.reddit.com/r/Fitness/comments/45jnud/selfpromotion_saturday/,2,50,1455357617.0
"my gym opens oct 1, check out a picture of me working on it!!",ktzpo,abeuntstudiainmores,https://www.reddit.com/r/Fitness/comments/ktzpo/my_gym_opens_oct_1_check_out_a_picture_of_me/,36,197,1317210113.0
Ate an entire Pizza from pizza hut tonight :(,3emrkd,White_Mocha,https://www.reddit.com/r/Fitness/comments/3emrkd/ate_an_entire_pizza_from_pizza_hut_tonight/,0,57,1437886499.0
"Due to the recent influx of form check videos, I created a subreddit for that, /r/formcheck. We need both experienced and beginner lifters to help here!",fwgkl,xmnstr,http://www.reddit.com/r/formcheck/,0,16,1299149333.0
Meeting Elliot Hulse IRL... Dat Farce,27m7zw,RZFitnessTV,https://www.reddit.com/r/Fitness/comments/27m7zw/meeting_elliot_hulse_irl_dat_farce/,1,20,1402234540.0
How To Increase Lung Capacity,1bqgju,AhmedF,https://www.reddit.com/r/Fitness/comments/1bqgju/how_to_increase_lung_capacity/,1,42,1365172640.0
The Bruce Lee Diet,13ec0x,None,https://www.reddit.com/r/Fitness/comments/13ec0x/the_bruce_lee_diet/,9,55,1353246673.0
How not to pick up women at the gym...,esgk7,notochord,https://www.reddit.com/r/Fitness/comments/esgk7/how_not_to_pick_up_women_at_the_gym/,9,67,1293523634.0
Abuse at the gym,20whyx,Square_Boob,https://www.reddit.com/r/Fitness/comments/20whyx/abuse_at_the_gym/,989,1206,1395323654.0
Meet Vegan Bodybuilder Jim Morris,2edczd,michellerosado,https://www.reddit.com/r/Fitness/comments/2edczd/meet_vegan_bodybuilder_jim_morris/,1,30,1408808104.0
Are breadloaf abs a common thing?,3lfeib,Weiner_Takes_All,https://www.reddit.com/r/Fitness/comments/3lfeib/are_breadloaf_abs_a_common_thing/,35,52,1442581179.0
Help me iron out a problem in my squat. Please don't post if you're an idiot (no offense to any idiots out there).,i7t8g,None,https://www.reddit.com/r/Fitness/comments/i7t8g/help_me_iron_out_a_problem_in_my_squat_please/,0,25,1308888655.0
"This guy needs help. This is absolutely heart breaking. Can someone here help this man?

x/post from /r/videos",qe20w,None,https://www.reddit.com/r/Fitness/comments/qe20w/this_guy_needs_help_this_is_absolutely_heart/,0,36,1330663596.0
This morning's OHP [rage comic],gzajx,eyal0,http://imgur.com/qKcF8.png,0,11,1303997836.0
"We know that crunches and sit-ups are bad for the spine, but why is the reverse crunch deemed safe?",7v1pmx,CellularGarrison,https://www.reddit.com/r/Fitness/comments/7v1pmx/we_know_that_crunches_and_situps_are_bad_for_the/,236,189,1517688371.0
No gym for home,1k58fy,Becoming_Epic,https://www.reddit.com/r/Fitness/comments/1k58fy/no_gym_for_home/,948,236,1376231967.0
Living in the age of the Matrix,heetz,collinstm,http://i.imgur.com/ixZ4j.png,9,12,1305744834.0
Working out while high.,1qhcvm,gnexus89,https://www.reddit.com/r/Fitness/comments/1qhcvm/working_out_while_high/,7,81,1384289272.0
The bottom line with Crossfit is.....,ehnkm,dirksmiley,https://www.reddit.com/r/Fitness/comments/ehnkm/the_bottom_line_with_crossfit_is/,0,41,1291731007.0
"Why do obese people who lose weight receive so much recognition, whereas skinny people who bulk up get tossed to the side?",2uyfxl,Lurkinalldayy,https://www.reddit.com/r/Fitness/comments/2uyfxl/why_do_obese_people_who_lose_weight_receive_so/,61,299,1423199950.0
Dangers of Mixed Grip Deadlifting,t51ig,meh_33333,https://www.reddit.com/r/Fitness/comments/t51ig/dangers_of_mixed_grip_deadlifting/,5,203,1336051391.0
20 alternatives to SS,scv25,20alternativestoss,https://www.reddit.com/r/Fitness/comments/scv25/20_alternatives_to_ss/,2,24,1334605060.0
"30 Things I Wish I Would Have Known About Working Out, Nutrition, and Life Before I Turned 30 - Martin Rooney",1r3y4j,AhmedF,https://www.reddit.com/r/Fitness/comments/1r3y4j/30_things_i_wish_i_would_have_known_about_working/,47,28,1385001123.0
"Don't y'all wish there was a protein filled, zero carb, zero fat tasty snack that's only 50 calories per serving?  Because it exists.",1ageri,that-freakin-guy,https://www.reddit.com/r/Fitness/comments/1ageri/dont_yall_wish_there_was_a_protein_filled_zero/,9,26,1363506005.0
I Am Unbreakable,19zadq,Arthien,https://www.reddit.com/r/Fitness/comments/19zadq/i_am_unbreakable/,0,8,1362852795.0
"A woman's guide to the ""Ottermode"" chart.",dae9r,Crispie_Critters,http://i.imgur.com/znjFO.jpg,0,46,1283820819.0
I just benched 135. ,lh32r,SriLanka,https://www.reddit.com/r/Fitness/comments/lh32r/i_just_benched_135/,30,41,1318994857.0
How do YOU know you are doing it correctly?,oys3x,schlieeefen,https://www.reddit.com/r/Fitness/comments/oys3x/how_do_you_know_you_are_doing_it_correctly/,4,45,1327642797.0
Why do so many people think that aerobic exercise will help someone lose weight faster than resistance training?,alwr7j,redditaccountforants,https://www.reddit.com/r/Fitness/comments/alwr7j/why_do_so_many_people_think_that_aerobic_exercise/,5,102,1548984970.0
"I got made fun of for exercising, should I care? ",1ab9ut,Thatonegirl1,https://www.reddit.com/r/Fitness/comments/1ab9ut/i_got_made_fun_of_for_exercising_should_i_care/,210,356,1363299772.0
why is it so difficult to find a fit SO?,22gu29,antone1101,https://www.reddit.com/r/Fitness/comments/22gu29/why_is_it_so_difficult_to_find_a_fit_so/,8,106,1396911595.0
Can we agree to stop being such creepers toward women?,1oxilj,None,https://www.reddit.com/r/Fitness/comments/1oxilj/can_we_agree_to_stop_being_such_creepers_toward/,1696,1177,1382390839.0
"[PSA] The terms ""cut"" and ""bulk"" are not relevant to novice weight lifters. Beginner programs have built-in nutrition guidelines.",1s5xz8,JSCMI,https://www.reddit.com/r/Fitness/comments/1s5xz8/psa_the_terms_cut_and_bulk_are_not_relevant_to/,0,26,1386257227.0
Despite daily strength training I'm not fit enough for WW2,xth4n,swizec,https://www.reddit.com/r/Fitness/comments/xth4n/despite_daily_strength_training_im_not_fit_enough/,8,60,1344338812.0
PSA: READ THE FAQ! THERE IS EVEN A LITTLE SIGN POSTED AT THE TOP OF THE FRONT PAGE!,1088sw,None,https://www.reddit.com/r/Fitness/comments/1088sw/psa_read_the_faq_there_is_even_a_little_sign/,136,179,1348194902.0
Self-Promotion Saturday,3o7dax,AutoModerator,https://www.reddit.com/r/Fitness/comments/3o7dax/selfpromotion_saturday/,0,51,1444471349.0
"Love Single Stiff Legged Snatch Grip Dumbbell Speed Deadlifts™? Sub to /r/TrueNecromancers, a new subreddit specifically for Single Stiff Legged Snatch Grip Dumbbell Speed Deadlifts™!",1pn47x,Mogwoggle,https://www.reddit.com/r/Fitness/comments/1pn47x/love_single_stiff_legged_snatch_grip_dumbbell/,21,20,1383252387.0
Is it true that trap bar deadlift is more dangerous than a straight bar deadlift?,d2vw5r,SomeoneAlt,https://www.reddit.com/r/Fitness/comments/d2vw5r/is_it_true_that_trap_bar_deadlift_is_more/,0,42,1568231522.0
Thank you /r/fitness!,1fipjz,Lost_and_never_found,https://www.reddit.com/r/Fitness/comments/1fipjz/thank_you_rfitness/,1,4,1370182981.0
What do guys think of girls who actually know what they’re doing in the gym?,wsjd6,noraindelay,https://www.reddit.com/r/Fitness/comments/wsjd6/what_do_guys_think_of_girls_who_actually_know/,0,106,1342660363.0
This is why I hate cheat days/meals,2d2dfg,perwahloo,https://www.reddit.com/r/Fitness/comments/2d2dfg/this_is_why_i_hate_cheat_daysmeals/,43,57,1407588096.0
"How Bruce Lee Ruined the World (An Anecdote of Myofibrillar Hypertrophy, Sarcoplasmic Hypertrophy, and Other Random Brain Flatulence)",1i7zvl,AhmedF,https://www.reddit.com/r/Fitness/comments/1i7zvl/how_bruce_lee_ruined_the_world_an_anecdote_of/,0,6,1373730852.0
Bicep Curls - Training to Failure?,250voj,mzltv,https://www.reddit.com/r/Fitness/comments/250voj/bicep_curls_training_to_failure/,2,24,1399533233.0
Stereotypes being turned around daily.,1wtemo,Dom369,https://www.reddit.com/r/Fitness/comments/1wtemo/stereotypes_being_turned_around_daily/,0,13,1391360827.0
"Hello /r/fitness, I know it isn't Sunday yet but may I please share my personal victory a little early?",1nq45l,stajmw,https://www.reddit.com/r/Fitness/comments/1nq45l/hello_rfitness_i_know_it_isnt_sunday_yet_but_may/,1,17,1380897291.0
"Love deadlifts? Sub to /r/Necromancers, a new subreddit specifically for deadlifts!",1pmj3m,Antranik,https://www.reddit.com/r/Fitness/comments/1pmj3m/love_deadlifts_sub_to_rnecromancers_a_new/,0,34,1383238617.0
"Girl made me take off my shirt, looked at me, and said ""And that's why I'm not a lesbian"".  What moments have made being fit worth it to you?",13v6hi,Crushinated,https://www.reddit.com/r/Fitness/comments/13v6hi/girl_made_me_take_off_my_shirt_looked_at_me_and/,18,120,1354006022.0
Self-Promotion Saturday,4qwoke,AutoModerator,https://www.reddit.com/r/Fitness/comments/4qwoke/selfpromotion_saturday/,0,40,1467453741.0
"Marijuana and lifting, our journey/how-to guide",1cngxu,hetzle,https://www.reddit.com/r/Fitness/comments/1cngxu/marijuana_and_lifting_our_journeyhowto_guide/,12,47,1366337358.0
Hey Fitit - does anyone else think the 'gym' polaroid at the top right isn't representative of /r/fitness?,f0fzg,Agnostix,https://www.reddit.com/r/Fitness/comments/f0fzg/hey_fitit_does_anyone_else_think_the_gym_polaroid/,6,39,1294779200.0
"From flab to fit! My progress pics! and ladies, I'm single! (Slightly NSFW after pics)",z054u,None,https://www.reddit.com/r/Fitness/comments/z054u/from_flab_to_fit_my_progress_pics_and_ladies_im/,41,122,1346214158.0
"I eat like 2 egg yolks a day, everyday.  Am I going to die?",ld76x,CrabbyPatties23,https://www.reddit.com/r/Fitness/comments/ld76x/i_eat_like_2_egg_yolks_a_day_everyday_am_i_going/,29,186,1318692378.0
I'm 5'5 and half asian looking for some motivation?,4av33u,RandomBellend,https://www.reddit.com/r/Fitness/comments/4av33u/im_55_and_half_asian_looking_for_some_motivation/,1,61,1458248023.0
Just signed up for a 100 mi cycling race. I've got one month to train.,1h9hkg,None,https://www.reddit.com/r/Fitness/comments/1h9hkg/just_signed_up_for_a_100_mi_cycling_race_ive_got/,0,51,1372443874.0
My 5 year transformation,3mictb,tgrub1,https://www.reddit.com/r/Fitness/comments/3mictb/my_5_year_transformation/,7,37,1443302813.0
Biggest Gym Pet Peeve?,1ryuhi,cromano923,https://www.reddit.com/r/Fitness/comments/1ryuhi/biggest_gym_pet_peeve/,0,207,1386042811.0
Before and after photos of joggers ,izgb7,jeremiahwarren,https://www.reddit.com/r/Fitness/comments/izgb7/before_and_after_photos_of_joggers/,37,61,1311622506.0
From Squash to Strongman 2.5 years progress,7h8io4,BloominStrong,https://www.reddit.com/r/Fitness/comments/7h8io4/from_squash_to_strongman_25_years_progress/,11,19,1512287568.0
Vegan Bodybuiding - In case anyone loves animals...link inside,oi3q4,SpankmasterS,https://www.reddit.com/r/Fitness/comments/oi3q4/vegan_bodybuiding_in_case_anyone_loves/,7,34,1326647643.0
"Is there a way to lose weight from your face, or is it a percentage body fat thing?",11ssgs,redonculous,https://www.reddit.com/r/Fitness/comments/11ssgs/is_there_a_way_to_lose_weight_from_your_face_or/,0,23,1350745912.0
"18, 6'3 315lbs and No idea where to start!",2h1a6a,X_REDNECK,https://www.reddit.com/r/Fitness/comments/2h1a6a/18_63_315lbs_and_no_idea_where_to_start/,21,60,1411309320.0
3 Years Ago Today - A Legend Was Taken To Early,2cojpp,Imnotmitchos,https://www.reddit.com/r/Fitness/comments/2cojpp/3_years_ago_today_a_legend_was_taken_to_early/,2,28,1407240617.0
From 216 (fat) ---> 150lbs (lean muscle) in 6 months,47r4od,NotSoHastyHobbit,https://www.reddit.com/r/Fitness/comments/47r4od/from_216_fat_150lbs_lean_muscle_in_6_months/,17,90,1456518599.0
Why is fittit obsessed with threads about fittit being obsessed with things?,e8pg5,threewhitelights,https://www.reddit.com/r/Fitness/comments/e8pg5/why_is_fittit_obsessed_with_threads_about_fittit/,0,42,1290183908.0
Fittit: we know you're out of shape and want to look better. Please do some basic research before asking for help.,cq43o,bentreflection,https://www.reddit.com/r/Fitness/comments/cq43o/fittit_we_know_youre_out_of_shape_and_want_to/,8,42,1279242140.0
What a year and a half of commitment feels like!,1f9uwa,None,https://www.reddit.com/r/Fitness/comments/1f9uwa/what_a_year_and_a_half_of_commitment_feels_like/,4,12,1369842107.0
New Chaos and Pain - Your Fat is Unequivocally Your Fault,v233d,None,https://www.reddit.com/r/Fitness/comments/v233d/new_chaos_and_pain_your_fat_is_unequivocally_your/,4,88,1339700263.0
Motivation. Dedication. Improvement. Collage (f) NSFW Oct28-Jan4th (included puppy progress too--he's getting so big!!),1ugiee,Infinitemistress,https://www.reddit.com/r/Fitness/comments/1ugiee/motivation_dedication_improvement_collage_f_nsfw/,0,60,1388928573.0
Self-Promotion Saturday,3fe6mu,AutoModerator,https://www.reddit.com/r/Fitness/comments/3fe6mu/selfpromotion_saturday/,14,45,1438423222.0
Why is checking your abs in a mirror in the gym bad?,2cced4,GotSomeJewellery,https://www.reddit.com/r/Fitness/comments/2cced4/why_is_checking_your_abs_in_a_mirror_in_the_gym/,22,214,1406908312.0
