Title,ID,Author,URL,Score,Comment Count,Created
"I think until basic nutrition is not taught in schools, obesity as a public health issue will never go away.",kw68ae,mayermail1977,https://www.reddit.com/r/nutrition/comments/kw68ae/i_think_until_basic_nutrition_is_not_taught_in/,2487,328,1610502690.0
Ireland's Supreme Court Rules Sandwiches in Subway 'too sugary to meet legal definition of being bread',j2npi7,Bluest_waters,https://www.reddit.com/r/nutrition/comments/j2npi7/irelands_supreme_court_rules_sandwiches_in_subway/,2076,120,1601477920.0
A study on nutrients in food concluded that we would have to eat 8 oranges to get the same amount of Vitamin A as our grandparents did with one orange because soil depletion has caused massive drops in nutrient levels in food. (Scientific American),uis73l,high_on_cosmos,https://www.reddit.com/r/nutrition/comments/uis73l/a_study_on_nutrients_in_food_concluded_that_we/,1914,161,1651736470.0
Just a reminder: Nutella is a garbage food.,bm4p24,imdjay,https://www.reddit.com/r/nutrition/comments/bm4p24/just_a_reminder_nutella_is_a_garbage_food/,1726,271,1557318708.0
Visualize your ancestors eating your food,ipw6xf,pbw,https://www.reddit.com/r/nutrition/comments/ipw6xf/visualize_your_ancestors_eating_your_food/,1596,104,1599710878.0
The food system in America is rigged and is legitimately an abomination to Humankind!,nlo73i,None,https://www.reddit.com/r/nutrition/comments/nlo73i/the_food_system_in_america_is_rigged_and_is/,1490,375,1622054429.0
I'd kill just to have ONE drive through with healthy meals.,1acvhko,Electronic-Mode-7760,https://www.reddit.com/r/nutrition/comments/1acvhko/id_kill_just_to_have_one_drive_through_with/,1490,357,1706420602.0
How the f**k did junk food become 90% of everybodys diets... within JUST half a century??,18udbbn,None,https://www.reddit.com/r/nutrition/comments/18udbbn/how_the_fk_did_junk_food_become_90_of_everybodys/,1387,536,1703934276.0
It seems like everyone is obsessed with calories and not the actual ingredients in foods/drinks,jdxfcw,leelbeach,https://www.reddit.com/r/nutrition/comments/jdxfcw/it_seems_like_everyone_is_obsessed_with_calories/,1180,234,1603093334.0
WHY ARE THERR SO MANY JUNK FOOD RESTAURANTS AND HARDLY ANY HEALTHY ESTABLISHMENTS??,ph8jy4,BlessedAF777,https://www.reddit.com/r/nutrition/comments/ph8jy4/why_are_therr_so_many_junk_food_restaurants_and/,1102,344,1630686334.0
"New nutrition label laws will now include an ""added sugars"" section on products. Also increased more realistic serving sizes.",bao3vk,flaxseed1,https://www.reddit.com/r/nutrition/comments/bao3vk/new_nutrition_label_laws_will_now_include_an/,1062,112,1554689243.0
"Sugary drink sales in Philadelphia fall 38% after city adopted soda tax, study finds",dcvr97,AntonJedno23533,https://www.reddit.com/r/nutrition/comments/dcvr97/sugary_drink_sales_in_philadelphia_fall_38_after/,1047,187,1570130818.0
Easiest way to clean up your diet.,hhilhc,None,https://www.reddit.com/r/nutrition/comments/hhilhc/easiest_way_to_clean_up_your_diet/,944,197,1593365792.0
USDA will allow chickens to be processed and sold that were diseased,ifshcy,flaxseed1,https://www.reddit.com/r/nutrition/comments/ifshcy/usda_will_allow_chickens_to_be_processed_and_sold/,935,75,1598287130.0
"New FDA guideline to require 2 food label columns for single serving, whole package",ej47oy,None,https://www.reddit.com/r/nutrition/comments/ej47oy/new_fda_guideline_to_require_2_food_label_columns/,925,97,1577998846.0
"Is this a placebo, or is ginger tea really this amazing?",kal4h7,None,https://www.reddit.com/r/nutrition/comments/kal4h7/is_this_a_placebo_or_is_ginger_tea_really_this/,885,192,1607625555.0
Why is proper nutrition so unimportant and unstressed in modern society considering the near pandemic levels of obesity?,z10utw,Worf-,https://www.reddit.com/r/nutrition/comments/z10utw/why_is_proper_nutrition_so_unimportant_and/,833,373,1669042297.0
What foods are highly nutritious that we should eat more of?,18on13a,blueduck301,https://www.reddit.com/r/nutrition/comments/18on13a/what_foods_are_highly_nutritious_that_we_should/,802,505,1703273789.0
Unpopular Opinion: You're getting enough nutrients,jo112m,thetransportedman,https://www.reddit.com/r/nutrition/comments/jo112m/unpopular_opinion_youre_getting_enough_nutrients/,801,246,1604511434.0
What is a food you were surprised to learn is crazy high in some nutrient?,oadz3i,macros_and_micros,https://www.reddit.com/r/nutrition/comments/oadz3i/what_is_a_food_you_were_surprised_to_learn_is/,799,561,1624990613.0
What’s one single change that you made that changed your health for the better?,1bpvmj7,princesscorgi2,https://www.reddit.com/r/nutrition/comments/1bpvmj7/whats_one_single_change_that_you_made_that/,791,892,1711632487.0
a meta-analysis showed how eating just a (raw) carrot a day could reduce a man's chances of developing prostate cancer by 50%,hbidpq,Snuggly-Muffin,https://www.reddit.com/r/nutrition/comments/hbidpq/a_metaanalysis_showed_how_eating_just_a_raw/,791,135,1592499072.0
US obesity rate is currently 40% but experts predict by 2030 half of all Americans will be obese.,cb2y57,flaxseed1,https://www.reddit.com/r/nutrition/comments/cb2y57/us_obesity_rate_is_currently_40_but_experts/,778,262,1562688875.0
Tea contains three anti cancer molecules which work synergistically together. The anti cancer mechanism of each molecule is different and thus they complement each other.,md2xl1,Bluest_waters,https://www.reddit.com/r/nutrition/comments/md2xl1/tea_contains_three_anti_cancer_molecules_which/,774,153,1616691510.0
Men eating Mediterranean style diet fart seven times more than men eating a high fat western style diet,zobijg,Czarben,https://www.reddit.com/r/nutrition/comments/zobijg/men_eating_mediterranean_style_diet_fart_seven/,745,165,1671298709.0
“ChatGPT beats 95% of nutrition & health influencers”,110yx7g,EDXE47_,https://www.reddit.com/r/nutrition/comments/110yx7g/chatgpt_beats_95_of_nutrition_health_influencers/,727,94,1676261140.0
Anybody looking for a free nutrition course?,gclitz,i-love-each-other,https://www.reddit.com/r/nutrition/comments/gclitz/anybody_looking_for_a_free_nutrition_course/,718,55,1588485048.0
Why do so many American foods feel the need to add sugar/corn syrup to so many packaged foods?,kkc7oc,None,https://www.reddit.com/r/nutrition/comments/kkc7oc/why_do_so_many_american_foods_feel_the_need_to/,716,177,1608955620.0
Why Mustard might be the healthiest condiment,nh8qrs,BrotherBringTheSun,https://www.reddit.com/r/nutrition/comments/nh8qrs/why_mustard_might_be_the_healthiest_condiment/,713,182,1621537805.0
**Big heads up for all those who consume & cook with avocado oil** Study Finds 82 Percent of Avocado Oil Rancid or Mixed With Other Oils,k5945a,None,https://www.reddit.com/r/nutrition/comments/k5945a/big_heads_up_for_all_those_who_consume_cook_with/,711,125,1606915364.0
Canada's new food guide was revealed this morning,aio62c,poutipoutine,https://www.reddit.com/r/nutrition/comments/aio62c/canadas_new_food_guide_was_revealed_this_morning/,685,170,1548172541.0
Why is the science of nutrition ignored in medicine (not taught in medical school)?,nchic6,new_minimalist1,https://www.reddit.com/r/nutrition/comments/nchic6/why_is_the_science_of_nutrition_ignored_in/,658,162,1621022373.0
Is it possible to find unbiased science based nutrition online? Why are everyone trying to revolutionize the way we eat?,mifmif,thehumanmachine,https://www.reddit.com/r/nutrition/comments/mifmif/is_it_possible_to_find_unbiased_science_based/,657,305,1617350080.0
It seems that eliminating sugar is the single thing everyone can agree on,akxyuv,lordoftrousers,https://www.reddit.com/r/nutrition/comments/akxyuv/it_seems_that_eliminating_sugar_is_the_single/,660,396,1548749737.0
A new study out of Harvard shows sugar sweetened drinks can increase chances of mortality by as much as 31%. Artificially sweetened drinks decreased mortality in moderation.,b4d02d,flaxseed1,https://www.reddit.com/r/nutrition/comments/b4d02d/a_new_study_out_of_harvard_shows_sugar_sweetened/,643,127,1553302748.0
I thought it was normal to want to fall asleep after every meal,j7h35p,tincock,https://www.reddit.com/r/nutrition/comments/j7h35p/i_thought_it_was_normal_to_want_to_fall_asleep/,636,179,1602177164.0
I made a graph: Protein per 100 calories,abn7lx,yvrcribs,https://www.reddit.com/r/nutrition/comments/abn7lx/i_made_a_graph_protein_per_100_calories/,631,158,1546384695.0
Study: Children on vegan diets are shorter than average,vhddus,turrek84,https://www.reddit.com/r/nutrition/comments/vhddus/study_children_on_vegan_diets_are_shorter_than/,624,332,1655818193.0
"Store your veg the right way to last longer, decrease grocery trips, and save money.",fofloi,Dejohns2,https://www.reddit.com/r/nutrition/comments/fofloi/store_your_veg_the_right_way_to_last_longer/,626,87,1585092231.0
"How did breakfast go from being the most important meal of the day to being skipped regularly as part of intermittent fasting, etc.?",yrm54a,navteq48,https://www.reddit.com/r/nutrition/comments/yrm54a/how_did_breakfast_go_from_being_the_most/,621,215,1668101830.0
"1lb fat is not always equal to 3,500 calories",iufa3r,None,https://www.reddit.com/r/nutrition/comments/iufa3r/1lb_fat_is_not_always_equal_to_3500_calories/,619,138,1600330542.0
"Does drinking a bunch of water at once to ""catch up"" for the day give you the same hydration as drinking steadily throughout the day?",v1us5l,St0rytime,https://www.reddit.com/r/nutrition/comments/v1us5l/does_drinking_a_bunch_of_water_at_once_to_catch/,607,198,1654016159.0
Is there a link between gut health and mental health?,gtftu2,birdy_tech,https://www.reddit.com/r/nutrition/comments/gtftu2/is_there_a_link_between_gut_health_and_mental/,611,145,1590851485.0
"UN Report: Climate Crisis is making food less nutritious, more scarce, and more expensive. Wheat grown at high carbon dioxide levels, for example, will offer 6-13% less protein, 4-7% less zinc and 5-8% less iron, according to experiments done with these plants.",co26w2,Bluest_waters,https://www.reddit.com/r/nutrition/comments/co26w2/un_report_climate_crisis_is_making_food_less/,598,78,1565356374.0
Why is nutrition still a debate and is so confusing?,hxjv7b,ZY0Ns,https://www.reddit.com/r/nutrition/comments/hxjv7b/why_is_nutrition_still_a_debate_and_is_so/,599,333,1595668601.0
Why were people back in the day so thin?,19e2k7l,Sea-Professional-804,https://www.reddit.com/r/nutrition/comments/19e2k7l/why_were_people_back_in_the_day_so_thin/,590,727,1706052935.0
You are What you Eat - Netflix,18zlku4,raleighnative,https://www.reddit.com/r/nutrition/comments/18zlku4/you_are_what_you_eat_netflix/,587,513,1704498769.0
Four reasons why you probably eat more (or less) calories than you might think,aome35,lorty,https://www.reddit.com/r/nutrition/comments/aome35/four_reasons_why_you_probably_eat_more_or_less/,585,122,1549667758.0
If you eat fiber before consuming alcohol and sugar will you limit the amount of fat that will be stored as visceral fat,inlzen,andyduly,https://www.reddit.com/r/nutrition/comments/inlzen/if_you_eat_fiber_before_consuming_alcohol_and/,585,94,1599398859.0
"A study from the University of Exeter has found that mycoprotein, the protein-rich food source that is unique to Quorn products, stimulates post-exercise muscle building to a greater extent than milk protein",goth1h,Snuggly-Muffin,https://www.reddit.com/r/nutrition/comments/goth1h/a_study_from_the_university_of_exeter_has_found/,581,94,1590187170.0
"You don't have to eat LESS, you just have to eat RIGHT",x4l91y,gynxeng,https://www.reddit.com/r/nutrition/comments/x4l91y/you_dont_have_to_eat_less_you_just_have_to_eat/,578,196,1662178517.0
What are some nutrition hot takes you absolutely hate seeing?,1dqea8t,SensitiveRough6210,https://www.reddit.com/r/nutrition/comments/1dqea8t/what_are_some_nutrition_hot_takes_you_absolutely/,571,591,1719561251.0
What nutritional change has made the most difference to you?,j08ksk,doucelag,https://www.reddit.com/r/nutrition/comments/j08ksk/what_nutritional_change_has_made_the_most/,566,550,1601136037.0
"If cucumbers are 96% water, is there any reason I shouldn't just eat a cucumber instead of drinking the equivalent amount of water?",12xzb6h,AlmostAntarctic,https://www.reddit.com/r/nutrition/comments/12xzb6h/if_cucumbers_are_96_water_is_there_any_reason_i/,564,458,1682376129.0
Using ChatGPT to clean up left overs,10t0dpq,Pokestralian,https://www.reddit.com/r/nutrition/comments/10t0dpq/using_chatgpt_to_clean_up_left_overs/,560,32,1675471239.0
Is the obesity crisis in America at least partially due to the fact that humans don’t need as many calories a day as they used to anymore and people’s diets just haven’t shrunk to accommodate?,owrkhz,Portalrules123,https://www.reddit.com/r/nutrition/comments/owrkhz/is_the_obesity_crisis_in_america_at_least/,544,292,1627949826.0
Holiday eating,eforuc,Femmiganza,https://www.reddit.com/r/nutrition/comments/eforuc/holiday_eating/,542,61,1577323349.0
Is it healthier to eat healthy and live a stressful live or eat unhealthy and live a stress free life?,j123pv,psychosil444,https://www.reddit.com/r/nutrition/comments/j123pv/is_it_healthier_to_eat_healthy_and_live_a/,540,166,1601252990.0
"Resources for leaning WHAT and WHY your body needs, instead of just lists of ""healthy"" foods?",naoxgk,Jcorb,https://www.reddit.com/r/nutrition/comments/naoxgk/resources_for_leaning_what_and_why_your_body/,540,83,1620826867.0
What are some wildly accepted facts which you know are not true?,jshlzu,josiegfk,https://www.reddit.com/r/nutrition/comments/jshlzu/what_are_some_wildly_accepted_facts_which_you/,537,670,1605132386.0
What's foods do people usually think is unhealthy but is actually good for you?,pot6ac,tiLT__,https://www.reddit.com/r/nutrition/comments/pot6ac/whats_foods_do_people_usually_think_is_unhealthy/,541,647,1631722182.0
"Consumption of repeatedly heated vegetable oil by rates caused ""significant damage"" in the small intestines, colon and liver. Damage likely caused by formation of destructive reactive oxygen species. RE: Relates to eating french fries or any deep fried food from a restaurant.",ll9ih4,Bluest_waters,https://www.reddit.com/r/nutrition/comments/ll9ih4/consumption_of_repeatedly_heated_vegetable_oil_by/,540,100,1613498341.0
What are so many doctors lacking nutrition knowledge?,mcdhlm,different_emphasis,https://www.reddit.com/r/nutrition/comments/mcdhlm/what_are_so_many_doctors_lacking_nutrition/,536,200,1616612006.0
What vitamins made the biggest difference in your health?,1cfc3ik,not1nterest1ng,https://www.reddit.com/r/nutrition/comments/1cfc3ik/what_vitamins_made_the_biggest_difference_in_your/,531,395,1714325987.0
Vegan Documentaries have ruined me,pra27z,None,https://www.reddit.com/r/nutrition/comments/pra27z/vegan_documentaries_have_ruined_me/,532,349,1632065344.0
U.S. federal bill H.R. 1887 could establish a National Institute of Nutrition within the National Institutes of Health,jbptys,EmelaJosa,https://www.reddit.com/r/nutrition/comments/jbptys/us_federal_bill_hr_1887_could_establish_a/,526,45,1602776111.0
"Onions and Garlic are in almost every recipe, no matter what culture. Is there a nutritional reason why we crave them so much?",d10o0b,None,https://www.reddit.com/r/nutrition/comments/d10o0b/onions_and_garlic_are_in_almost_every_recipe_no/,530,151,1567885602.0
What is one food that if eaten could drastically help improve the health of many people?,11y1tec,None,https://www.reddit.com/r/nutrition/comments/11y1tec/what_is_one_food_that_if_eaten_could_drastically/,521,631,1679447582.0
Stevia doesn't have to be listed as an ingredient now?,hzh5xg,Chen__Bot,https://www.reddit.com/r/nutrition/comments/hzh5xg/stevia_doesnt_have_to_be_listed_as_an_ingredient/,519,135,1595951761.0
For all who are the SUPER nutrition nuts: what does a normal day of eating for you and why?,lsl0ex,platypusking22,https://www.reddit.com/r/nutrition/comments/lsl0ex/for_all_who_are_the_super_nutrition_nuts_what/,519,432,1614298494.0
"Eat 14 servings of the sardines and you will have eaten around the same weight as one plastic straw. A grain of rice weighs about 30 mg, roughly the amount of plastic found in a sardine.",inwrrx,Droyk,https://www.reddit.com/r/nutrition/comments/inwrrx/eat_14_servings_of_the_sardines_and_you_will_have/,520,132,1599436042.0
"If you had to pick 5+ things you very strongly think everyone should include in their diet as well as 5+ things you strongly recommend people not eat at all, what would they be?",fdc1w8,samandraaa,https://www.reddit.com/r/nutrition/comments/fdc1w8/if_you_had_to_pick_5_things_you_very_strongly/,521,501,1583323659.0
Trigger Words That Let You Know When to Take Nutrition Advice with grain of Salt?,gpj3dr,LiKenun,https://www.reddit.com/r/nutrition/comments/gpj3dr/trigger_words_that_let_you_know_when_to_take/,514,265,1590293175.0
"Sardinians, renowned for a propensity to live to 100 and beyond, want formal recognition for the island's unique diet",t9kwiy,rugbyvolcano,https://www.reddit.com/r/nutrition/comments/t9kwiy/sardinians_renowned_for_a_propensity_to_live_to/,516,116,1646757613.0
Do you have a single food item that completely changed your life and led you to pursue nutrition?,n2di2o,Debber10,https://www.reddit.com/r/nutrition/comments/n2di2o/do_you_have_a_single_food_item_that_completely/,514,408,1619854033.0
You Are What You Eat: A Twin Experiment on Netflix,190grux,Jacinto1972,https://www.reddit.com/r/nutrition/comments/190grux/you_are_what_you_eat_a_twin_experiment_on_netflix/,503,540,1704592982.0
Why do prisoners come out so ripped but they definitely don’t get all the protein they need,1anrexl,ineedsleep5,https://www.reddit.com/r/nutrition/comments/1anrexl/why_do_prisoners_come_out_so_ripped_but_they/,498,378,1707601888.0
What is something people think is healthy but actually isn't?,q142rt,itaicool,https://www.reddit.com/r/nutrition/comments/q142rt/what_is_something_people_think_is_healthy_but/,500,968,1633349090.0
Why is there no definitive healthy Human Diet?,h7jxvp,None,https://www.reddit.com/r/nutrition/comments/h7jxvp/why_is_there_no_definitive_healthy_human_diet/,490,241,1591965525.0
"Overall, dietary changes could explain 57% of the total structural variation in gut microbiota whereas changes in genetics accounted for no more than 12%. This indicates that diet has a dominating role in shaping gut microbiota",b1npoy,Bluest_waters,https://www.reddit.com/r/nutrition/comments/b1npoy/overall_dietary_changes_could_explain_57_of_the/,492,55,1552704851.0
How would you reverse years of unhealthy living? ,1dhhlyh,cat-in-thebath,https://www.reddit.com/r/nutrition/comments/1dhhlyh/how_would_you_reverse_years_of_unhealthy_living/,489,315,1718572714.0
Why do people bash carbs?,iyznyu,None,https://www.reddit.com/r/nutrition/comments/iyznyu/why_do_people_bash_carbs/,484,411,1600962344.0
"If junk food is so caloric, why isnt it good for avoiding hunger?",j8j02p,Morbid-Analytic,https://www.reddit.com/r/nutrition/comments/j8j02p/if_junk_food_is_so_caloric_why_isnt_it_good_for/,467,107,1602329859.0
"If foods like lettuce are so nutritious and foods like chips are not as nutritious, why didn't all humans' taste buds evolve to prefer lettuce to chips?",qeamxv,quirkycurlygirly,https://www.reddit.com/r/nutrition/comments/qeamxv/if_foods_like_lettuce_are_so_nutritious_and_foods/,473,166,1635014137.0
What are some ordinary and overlooked superfoods?,wqkidm,noneofthefoxes,https://www.reddit.com/r/nutrition/comments/wqkidm/what_are_some_ordinary_and_overlooked_superfoods/,468,378,1660728652.0
"Sorry if this is gross... But when you eat food with 500 calories, do you actually get 500 calories? Or are some calories lost due to inefficiencies in the body processing it? Or how about feces?",9b6qrm,abedfilms,https://www.reddit.com/r/nutrition/comments/9b6qrm/sorry_if_this_is_gross_but_when_you_eat_food_with/,468,87,1535523449.0
"When I was a kid, my mom would give me lunch in a brown bag with either turkey, bologna, or tuna. I never had an ice pack. Wouldn't I have gotten food poisoning at some point?",ip508e,PregnantMexicanTeens,https://www.reddit.com/r/nutrition/comments/ip508e/when_i_was_a_kid_my_mom_would_give_me_lunch_in_a/,466,103,1599608908.0
What's your nutritional dark horse/secret weapon?,txuqla,doucelag,https://www.reddit.com/r/nutrition/comments/txuqla/whats_your_nutritional_dark_horsesecret_weapon/,463,443,1649275087.0
What are some healthy foods you find luxurious?,rgk8ev,jennxxh,https://www.reddit.com/r/nutrition/comments/rgk8ev/what_are_some_healthy_foods_you_find_luxurious/,459,396,1639524034.0
Beans may be the very best thing you can eat for your microbiome. Here is why.,athyam,Bluest_waters,https://www.reddit.com/r/nutrition/comments/athyam/beans_may_be_the_very_best_thing_you_can_eat_for/,461,158,1550844195.0
Do you have examples of popular nutrition beliefs that are wrong?,l9zgb7,Hurtkopain,https://www.reddit.com/r/nutrition/comments/l9zgb7/do_you_have_examples_of_popular_nutrition_beliefs/,460,566,1612172185.0
What are small things that u think everyone should be doing to improve their health?,df6s77,Kayamarii,https://www.reddit.com/r/nutrition/comments/df6s77/what_are_small_things_that_u_think_everyone/,455,372,1570570810.0
The Western diet has nearly killed-off our ancestral microbiome,bvrrfu,QubitBob,https://www.reddit.com/r/nutrition/comments/bvrrfu/the_western_diet_has_nearly_killedoff_our/,457,65,1559436194.0
Are canned sardines the most underrated superfood?,out8m8,bramapuptra,https://www.reddit.com/r/nutrition/comments/out8m8/are_canned_sardines_the_most_underrated_superfood/,446,217,1627676878.0
What are some foods that are commonly thought of as unhealthy but are actually healthy for you?,lhuhbg,SLBMLQFBSNC,https://www.reddit.com/r/nutrition/comments/lhuhbg/what_are_some_foods_that_are_commonly_thought_of/,453,532,1613076840.0
Is 47g a lot of sugar?,k1o39w,totallylegitcanser,https://www.reddit.com/r/nutrition/comments/k1o39w/is_47g_a_lot_of_sugar/,448,117,1606427196.0
Are there any foods commonly believed to be healthy but really aren't?,j9v8rc,gottapoopASAP,https://www.reddit.com/r/nutrition/comments/j9v8rc/are_there_any_foods_commonly_believed_to_be/,444,602,1602523565.0
YSK: There is a common standard definition of processed foods that is used in academia called NOVA,j1v4dz,venuswasaflytrap,https://www.reddit.com/r/nutrition/comments/j1v4dz/ysk_there_is_a_common_standard_definition_of/,446,42,1601367298.0
"""You can't outrun a bad diet."" I've heard this is true.. but why?",j6n3hf,xoemily,https://www.reddit.com/r/nutrition/comments/j6n3hf/you_cant_outrun_a_bad_diet_ive_heard_this_is_true/,443,210,1602058530.0
Do you guys have any advice on how to stop sugar cravings?,jopaw8,durianmochis,https://www.reddit.com/r/nutrition/comments/jopaw8/do_you_guys_have_any_advice_on_how_to_stop_sugar/,435,256,1604604680.0
How do you personally tell if your gut micro biome is healthy?,1bbcmbx,salad_thrower20,https://www.reddit.com/r/nutrition/comments/1bbcmbx/how_do_you_personally_tell_if_your_gut_micro/,439,206,1710083657.0
What's ONE nutrition change you made that had a SURPRSINGLY BIG impact on your overall health?,1cab0hj,HakaLifeAndrew,https://www.reddit.com/r/nutrition/comments/1cab0hj/whats_one_nutrition_change_you_made_that_had_a/,430,454,1713793080.0
Why is red meat so bad? Isn’t it what we used to eat as hunters?,xsan6h,Fushigibama,https://www.reddit.com/r/nutrition/comments/xsan6h/why_is_red_meat_so_bad_isnt_it_what_we_used_to/,434,550,1664567225.0
How do people eat delicious food while staying thin?,n66oz4,CopainChevalier,https://www.reddit.com/r/nutrition/comments/n66oz4/how_do_people_eat_delicious_food_while_staying/,435,370,1620305961.0
Why are people so neurotic about artificial sweeteners,nwlxs9,Beginning-Sport9217,https://www.reddit.com/r/nutrition/comments/nwlxs9/why_are_people_so_neurotic_about_artificial/,436,371,1623326708.0
People who eat a moderate amount of carbohydrates live longer than those who consume either very high or very low amounts of carbs,atx1ur,Bluest_waters,https://www.reddit.com/r/nutrition/comments/atx1ur/people_who_eat_a_moderate_amount_of_carbohydrates/,432,76,1550938798.0
What’s healthier. Eating 300 calories of ice cream then running to burn off 300 calories or not eating anything and not running?,o36kn5,Socketlint,https://www.reddit.com/r/nutrition/comments/o36kn5/whats_healthier_eating_300_calories_of_ice_cream/,431,185,1624071343.0
"What supposedly ""healthy"" junk food have you been consuming without realizing it was junk food?",wwhro7,fostnharry,https://www.reddit.com/r/nutrition/comments/wwhro7/what_supposedly_healthy_junk_food_have_you_been/,426,622,1661342642.0
What nutritional information do you wish EVERYONE knew?,dvs1ms,hyperbeast01,https://www.reddit.com/r/nutrition/comments/dvs1ms/what_nutritional_information_do_you_wish_everyone/,424,465,1573653102.0
When and why did soy become the devil?,l6i7ze,macaronist,https://www.reddit.com/r/nutrition/comments/l6i7ze/when_and_why_did_soy_become_the_devil/,429,280,1611791686.0
What is the most important food you introduced in your diet that made most changes in your body and health?,zi0azf,Ok-Valuable594,https://www.reddit.com/r/nutrition/comments/zi0azf/what_is_the_most_important_food_you_introduced_in/,429,505,1670698551.0
"Is there a ""Golden Meal"": AKA a single meal that you can eat three times a day that fulfills all needed nutrition?",i0r4xy,None,https://www.reddit.com/r/nutrition/comments/i0r4xy/is_there_a_golden_meal_aka_a_single_meal_that_you/,426,256,1596133093.0
Is it a myth or fact: Fat cells never go away once created?,mmv31y,None,https://www.reddit.com/r/nutrition/comments/mmv31y/is_it_a_myth_or_fact_fat_cells_never_go_away_once/,422,207,1617898070.0
