Title,ID,Author,URL,Score,Comment Count,Created
"If wheat, rice, potatoes are all made of starch, why are they different?",wnm24d,iamacellularautomata,https://www.reddit.com/r/nutrition/comments/wnm24d/if_wheat_rice_potatoes_are_all_made_of_starch_why/,0,6,1660417526.0
this is going to sound very stupid but— are things like stevia and monk fruit *actually* 0 calories?,veiw7b,agisbored,https://www.reddit.com/r/nutrition/comments/veiw7b/this_is_going_to_sound_very_stupid_but_are_things/,1,9,1655481484.0
Vitamins in Nestlé products,tqgrd4,plrh-mc,https://www.reddit.com/r/nutrition/comments/tqgrd4/vitamins_in_nestlé_products/,0,9,1648494465.0
"Hey, I’ve been wondering this for a while now, but can you build muscle on a puréed diet?",tk1ve8,TheHorrorFright,https://www.reddit.com/r/nutrition/comments/tk1ve8/hey_ive_been_wondering_this_for_a_while_now_but/,0,7,1647952101.0
Does 5 servings of one fruit count as all of your 5 a day?,td8ktj,pilipdicthhh,https://www.reddit.com/r/nutrition/comments/td8ktj/does_5_servings_of_one_fruit_count_as_all_of_your/,1,16,1647183320.0
Nutrition Question,qnl7o4,Lord19_,https://www.reddit.com/r/nutrition/comments/qnl7o4/nutrition_question/,1,13,1636148006.0
Wich are the hacks/meaks you have to eat a lot in a calorie deficit?,pl131l,Lychee_Fluffy,https://www.reddit.com/r/nutrition/comments/pl131l/wich_are_the_hacksmeaks_you_have_to_eat_a_lot_in/,0,16,1631204515.0
"If an inactive person diets (cuts calories) do they lose fat or muscle first? If possible please provide sources for answer, such as studies.",p2k5wz,GregJamesDahlen,https://www.reddit.com/r/nutrition/comments/p2k5wz/if_an_inactive_person_diets_cuts_calories_do_they/,0,7,1628709948.0
What is the requirement/default carbohydrate percentage of humans when food is available?,osojrq,dokkblarr,https://www.reddit.com/r/nutrition/comments/osojrq/what_is_the_requirementdefault_carbohydrate/,0,10,1627398132.0
Finding a super healthy alternative to Heavy Cream.,n8zx5g,Tangentkoala,https://www.reddit.com/r/nutrition/comments/n8zx5g/finding_a_super_healthy_alternative_to_heavy_cream/,1,13,1620637194.0
Cheeseburger vs pizza for weight maintenance,lxww54,miamigirl101,https://www.reddit.com/r/nutrition/comments/lxww54/cheeseburger_vs_pizza_for_weight_maintenance/,0,8,1614896024.0
What do you think about herbalife?,lpac3j,Sorryformyfart,https://www.reddit.com/r/nutrition/comments/lpac3j/what_do_you_think_about_herbalife/,0,10,1613952533.0
differences between white sugar and caramelied white sugar,l3n6za,qarton,https://www.reddit.com/r/nutrition/comments/l3n6za/differences_between_white_sugar_and_caramelied/,0,8,1611444157.0
PH balanced water,l0qy33,1rockfish,https://www.reddit.com/r/nutrition/comments/l0qy33/ph_balanced_water/,0,9,1611083895.0
Can you be malnourished if you're actively gaining muscle?,jpr7bp,Fakeintligence,https://www.reddit.com/r/nutrition/comments/jpr7bp/can_you_be_malnourished_if_youre_actively_gaining/,0,19,1604757280.0
Should you cycle creatine,jmpmg7,notyouraverageroider,https://www.reddit.com/r/nutrition/comments/jmpmg7/should_you_cycle_creatine/,0,5,1604331354.0
Protein and Carbs.. Oh My,jcd8nw,olddawgsrule,https://www.reddit.com/r/nutrition/comments/jcd8nw/protein_and_carbs_oh_my/,0,14,1602866343.0
A drink that has no sugar and no caffeine?,j52x2j,cmprogrammers,https://www.reddit.com/r/nutrition/comments/j52x2j/a_drink_that_has_no_sugar_and_no_caffeine/,1,29,1601833024.0
Why is eating egg whites better than eating the whole egg with yolk?,ip7q37,MalangChic,https://www.reddit.com/r/nutrition/comments/ip7q37/why_is_eating_egg_whites_better_than_eating_the/,0,20,1599619147.0
Cattle milk and its effect on a baby,hj6cu8,Mr-MPSS,https://www.reddit.com/r/nutrition/comments/hj6cu8/cattle_milk_and_its_effect_on_a_baby/,0,12,1593592252.0
"With the increase use of pesticides and chemicals on vegetables and fruits, would it get so bad to the point where it’s not even worth it to consume them for vitamins, etc?",feq49n,None,https://www.reddit.com/r/nutrition/comments/feq49n/with_the_increase_use_of_pesticides_and_chemicals/,0,17,1583555481.0
"Ive pretty much given up regular milk, but is cheese as bad as milk?",f9b5tj,Critical50,https://www.reddit.com/r/nutrition/comments/f9b5tj/ive_pretty_much_given_up_regular_milk_but_is/,1,19,1582641425.0
I read to avoid breads. Are Rye bread healthy?,ecu080,None,https://www.reddit.com/r/nutrition/comments/ecu080/i_read_to_avoid_breads_are_rye_bread_healthy/,0,20,1576766139.0
Pros and Cons biologically of OMAD vs Intermittent fasting? Which is better overall?,dwarfa,dannydsan,https://www.reddit.com/r/nutrition/comments/dwarfa/pros_and_cons_biologically_of_omad_vs/,1,11,1573744099.0
Are any of you obsessed with superfoods?,cnp6lq,JohnOnWheels,https://www.reddit.com/r/nutrition/comments/cnp6lq/are_any_of_you_obsessed_with_superfoods/,0,6,1565286233.0
Is it possible to get all the nutrients you need by living off steam and refried beans?,cal5jb,Terror_of_Texas,https://www.reddit.com/r/nutrition/comments/cal5jb/is_it_possible_to_get_all_the_nutrients_you_need/,1,12,1562593193.0
Question about oatmeal,buu470,Starfinger10,https://www.reddit.com/r/nutrition/comments/buu470/question_about_oatmeal/,0,17,1559227976.0
That feeling when the organism doesn't digest...,bo6be4,Daneu,https://www.reddit.com/r/nutrition/comments/bo6be4/that_feeling_when_the_organism_doesnt_digest/,0,6,1557767839.0
"If CICO(caloric restriction) supposedly doesn't work, then what does?",aip407,BigBootyBear,https://www.reddit.com/r/nutrition/comments/aip407/if_cicocaloric_restriction_supposedly_doesnt_work/,0,14,1548177960.0
Drinking Boiling water vs Deionized Water,aeirim,machao15,https://www.reddit.com/r/nutrition/comments/aeirim/drinking_boiling_water_vs_deionized_water/,1,13,1547123976.0
Hi guys just wondering if anyone has used bicarbonate of soda and lemon juice to whiten there teeth ? Just worried about long term effects ect?,9zhonr,hazzakbeats,https://www.reddit.com/r/nutrition/comments/9zhonr/hi_guys_just_wondering_if_anyone_has_used/,0,27,1542918850.0
"Looking at super food powder ingredients, it looks like most only have 5% of your DV of each vitamins. How does that help?",9vzezq,soowhatchathink,https://www.reddit.com/r/nutrition/comments/9vzezq/looking_at_super_food_powder_ingredients_it_looks/,1,5,1541896013.0
"Is butter on potatoes more healthy, less healthy, or no different than eating potatoes without butter?",9q73ks,WhatsHappening123456,https://www.reddit.com/r/nutrition/comments/9q73ks/is_butter_on_potatoes_more_healthy_less_healthy/,1,18,1540155424.0
Is there some nutritional steps to target fat in the mid section?,9irou2,suspicious_owl69,https://www.reddit.com/r/nutrition/comments/9irou2/is_there_some_nutritional_steps_to_target_fat_in/,0,14,1537878575.0
European Society of Cardiology: PURE Study Shows Healthy Diet Including Dairy and Meats Good For Hearts Worldwide,9bfg62,czechnology,https://www.reddit.com/r/nutrition/comments/9bfg62/european_society_of_cardiology_pure_study_shows/,0,3,1535593847.0
Apple cider vinegar,8w3y4z,andy9432,https://www.reddit.com/r/nutrition/comments/8w3y4z/apple_cider_vinegar/,0,14,1530729631.0
Calories in rolled oats?,8j6ayc,Ausin3,https://www.reddit.com/r/nutrition/comments/8j6ayc/calories_in_rolled_oats/,0,3,1526239995.0
Non-cow milk consumption linked to shorter childhood height.,6gfvqh,KidsWifeJob,https://www.reddit.com/r/nutrition/comments/6gfvqh/noncow_milk_consumption_linked_to_shorter/,0,17,1497109554.0
"I always get a huge energy boost after eating tomatoes, why?",67hl1h,Shady_Scientist,https://www.reddit.com/r/nutrition/comments/67hl1h/i_always_get_a_huge_energy_boost_after_eating/,1,4,1493137088.0
What to eat to lose weight I want some goddamn recipes people… please.,5xl720,DarnedBagboyJr,https://www.reddit.com/r/nutrition/comments/5xl720/what_to_eat_to_lose_weight_i_want_some_goddamn/,0,4,1488688961.0
"If I go from a low protein to a higher protein intake, muscles get really pumped immediately. Why is that?",5i9700,cbdup,https://www.reddit.com/r/nutrition/comments/5i9700/if_i_go_from_a_low_protein_to_a_higher_protein/,0,5,1481698558.0
"Does dietary fiber ""cancel out"" sugar?",58s04d,None,https://www.reddit.com/r/nutrition/comments/58s04d/does_dietary_fiber_cancel_out_sugar/,1,3,1477119050.0
Which has more nutrition black beans or quinoa?,53e5uj,da_angry_scotsman,https://www.reddit.com/r/nutrition/comments/53e5uj/which_has_more_nutrition_black_beans_or_quinoa/,1,3,1474232722.0
Will ice tea stunt my growth due to caffeine?,4xnf9f,Anto52,https://www.reddit.com/r/nutrition/comments/4xnf9f/will_ice_tea_stunt_my_growth_due_to_caffeine/,0,3,1471164551.0
5 day cut and 2 day cleanse,4b859d,Justherelooking4u,https://www.reddit.com/r/nutrition/comments/4b859d/5_day_cut_and_2_day_cleanse/,0,2,1458491018.0
[Question] How to Gain Weight Fastly,3xlq37,MeiDoctor,https://www.reddit.com/r/nutrition/comments/3xlq37/question_how_to_gain_weight_fastly/,0,6,1450636292.0
"Going vegan, how does my diet sound?",3ky5kc,Lather,https://www.reddit.com/r/nutrition/comments/3ky5kc/going_vegan_how_does_my_diet_sound/,0,27,1442259140.0
Clean Eating Grocery List (Infographic & Free Download),34pfam,khatuntania,https://www.reddit.com/r/nutrition/comments/34pfam/clean_eating_grocery_list_infographic_free/,2,2,1430647924.0
Symptoms of a b12 deficiency. My experience,334rnw,wewewawa,https://www.reddit.com/r/nutrition/comments/334rnw/symptoms_of_a_b12_deficiency_my_experience/,0,16,1429456923.0
FAST FOOD inaccurate calories,2yricg,cyaspacecowboy,https://www.reddit.com/r/nutrition/comments/2yricg/fast_food_inaccurate_calories/,0,5,1426136137.0
"Any thoughts on a diet of eating 6 almonds every hour? (Replacing snacking, not meals)",2ozxnu,Tower26,https://www.reddit.com/r/nutrition/comments/2ozxnu/any_thoughts_on_a_diet_of_eating_6_almonds_every/,0,7,1418324449.0
Oatmeal makes me urinate?,2nb80h,torontodrakes,https://www.reddit.com/r/nutrition/comments/2nb80h/oatmeal_makes_me_urinate/,0,7,1416869922.0
Are there any scientific reasons that excessive Soda Pop consumption is unhealthy other than Obesity and Obesity related symptoms?,2jt9mc,Fang88,https://www.reddit.com/r/nutrition/comments/2jt9mc/are_there_any_scientific_reasons_that_excessive/,1,11,1413832789.0
Top ten Healthy Foods To Eat,2cx8aj,WILL19136,https://www.reddit.com/r/nutrition/comments/2cx8aj/top_ten_healthy_foods_to_eat/,0,3,1407447621.0
[Diet help needed] Vegitarin set weight loss diet plan?,250d0e,GenericServers,https://www.reddit.com/r/nutrition/comments/250d0e/diet_help_needed_vegitarin_set_weight_loss_diet/,0,12,1399517242.0
I want to eat properly,1u0ta4,justcallmejose,https://www.reddit.com/r/nutrition/comments/1u0ta4/i_want_to_eat_properly/,0,3,1388421043.0
Nutrition for Pain by Joel Cutulle,1m2q3f,JSC44,https://www.reddit.com/r/nutrition/comments/1m2q3f/nutrition_for_pain_by_joel_cutulle/,0,1,1378776838.0
Best way to come out of hypoglycemia,1lrj3l,tbaythrowaway,https://www.reddit.com/r/nutrition/comments/1lrj3l/best_way_to_come_out_of_hypoglycemia/,0,6,1378354474.0
Wanting to juice for lunch... but looking for some advice.,1k457y,Krimmirion,https://www.reddit.com/r/nutrition/comments/1k457y/wanting_to_juice_for_lunch_but_looking_for_some/,0,30,1376176648.0
which food has most highest Soluble Fiber?,1erh5e,None,https://www.reddit.com/r/nutrition/comments/1erh5e/which_food_has_most_highest_soluble_fiber/,2,15,1369143776.0
Trying an experiment; How long does it take my body to adjust?,16gjhb,Kippersoft,https://www.reddit.com/r/nutrition/comments/16gjhb/trying_an_experiment_how_long_does_it_take_my/,2,5,1358030579.0
Why do you like food bars? Like Kind Bar,10st79,illis3,https://www.reddit.com/r/nutrition/comments/10st79/why_do_you_like_food_bars_like_kind_bar/,0,4,1349150473.0
DAE have trouble drinking enough water?,wpfxr,braiker,https://www.reddit.com/r/nutrition/comments/wpfxr/dae_have_trouble_drinking_enough_water/,0,12,1342541014.0
Is it bad for your health if you stop eating red meat forever?,16cvur9,APOTHIASEXUAL,https://www.reddit.com/r/nutrition/comments/16cvur9/is_it_bad_for_your_health_if_you_stop_eating_red/,20,176,1694133655.0
Are nuts really that bad?,jmo08p,EmilyAdams23,https://www.reddit.com/r/nutrition/comments/jmo08p/are_nuts_really_that_bad/,10,29,1604326091.0
Soya chunks cause male feminization,qzj7u0,None,https://www.reddit.com/r/nutrition/comments/qzj7u0/soya_chunks_cause_male_feminization/,45,159,1637579856.0
what do you think about the carnivore diet and can it be nutritionally complete? can it be optimal for human healthspan?,si1kvs,None,https://www.reddit.com/r/nutrition/comments/si1kvs/what_do_you_think_about_the_carnivore_diet_and/,9,94,1643739412.0
Associations of Dietary Cholesterol or Egg Consumption With Incident Cardiovascular Disease and Mortality.,cj0kjv,Only8livesleft,https://www.reddit.com/r/nutrition/comments/cj0kjv/associations_of_dietary_cholesterol_or_egg/,9,54,1564343950.0
So there is basically tannins in every plant which is an anti-nutrient but plants are healthy to eat so how do you manage that?,17jvhph,itaicool,https://www.reddit.com/r/nutrition/comments/17jvhph/so_there_is_basically_tannins_in_every_plant/,17,144,1698678356.0
"Vegan for 1.5 years, no added sugar for 2 months, no gluten for 2 weeks.",5ab5je,None,https://www.reddit.com/r/nutrition/comments/5ab5je/vegan_for_15_years_no_added_sugar_for_2_months_no/,19,57,1477901977.0
Wtf is this carnivore diet???,1d46uo6,CaramelSpice_notnice,https://www.reddit.com/r/nutrition/comments/1d46uo6/wtf_is_this_carnivore_diet/,91,400,1717083162.0
"Which diet is worse: high sugar, high saturated fat or high sodium?",1dglo8v,edgarallenSNATCH,https://www.reddit.com/r/nutrition/comments/1dglo8v/which_diet_is_worse_high_sugar_high_saturated_fat/,0,33,1718468698.0
Is it bad to only be mainly eating these foods ,1cdy6ga,giwtd,https://www.reddit.com/r/nutrition/comments/1cdy6ga/is_it_bad_to_only_be_mainly_eating_these_foods/,2,33,1714169499.0
How much fish is safe to eat a week?,1c5o4ic,SparePoet5576,https://www.reddit.com/r/nutrition/comments/1c5o4ic/how_much_fish_is_safe_to_eat_a_week/,4,30,1713293750.0
Is it true that a high protein low fat diet lead to gluconeogenesis?,1bbsrsa,mysseclypse,https://www.reddit.com/r/nutrition/comments/1bbsrsa/is_it_true_that_a_high_protein_low_fat_diet_lead/,3,34,1710125333.0
Glassware drinking cups,18p3b8h,Krystal_Marie_,https://www.reddit.com/r/nutrition/comments/18p3b8h/glassware_drinking_cups/,0,7,1703329029.0
Has anyone tried AG1? Thoughts?,18bp0av,videojuegos17,https://www.reddit.com/r/nutrition/comments/18bp0av/has_anyone_tried_ag1_thoughts/,3,30,1701816979.0
What ethnic food/meal is the most balanced,15dyo27,Gsomethepatient,https://www.reddit.com/r/nutrition/comments/15dyo27/what_ethnic_foodmeal_is_the_most_balanced/,5,32,1690756427.0
Do the carbs of rice make us fat more easily than the carbs of other sources?,151l2kc,Natuanas,https://www.reddit.com/r/nutrition/comments/151l2kc/do_the_carbs_of_rice_make_us_fat_more_easily_than/,0,38,1689549955.0
Raw meat diet??,ux8brp,bripuli,https://www.reddit.com/r/nutrition/comments/ux8brp/raw_meat_diet/,1,54,1653449214.0
Does eating foods that complement each other lead to healthier life?,ul29e2,RedditAbuserPolice,https://www.reddit.com/r/nutrition/comments/ul29e2/does_eating_foods_that_complement_each_other_lead/,3,10,1652018176.0
What are yalls thoughts and opinions on the vertical diet?,qr8ybw,None,https://www.reddit.com/r/nutrition/comments/qr8ybw/what_are_yalls_thoughts_and_opinions_on_the/,3,14,1636592217.0
Annual Best Diets 2020 by U.S. News,ej3fol,Only8livesleft,https://www.reddit.com/r/nutrition/comments/ej3fol/annual_best_diets_2020_by_us_news/,1,11,1577995664.0
Why isn’t bacon as good for us as Spinach? Even tho (subjectively) it taste better,an6ppx,None,https://www.reddit.com/r/nutrition/comments/an6ppx/why_isnt_bacon_as_good_for_us_as_spinach_even_tho/,5,33,1549316413.0
I think even RD's are bullshit,8ctlgv,juxstage,https://www.reddit.com/r/nutrition/comments/8ctlgv/i_think_even_rds_are_bullshit/,2,35,1523935936.0
Keto vs vegan. Which one is the best diet?,6d0vfn,super_good_aim_guy,https://www.reddit.com/r/nutrition/comments/6d0vfn/keto_vs_vegan_which_one_is_the_best_diet/,3,62,1495614727.0
Are eggs bad for you?,55t744,iadorh,https://www.reddit.com/r/nutrition/comments/55t744/are_eggs_bad_for_you/,0,41,1475583492.0
"How to loose weight while working 12+ as a programmer sitting all day.... need help, plz help",zo4is,fattyProgrammer,https://www.reddit.com/r/nutrition/comments/zo4is/how_to_loose_weight_while_working_12_as_a/,1,27,1347308321.0
Best Greens Gummies?,tgas24,SorryCollege6,https://www.reddit.com/r/nutrition/comments/tgas24/best_greens_gummies/,15,27,1647525240.0
How healthy is breakfast cereal and milk for kids?,1bucgta,None,https://www.reddit.com/r/nutrition/comments/1bucgta/how_healthy_is_breakfast_cereal_and_milk_for_kids/,7,85,1712098109.0
Your reasons for not adopting a plant-based diet,xgzfbi,Meowier1,https://www.reddit.com/r/nutrition/comments/xgzfbi/your_reasons_for_not_adopting_a_plantbased_diet/,0,80,1663453263.0
Making weed shakes for health benefit?,cb1duy,trwwjtizenketto,https://www.reddit.com/r/nutrition/comments/cb1duy/making_weed_shakes_for_health_benefit/,8,24,1562681503.0
Is smoked paprika bad for you?,1di4pvo,Flashy_Paper2345,https://www.reddit.com/r/nutrition/comments/1di4pvo/is_smoked_paprika_bad_for_you/,0,31,1718647729.0
whats the concensus on seed oils? are they bad or good?,1cj9ira,Designer_Egg_5279,https://www.reddit.com/r/nutrition/comments/1cj9ira/whats_the_concensus_on_seed_oils_are_they_bad_or/,3,76,1714745113.0
how to reduce the saturated fat in within diet?,1b4r2cv,New_Swordfish_1352,https://www.reddit.com/r/nutrition/comments/1b4r2cv/how_to_reduce_the_saturated_fat_in_within_diet/,0,36,1709393990.0
Cool wrap from Chic-fil-A is a damn good nutritional choice if you do not use the side dressing,1aiavp8,razors_so_yummy,https://www.reddit.com/r/nutrition/comments/1aiavp8/cool_wrap_from_chicfila_is_a_damn_good/,0,8,1707006953.0
NO BIASED ANSWERS PLEASE - is it factually healthier to be vegan or to eat animal products?,15jcr70,Lightningvegan5,https://www.reddit.com/r/nutrition/comments/15jcr70/no_biased_answers_please_is_it_factually/,0,99,1691285400.0
"Ground beef boiled to reduce fat content, but no fat come out when drained- does it mean the meat is lean?",zxo1or,lemoncry_,https://www.reddit.com/r/nutrition/comments/zxo1or/ground_beef_boiled_to_reduce_fat_content_but_no/,4,43,1672268659.0
Are fruits bad for you?,vaj51l,None,https://www.reddit.com/r/nutrition/comments/vaj51l/are_fruits_bad_for_you/,0,90,1655029561.0
Can someone explain to me the difference between a corndog and peanut butter in terms of nutrition?,mnxn6w,None,https://www.reddit.com/r/nutrition/comments/mnxn6w/can_someone_explain_to_me_the_difference_between/,3,18,1618027367.0
Let's get one thing straight: is fruit good or bad for you?,h9jgfq,dm_me_alt_girls,https://www.reddit.com/r/nutrition/comments/h9jgfq/lets_get_one_thing_straight_is_fruit_good_or_bad/,3,16,1592238024.0
"Less carbs, more fat: ketogenic diet makes migraine patients' headaches disappear",57lkye,FrigoCoder,https://www.reddit.com/r/nutrition/comments/57lkye/less_carbs_more_fat_ketogenic_diet_makes_migraine/,0,7,1476529127.0
"Eggs- Almost As Good As Breast Milk, Best Protein Source Ever",1f925g,GoodLookingLoser,https://www.reddit.com/r/nutrition/comments/1f925g/eggs_almost_as_good_as_breast_milk_best_protein/,6,32,1369803675.0
"If you eat around 400-800 cals a day, will you be in a constant state of ketosis? I'm not actually doing this, I'm just genuinely curious.",1dfeldk,replyplumber,https://www.reddit.com/r/nutrition/comments/1dfeldk/if_you_eat_around_400800_cals_a_day_will_you_be/,0,38,1718326542.0
Sweet Potatoes?????,17tst93,Plenty_Surprise2593,https://www.reddit.com/r/nutrition/comments/17tst93/sweet_potatoes/,6,83,1699820621.0
Dr. Greger/ Nutrition Facts,bqtjcv,Lavasd,https://www.reddit.com/r/nutrition/comments/bqtjcv/dr_greger_nutrition_facts/,6,65,1558346201.0
"Can someone live off chocolate soy milk, a MV and a fish oil supplment?",7aqtnx,3bigboy1122,https://www.reddit.com/r/nutrition/comments/7aqtnx/can_someone_live_off_chocolate_soy_milk_a_mv_and/,6,36,1509804524.0
Public Service Announcement: Saturated Fat is not Neutral,2m3idp,alarmstrong,https://www.reddit.com/r/nutrition/comments/2m3idp/public_service_announcement_saturated_fat_is_not/,0,26,1415818217.0
What is the most underrated food that people should actually not eat?,djgin8,JSHFV222,https://www.reddit.com/r/nutrition/comments/djgin8/what_is_the_most_underrated_food_that_people/,91,340,1571363913.0
"Which is nutritionally better, pork tenderloin or chicken breast?",ezn54o,lovenote123,https://www.reddit.com/r/nutrition/comments/ezn54o/which_is_nutritionally_better_pork_tenderloin_or/,11,45,1580965064.0
how to bulk without the fast food carbs ?,1bmr0fy,sweetpotato_2000,https://www.reddit.com/r/nutrition/comments/1bmr0fy/how_to_bulk_without_the_fast_food_carbs/,12,72,1711303338.0
Are frozen vegetables unhealthy?,16p3hmq,IndependentMarket960,https://www.reddit.com/r/nutrition/comments/16p3hmq/are_frozen_vegetables_unhealthy/,12,57,1695366165.0
Diet for peak human performance,6uf2y8,choose-a-username11,https://www.reddit.com/r/nutrition/comments/6uf2y8/diet_for_peak_human_performance/,13,16,1503024807.0
Does Saturated Fat ever leave youre body?,y7cqbs,ToiletTaster2,https://www.reddit.com/r/nutrition/comments/y7cqbs/does_saturated_fat_ever_leave_youre_body/,85,107,1666112888.0
Would adding psyllium husk to sugar make it less unhealthy?,18pv1te,johnetizen,https://www.reddit.com/r/nutrition/comments/18pv1te/would_adding_psyllium_husk_to_sugar_make_it_less/,27,39,1703423757.0
Is milk really that bad?,1c2uu2a,CableAutomatic8949,https://www.reddit.com/r/nutrition/comments/1c2uu2a/is_milk_really_that_bad/,33,187,1712987756.0
"Can we stop with the words ""bad"" and ""good"" as descriptions of types of food?",2zmexf,None,https://www.reddit.com/r/nutrition/comments/2zmexf/can_we_stop_with_the_words_bad_and_good_as/,36,39,1426796119.0
Why is fruit considered good while sugar is considered bad?,wkdx7a,Satcitananda90,https://www.reddit.com/r/nutrition/comments/wkdx7a/why_is_fruit_considered_good_while_sugar_is/,33,100,1660077234.0
"It's like current nutritional advice isn't based on increasing health or fitness, but rather on increasing consumption ...",55bufq,None,https://www.reddit.com/r/nutrition/comments/55bufq/its_like_current_nutritional_advice_isnt_based_on/,0,1,1475297215.0
Breakfast foods,513s04,None,https://www.reddit.com/r/nutrition/comments/513s04/breakfast_foods/,2,13,1472992126.0
Raw oats are bad. Add some milk and chuck in the microwave - no how many seconds till they're safe to eat?,4vf46w,None,https://www.reddit.com/r/nutrition/comments/4vf46w/raw_oats_are_bad_add_some_milk_and_chuck_in_the/,0,3,1469929823.0
"I plan on restricting my diet to ONLY these items for about 6 months, thoughts?",4pel5k,notsok33t00,https://www.reddit.com/r/nutrition/comments/4pel5k/i_plan_on_restricting_my_diet_to_only_these_items/,1,23,1466650442.0
"I'm 19, never eaten fruit or veg in my life, how dangerous is this?",4ktcis,None,https://www.reddit.com/r/nutrition/comments/4ktcis/im_19_never_eaten_fruit_or_veg_in_my_life_how/,1,16,1464090190.0
Exceptionally healthy mother drinks to much coffee. Should I be concerned?,4kkfjx,Craig_of_the_jungle,https://www.reddit.com/r/nutrition/comments/4kkfjx/exceptionally_healthy_mother_drinks_to_much/,3,6,1463950233.0
Should I feel guilty for eating jujubes?,4gmu8x,UyhAEqbnp,https://www.reddit.com/r/nutrition/comments/4gmu8x/should_i_feel_guilty_for_eating_jujubes/,1,2,1461730318.0
I put on weight when ever i eat rice. Why is my body different than others,4dgvw4,220to170,https://www.reddit.com/r/nutrition/comments/4dgvw4/i_put_on_weight_when_ever_i_eat_rice_why_is_my/,0,19,1459869694.0
"Benefits of tomatoes in improving eyesight, also it benefits in the fight against cancer.",4aqegz,chsarah,https://www.reddit.com/r/nutrition/comments/4aqegz/benefits_of_tomatoes_in_improving_eyesight_also/,1,0,1458170751.0
Adding flour to meat and then frying it; is it healthy?,46q797,Timbermaw,https://www.reddit.com/r/nutrition/comments/46q797/adding_flour_to_meat_and_then_frying_it_is_it/,2,7,1455977114.0
Just drank a smoothie. Now I'm farting and experiencing wet stool. Is this normal?,46a04f,Jyqft,https://www.reddit.com/r/nutrition/comments/46a04f/just_drank_a_smoothie_now_im_farting_and/,0,13,1455732216.0
I'm beginning to get a little worried about my health and I suspect my diet is the problem,3y2omd,None,https://www.reddit.com/r/nutrition/comments/3y2omd/im_beginning_to_get_a_little_worried_about_my/,1,12,1450956860.0
How long do Antioxidants take to work?,3xjmjq,redpillbjj,https://www.reddit.com/r/nutrition/comments/3xjmjq/how_long_do_antioxidants_take_to_work/,1,4,1450585731.0
"Is, ""Grass Fed"" and dairy worth the additional price?",3pkmrj,TheYogi,https://www.reddit.com/r/nutrition/comments/3pkmrj/is_grass_fed_and_dairy_worth_the_additional_price/,2,24,1445389909.0
I kinda eat the same things every day. Is my diet ok or what should I change?,3p8vbv,F0ur2o,https://www.reddit.com/r/nutrition/comments/3p8vbv/i_kinda_eat_the_same_things_every_day_is_my_diet/,1,12,1445188276.0
Antibiotic free food?!,3hwf2k,averagejoesnutrition,https://www.reddit.com/r/nutrition/comments/3hwf2k/antibiotic_free_food/,0,15,1440193512.0
How naughty IS the starbucks skinny iced mocha?,31vpmv,--shera--,https://www.reddit.com/r/nutrition/comments/31vpmv/how_naughty_is_the_starbucks_skinny_iced_mocha/,0,8,1428505630.0
Forks Over Knives Documentary,2mozsv,briannatarango,https://www.reddit.com/r/nutrition/comments/2mozsv/forks_over_knives_documentary/,0,16,1416339655.0
