Title,ID,Author,URL,Score,Comment Count,Created
Bulletproof Coffee. Anyone tried this stuff or have thoughts on it?,42s935,M-as-in-Mancyyy,https://www.reddit.com/r/nutrition/comments/42s935/bulletproof_coffee_anyone_tried_this_stuff_or/,0,27,1453825508.0
Is there a maximum your body will utilize of protein in a meal?,3ajxia,None,https://www.reddit.com/r/nutrition/comments/3ajxia/is_there_a_maximum_your_body_will_utilize_of/,0,12,1434840435.0
"Camel Milk Good for Health, Why?",377a1y,webgeek86,https://www.reddit.com/r/nutrition/comments/377a1y/camel_milk_good_for_health_why/,2,15,1432561086.0
"Would you change your doctor/specialist if he/she didn't believe that, you can supplement vitamins with proper eating?",2cz8if,2cqb4y,https://www.reddit.com/r/nutrition/comments/2cz8if/would_you_change_your_doctorspecialist_if_heshe/,0,20,1407505045.0
Do you heard about millet?,1dn1jbj,Sorry-Month7230,https://www.reddit.com/r/nutrition/comments/1dn1jbj/do_you_heard_about_millet/,0,38,1719191913.0
Breakfast ideas for husband,199u4vl,StraightFoundation13,https://www.reddit.com/r/nutrition/comments/199u4vl/breakfast_ideas_for_husband/,0,70,1705595480.0
Nutrition that can help you build mussels fast ? ,1dues8r,Frosty_Pay_9297,https://www.reddit.com/r/nutrition/comments/1dues8r/nutrition_that_can_help_you_build_mussels_fast/,41,70,1720014461.0
Is whey protein really “healthy”?,1d1hkcn,OldFanJEDIot,https://www.reddit.com/r/nutrition/comments/1d1hkcn/is_whey_protein_really_healthy/,0,65,1716777627.0
"Glad subs back, anyone can explain why we know certain foods are super good for us like for example Sardines, yet we still (in most cases) rarely eat them?",14dbscw,ego157,https://www.reddit.com/r/nutrition/comments/14dbscw/glad_subs_back_anyone_can_explain_why_we_know/,21,41,1687173402.0
Is saturated fat healthy,1b2d7vj,Fair-Cartographer-27,https://www.reddit.com/r/nutrition/comments/1b2d7vj/is_saturated_fat_healthy/,9,190,1709144569.0
Is it okay to eat tons and tons of dairy if it’s all the “right” dairy?,17bntt7,pinkishtiger,https://www.reddit.com/r/nutrition/comments/17bntt7/is_it_okay_to_eat_tons_and_tons_of_dairy_if_its/,10,89,1697734562.0
How do we feel about coconut milk?,17l0vux,climber_cass,https://www.reddit.com/r/nutrition/comments/17l0vux/how_do_we_feel_about_coconut_milk/,4,64,1698801853.0
Can the sugar in fruit make you gain belly fat?,p8zkn7,insultin_crayon,https://www.reddit.com/r/nutrition/comments/p8zkn7/can_the_sugar_in_fruit_make_you_gain_belly_fat/,0,64,1629580912.0
Why is every post full of carnivore advocates?,1bx73f6,None,https://www.reddit.com/r/nutrition/comments/1bx73f6/why_is_every_post_full_of_carnivore_advocates/,183,586,1712394200.0
TIL processed foods creates a rapid rise in blood sugar that activates the hypocretin neurons in the brain that leads to tiredness...,331dpq,secksee,https://www.reddit.com/r/nutrition/comments/331dpq/til_processed_foods_creates_a_rapid_rise_in_blood/,36,24,1429372718.0
Serving size doesn't make sense,179ffsi,RedZeshinX,https://www.reddit.com/r/nutrition/comments/179ffsi/serving_size_doesnt_make_sense/,6,25,1697487148.0
What’s the most underrated health food?,14x6p2j,SweatyArgument5835,https://www.reddit.com/r/nutrition/comments/14x6p2j/whats_the_most_underrated_health_food/,6,73,1689116894.0
Vitamin that affects eye color?,z0hk9i,iDriveSlowInFastLane,https://www.reddit.com/r/nutrition/comments/z0hk9i/vitamin_that_affects_eye_color/,5,18,1668983744.0
"If a drank a gallon of water within 1 hour, would I be hydrated for the rest of the day?",53y68b,HumSupLo69,https://www.reddit.com/r/nutrition/comments/53y68b/if_a_drank_a_gallon_of_water_within_1_hour_would/,0,5,1474536921.0
What's New and Beneficial About Strawberries!,2ezht3,retin,https://www.reddit.com/r/nutrition/comments/2ezht3/whats_new_and_beneficial_about_strawberries/,3,4,1409377704.0
Carbs are NOT your Enemy,1tsyq7,avgfitfreak,https://www.reddit.com/r/nutrition/comments/1tsyq7/carbs_are_not_your_enemy/,2,12,1388148985.0
"Animal Fat, Lard - Yay or nay?",1byzd3b,LosslessQ,https://www.reddit.com/r/nutrition/comments/1byzd3b/animal_fat_lard_yay_or_nay/,2,112,1712586714.0
What food would be considered healthy if it didn’t have sugar in it?,1828l8t,adamcantcook,https://www.reddit.com/r/nutrition/comments/1828l8t/what_food_would_be_considered_healthy_if_it_didnt/,2,100,1700766737.0
Is white rice healthier than brown rice?,13lgpl8,0Tungence,https://www.reddit.com/r/nutrition/comments/13lgpl8/is_white_rice_healthier_than_brown_rice/,2,40,1684458562.0
Would pouring instant coffe to your mouth and then swallowing it with plain warm water give the same sobriety as preparing it with hot water?,12tp5gp,IamJustFuckingTired,https://www.reddit.com/r/nutrition/comments/12tp5gp/would_pouring_instant_coffe_to_your_mouth_and/,0,26,1682048253.0
Does anyone have an useful list of products high and low in carbohydrates,mqppf4,IceMajorr,https://www.reddit.com/r/nutrition/comments/mqppf4/does_anyone_have_an_useful_list_of_products_high/,2,6,1618403999.0
Does Coconut oil trick the thyroid into thinking it's getting enough calories,584r45,ellipsical11,https://www.reddit.com/r/nutrition/comments/584r45/does_coconut_oil_trick_the_thyroid_into_thinking/,2,20,1476808365.0
What did people from the 20th century implement in their lifestyle to maintain such good bone structure in the face and body?,1d7m3pa,None,https://www.reddit.com/r/nutrition/comments/1d7m3pa/what_did_people_from_the_20th_century_implement/,19,82,1717467107.0
How is charcoal suddenly considered healthy nowadays?,1bz6vrl,ihsv777,https://www.reddit.com/r/nutrition/comments/1bz6vrl/how_is_charcoal_suddenly_considered_healthy/,0,60,1712604586.0
does lemon in water spike insulin?,1aju3x6,OpenMyChakra,https://www.reddit.com/r/nutrition/comments/1aju3x6/does_lemon_in_water_spike_insulin/,0,37,1707173366.0
5 Reasons Not To Eat Junk Food,52phgq,ShafYounus,https://www.reddit.com/r/nutrition/comments/52phgq/5_reasons_not_to_eat_junk_food/,7,16,1473840716.0
Are vegetables really THAT good for you? ,1c988yo,tdizz123,https://www.reddit.com/r/nutrition/comments/1c988yo/are_vegetables_really_that_good_for_you/,0,94,1713670206.0
Is Wine Healthy,1dfaiew,Last-Bench-9618,https://www.reddit.com/r/nutrition/comments/1dfaiew/is_wine_healthy/,0,52,1718314810.0
"Is there such a thing as ""too much"" oatmeal?",195ydp4,homebase99,https://www.reddit.com/r/nutrition/comments/195ydp4/is_there_such_a_thing_as_too_much_oatmeal/,7,78,1705180486.0
Is it healthy to eat no meat?,16d671v,YLRESS,https://www.reddit.com/r/nutrition/comments/16d671v/is_it_healthy_to_eat_no_meat/,7,160,1694166514.0
Question for ex-vegans/vegetarians : how did reintroducing meat back into your diet go? ,1aw5ep9,daydream_believer322,https://www.reddit.com/r/nutrition/comments/1aw5ep9/question_for_exvegansvegetarians_how_did/,10,41,1708497571.0
Where did this 1 g/lb protein requirement myth start?,sg6gxf,craigies_list,https://www.reddit.com/r/nutrition/comments/sg6gxf/where_did_this_1_glb_protein_requirement_myth/,13,14,1643538807.0
Have I been doing it wrong?,1cirb7j,Katamali,https://www.reddit.com/r/nutrition/comments/1cirb7j/have_i_been_doing_it_wrong/,11,53,1714685128.0
Vegetable Oils Consumption as One of the Leading Cause of Cancer and Heart Disease,5o1ai1,StuWard,https://www.reddit.com/r/nutrition/comments/5o1ai1/vegetable_oils_consumption_as_one_of_the_leading/,11,14,1484444830.0
Why do I feel weak and hungry after eating a high carb meal?,4lp9r3,tikki_Masala,https://www.reddit.com/r/nutrition/comments/4lp9r3/why_do_i_feel_weak_and_hungry_after_eating_a_high/,3,10,1464610782.0
Health Benefits Of Drinking Lemon Water,2m3f11,Hsnah,https://www.reddit.com/r/nutrition/comments/2m3f11/health_benefits_of_drinking_lemon_water/,3,15,1415816525.0
How many pounds of fat can you gain in one week,1810pn7,Dabomie,https://www.reddit.com/r/nutrition/comments/1810pn7/how_many_pounds_of_fat_can_you_gain_in_one_week/,2,23,1700627097.0
"Removing the ""crust"" from fried food?",11cqvsg,goiabada-,https://www.reddit.com/r/nutrition/comments/11cqvsg/removing_the_crust_from_fried_food/,0,23,1677441349.0
CarnivoreMD book diet different from website diet,10qvzg4,Vegetable_Vacation56,https://www.reddit.com/r/nutrition/comments/10qvzg4/carnivoremd_book_diet_different_from_website_diet/,3,64,1675261572.0
is it healthier to just eat refined sugar instead of white rice?,q870my,RiverOfHell,https://www.reddit.com/r/nutrition/comments/q870my/is_it_healthier_to_just_eat_refined_sugar_instead/,0,30,1634240099.0
Does unused Carbs become good fats or bad fats?,9edref,zer0gaming,https://www.reddit.com/r/nutrition/comments/9edref/does_unused_carbs_become_good_fats_or_bad_fats/,1,14,1536506806.0
"Limiting myself to a list of 10 foods, looking for feedback",4saxs6,truthink,https://www.reddit.com/r/nutrition/comments/4saxs6/limiting_myself_to_a_list_of_10_foods_looking_for/,2,15,1468244106.0
What do you think about this ''lose 10 pounds in a week'' diet?,39wq55,darko_ufo,https://www.reddit.com/r/nutrition/comments/39wq55/what_do_you_think_about_this_lose_10_pounds_in_a/,0,29,1434372215.0
[Question] What is junk food and should I avoid it at all cost?,2llq44,None,https://www.reddit.com/r/nutrition/comments/2llq44/question_what_is_junk_food_and_should_i_avoid_it/,0,69,1415386263.0
IS KELP NUTRITIOUS,2f1dqa,bongo_jim_hoover,https://www.reddit.com/r/nutrition/comments/2f1dqa/is_kelp_nutritious/,1,10,1409436687.0
6 Reasons Why Vegetable Oils Are Toxic,1kall4,gbalbinot,https://www.reddit.com/r/nutrition/comments/1kall4/6_reasons_why_vegetable_oils_are_toxic/,0,7,1376418644.0
Anyone want to help start up r/superfood?,10vzbr,iHeartApples,https://www.reddit.com/r/nutrition/comments/10vzbr/anyone_want_to_help_start_up_rsuperfood/,1,9,1349289017.0
Garlic: Brain Toxin?,tmglx,DropKickZen,https://www.reddit.com/r/nutrition/comments/tmglx/garlic_brain_toxin/,0,14,1337004662.0
"What is the order of most important nutrients?(Water, Fat, Protein, Carbohydrates, Minerals, Vitamins)",1dd010o,Realistic_Guava9117,https://www.reddit.com/r/nutrition/comments/1dd010o/what_is_the_order_of_most_important/,2,70,1718062512.0
Heavy metal toxicity and fungal overgrowth- which to treat first?,1ckt5ti,Voice-Infinite,https://www.reddit.com/r/nutrition/comments/1ckt5ti/heavy_metal_toxicity_and_fungal_overgrowth_which/,0,17,1714921176.0
How to fix a slow metabolism?,1chmkov,sleazybih,https://www.reddit.com/r/nutrition/comments/1chmkov/how_to_fix_a_slow_metabolism/,1,22,1714571144.0
"Why are oats so low in calories per gram, but you still feel full after eating them?",1cdhuvc,thefluffyhgamer,https://www.reddit.com/r/nutrition/comments/1cdhuvc/why_are_oats_so_low_in_calories_per_gram_but_you/,0,26,1714127018.0
Soybean causes inflammation?,1caur7a,vvvorticcousin,https://www.reddit.com/r/nutrition/comments/1caur7a/soybean_causes_inflammation/,0,9,1713843322.0
"If a pb white bread sandwich was your staple food, what other food should you eat to balance it?",1bu8hz4,toomanysubsbannedme,https://www.reddit.com/r/nutrition/comments/1bu8hz4/if_a_pb_white_bread_sandwich_was_your_staple_food/,0,28,1712088019.0
"What does food contain apart from protein, carbs and fats? And water? ",1aywdbj,Clean_Ad_6099,https://www.reddit.com/r/nutrition/comments/1aywdbj/what_does_food_contain_apart_from_protein_carbs/,1,18,1708786437.0
Is it bad to use seeds and nuts in baking?,184gq7a,Objective_Yam_3382,https://www.reddit.com/r/nutrition/comments/184gq7a/is_it_bad_to_use_seeds_and_nuts_in_baking/,1,24,1701022092.0
What’s magical about liquid IV?,175wwle,Dear_Afternoon_9280,https://www.reddit.com/r/nutrition/comments/175wwle/whats_magical_about_liquid_iv/,1,36,1697080458.0
"Is combining proteins and carbs in one meal good or not, why?",16mtd16,Most_Adhesiveness103,https://www.reddit.com/r/nutrition/comments/16mtd16/is_combining_proteins_and_carbs_in_one_meal_good/,0,14,1695135668.0
Do you also feel better after eating a solid/cubed piece of meat instead of minced? (Even if the cut/quality is the same),163r23b,None,https://www.reddit.com/r/nutrition/comments/163r23b/do_you_also_feel_better_after_eating_a_solidcubed/,0,18,1693240938.0
Raw pet food as a source of diverse organ meat (for humans)?,swvswo,mohishunder,https://www.reddit.com/r/nutrition/comments/swvswo/raw_pet_food_as_a_source_of_diverse_organ_meat/,1,21,1645342598.0
Best diet ever?,sj1mzo,Space-life1,https://www.reddit.com/r/nutrition/comments/sj1mzo/best_diet_ever/,1,15,1643840152.0
The heavy metal toxicity issue in supplements and herbs,nu2mq4,whitelightstorm,https://www.reddit.com/r/nutrition/comments/nu2mq4/the_heavy_metal_toxicity_issue_in_supplements_and/,0,18,1623035726.0
Why do we need fat in a diet,n4svru,Environmental_Thing5,https://www.reddit.com/r/nutrition/comments/n4svru/why_do_we_need_fat_in_a_diet/,0,27,1620146368.0
Why does red sauce make me tired?,mq1jdo,slidellproud,https://www.reddit.com/r/nutrition/comments/mq1jdo/why_does_red_sauce_make_me_tired/,0,20,1618318064.0
Intermittent fasting and keto aren’t the best for athletic performance and creating muscle mass,f6k535,None,https://www.reddit.com/r/nutrition/comments/f6k535/intermittent_fasting_and_keto_arent_the_best_for/,1,7,1582157506.0
Actual impacts of estrogen/phytoestrogen in men,eh3und,awksomepenguin,https://www.reddit.com/r/nutrition/comments/eh3und/actual_impacts_of_estrogenphytoestrogen_in_men/,0,9,1577609697.0
What are you thoughts on Dr Greger MD Evidence Based Weight Loss Video?,e1z1mk,bubblerboy18,https://www.reddit.com/r/nutrition/comments/e1z1mk/what_are_you_thoughts_on_dr_greger_md_evidence/,0,32,1574780321.0
Meat,94uiku,rattyflood,https://www.reddit.com/r/nutrition/comments/94uiku/meat/,0,25,1533497797.0
Chris Traeger,6qef37,Jorah_2016,https://www.reddit.com/r/nutrition/comments/6qef37/chris_traeger/,3,11,1501373654.0
"Which diet is worse: high sodium, high sugar, high fat, or high alcohol?",1dgjmu9,edgarallenSNATCH,https://www.reddit.com/r/nutrition/comments/1dgjmu9/which_diet_is_worse_high_sodium_high_sugar_high/,33,178,1718462984.0
"The Remarkable Health Benefits of Broccoli, and How to Maximize Its Cancer-Fighting Potential",52edcs,Life_Long_Products,https://www.reddit.com/r/nutrition/comments/52edcs/the_remarkable_health_benefits_of_broccoli_and/,3,7,1473687673.0
"I want to eat a 80% plant based diet and 20 % meat and fish, is there a name for this?",45vifk,None,https://www.reddit.com/r/nutrition/comments/45vifk/i_want_to_eat_a_80_plant_based_diet_and_20_meat/,4,39,1455524177.0
I went on a 14 day sugar(added sugar) deficit and HOLY SH*T IVE BEEN MORE IRRITABLE THAN EVER,1dgb2ys,Various_League_8731,https://www.reddit.com/r/nutrition/comments/1dgb2ys/i_went_on_a_14_day_sugaradded_sugar_deficit_and/,0,38,1718430514.0
What can I snack on without fear of pesticides?,1cb5b80,Plucky_Adventurer,https://www.reddit.com/r/nutrition/comments/1cb5b80/what_can_i_snack_on_without_fear_of_pesticides/,0,38,1713880643.0
Which one is worse for you in your opinion..,ubczao,cricket2tay23,https://www.reddit.com/r/nutrition/comments/ubczao/which_one_is_worse_for_you_in_your_opinion/,0,50,1650861909.0
Which holidays contribute most to the overweight and obesity crisis?,qjkx00,Helpscript,https://www.reddit.com/r/nutrition/comments/qjkx00/which_holidays_contribute_most_to_the_overweight/,0,17,1635667359.0
is alcohol from to time still bad?,1duc4va,ARA-GOD,https://www.reddit.com/r/nutrition/comments/1duc4va/is_alcohol_from_to_time_still_bad/,56,221,1720006492.0
Is Ultra-pasteurized (UHT) milk nutritionally different than  traditionally pasteurized milk?,1dec0zv,OldFanJEDIot,https://www.reddit.com/r/nutrition/comments/1dec0zv/is_ultrapasteurized_uht_milk_nutritionally/,0,27,1718212606.0
Is it a good idea to eat vegan dishes meat flavored if you can't handle eating vegetables?,1d3osf3,A_lil_confused_bee,https://www.reddit.com/r/nutrition/comments/1d3osf3/is_it_a_good_idea_to_eat_vegan_dishes_meat/,0,25,1717022280.0
Who do desserts cause my face to “go numb”?,1cijt5k,None,https://www.reddit.com/r/nutrition/comments/1cijt5k/who_do_desserts_cause_my_face_to_go_numb/,0,10,1714666783.0
are sugar alternatives really much healthier?,1cfbxt1,sunshineydaisy,https://www.reddit.com/r/nutrition/comments/1cfbxt1/are_sugar_alternatives_really_much_healthier/,0,20,1714325569.0
Does it still count as protein if it's a cookie?,1bzwh3t,Birchwood_Goddess,https://www.reddit.com/r/nutrition/comments/1bzwh3t/does_it_still_count_as_protein_if_its_a_cookie/,0,35,1712680166.0
An inquiry on the Influence of Whole versus Processed Foods on the Body,1br4uu9,Affectionate-Ad-9306,https://www.reddit.com/r/nutrition/comments/1br4uu9/an_inquiry_on_the_influence_of_whole_versus/,0,18,1711760174.0
How high fat diet helps us absorb nutrients?,1bmkz8j,dukadini,https://www.reddit.com/r/nutrition/comments/1bmkz8j/how_high_fat_diet_helps_us_absorb_nutrients/,0,8,1711287540.0
How nutritious is your food,1b592am,Amahardguy,https://www.reddit.com/r/nutrition/comments/1b592am/how_nutritious_is_your_food/,0,15,1709442568.0
What is wrong with preservatives or processed food?,1b2fb7y,AlternativePresent22,https://www.reddit.com/r/nutrition/comments/1b2fb7y/what_is_wrong_with_preservatives_or_processed_food/,0,23,1709149424.0
Ground beef draining fat,1av2riz,ParkingPotential4885,https://www.reddit.com/r/nutrition/comments/1av2riz/ground_beef_draining_fat/,0,30,1708386428.0
Oxalates in canned sweet potato?,18sykmj,UchuuStranger,https://www.reddit.com/r/nutrition/comments/18sykmj/oxalates_in_canned_sweet_potato/,0,11,1703782533.0
How is the sodium in pasta sauces (jarred marinara mainly) distributed when stirred in with a full box of pasta?,18bhlbf,glossyplane245,https://www.reddit.com/r/nutrition/comments/18bhlbf/how_is_the_sodium_in_pasta_sauces_jarred_marinara/,1,8,1701798211.0
Are sweet potatoes superior to bananas in every way when it comes to nutrition?,17mfgmf,andreasdagen,https://www.reddit.com/r/nutrition/comments/17mfgmf/are_sweet_potatoes_superior_to_bananas_in_every/,0,19,1698963487.0
Types of intermittent fasting,17cirjn,coolnavigator,https://www.reddit.com/r/nutrition/comments/17cirjn/types_of_intermittent_fasting/,0,13,1697828596.0
Is target BMI dependent on height?,16ssqs5,DrWistfulness,https://www.reddit.com/r/nutrition/comments/16ssqs5/is_target_bmi_dependent_on_height/,1,11,1695745992.0
Is Ascorbic acid safe to consume in small amounts?,16b0e8j,AJManso26,https://www.reddit.com/r/nutrition/comments/16b0e8j/is_ascorbic_acid_safe_to_consume_in_small_amounts/,1,7,1693948415.0
Does someone here has a list of all the food additives available?,13vqpdm,harukaw4,https://www.reddit.com/r/nutrition/comments/13vqpdm/does_someone_here_has_a_list_of_all_the_food/,0,4,1685454139.0
Meat/Ancestral vs. Plant Based,112nry3,emccluskm,https://www.reddit.com/r/nutrition/comments/112nry3/meatancestral_vs_plant_based/,0,22,1676429922.0
Do sugar alcohols really cancel out carbs?,zr106v,CommercialLaugh8446,https://www.reddit.com/r/nutrition/comments/zr106v/do_sugar_alcohols_really_cancel_out_carbs/,0,17,1671573518.0
Is peanut butter healthier than animal fats (butter or tallow),wjh1lx,Pitiful-Car5004,https://www.reddit.com/r/nutrition/comments/wjh1lx/is_peanut_butter_healthier_than_animal_fats/,1,25,1659985197.0
"If grains don't have complete protein, how did so many people survive on nearly exclusively bread and beer for so many centuries?",uhcute,gettinhaahd,https://www.reddit.com/r/nutrition/comments/uhcute/if_grains_dont_have_complete_protein_how_did_so/,0,25,1651572829.0
What’s so bad with processed food?,tvzfu7,bagelsandbarbells,https://www.reddit.com/r/nutrition/comments/tvzfu7/whats_so_bad_with_processed_food/,0,16,1649070789.0
Are cheaper Coca cola drinks even more unheatlhy than original Coca cola?,tpripu,goldenoreoinmilk,https://www.reddit.com/r/nutrition/comments/tpripu/are_cheaper_coca_cola_drinks_even_more_unheatlhy/,0,16,1648410265.0
First time ordering chipotle.,sj4c44,weisoman,https://www.reddit.com/r/nutrition/comments/sj4c44/first_time_ordering_chipotle/,2,11,1643846963.0
How do you figure out the calories in this recipe?,rzt0dg,s3lene,https://www.reddit.com/r/nutrition/comments/rzt0dg/how_do_you_figure_out_the_calories_in_this_recipe/,0,11,1641739044.0
Reheated pasta has less calories and what other foods or cooking methods differ from what labels says?,rhz2f8,YonkersLilBrat,https://www.reddit.com/r/nutrition/comments/rhz2f8/reheated_pasta_has_less_calories_and_what_other/,1,5,1639685509.0
Do plant based milks provide the same nutrients as their whole plant version?,r0o4u6,daybreakin,https://www.reddit.com/r/nutrition/comments/r0o4u6/do_plant_based_milks_provide_the_same_nutrients/,0,12,1637703897.0
"Is it True that Hormones affect Fat Placement in the following way: Insulin = Waist, Progesterone = Chest, Estrogen = Hips & Thighs?",o5slca,None,https://www.reddit.com/r/nutrition/comments/o5slca/is_it_true_that_hormones_affect_fat_placement_in/,1,5,1624383289.0
Does detox really not do anything good?,o4q5z5,louisme97,https://www.reddit.com/r/nutrition/comments/o4q5z5/does_detox_really_not_do_anything_good/,1,46,1624262657.0
Mixing Tomato and cucumber together?,ntg3gu,Dangerous-Map-429,https://www.reddit.com/r/nutrition/comments/ntg3gu/mixing_tomato_and_cucumber_together/,0,7,1622963809.0
Sparkling water is bad?,kbz7hm,None,https://www.reddit.com/r/nutrition/comments/kbz7hm/sparkling_water_is_bad/,2,7,1607814705.0
Negative calorie foods...,k715z0,None,https://www.reddit.com/r/nutrition/comments/k715z0/negative_calorie_foods/,1,18,1607143097.0
What do you eat in breakfast if you want to get rid of carbohydrats?,jlr1mi,88Question88,https://www.reddit.com/r/nutrition/comments/jlr1mi/what_do_you_eat_in_breakfast_if_you_want_to_get/,0,43,1604181702.0
Do you really need your five a day to be healthy?,iisa8y,None,https://www.reddit.com/r/nutrition/comments/iisa8y/do_you_really_need_your_five_a_day_to_be_healthy/,0,18,1598707316.0
Is it ok to eat junk foods once a week?,hngaii,ZoiZois,https://www.reddit.com/r/nutrition/comments/hngaii/is_it_ok_to_eat_junk_foods_once_a_week/,0,20,1594211841.0
How bad is milk?,hcm98u,jump_in_the_caac,https://www.reddit.com/r/nutrition/comments/hcm98u/how_bad_is_milk/,0,40,1592659543.0
"Crisis of confidence averted: Impairment of exercise economy and performance in elite race walkers by ketogenic low carbohydrate, high fat (LCHF) diet is reproducible",gxzgcq,Only8livesleft,https://www.reddit.com/r/nutrition/comments/gxzgcq/crisis_of_confidence_averted_impairment_of/,0,9,1591479058.0
What is a fruit that you just can't have an excess of?,ghretc,None,https://www.reddit.com/r/nutrition/comments/ghretc/what_is_a_fruit_that_you_just_cant_have_an_excess/,0,15,1589216166.0
Too Low calorie diet Vs. Unhealthy diet?,dn1a5p,Shiandrina,https://www.reddit.com/r/nutrition/comments/dn1a5p/too_low_calorie_diet_vs_unhealthy_diet/,0,34,1572026814.0
Are other flavors of LaCroix better than the orange one?,9476o2,None,https://www.reddit.com/r/nutrition/comments/9476o2/are_other_flavors_of_lacroix_better_than_the/,2,16,1533277228.0
Difference Between Sharp Cheddar and Mild Cheddar,8oe8xg,None,https://www.reddit.com/r/nutrition/comments/8oe8xg/difference_between_sharp_cheddar_and_mild_cheddar/,2,9,1528083279.0
Bodybuilding Clean Drinking water every day. But my sugar levels get dangerously low.,6cnvvl,None,https://www.reddit.com/r/nutrition/comments/6cnvvl/bodybuilding_clean_drinking_water_every_day_but/,1,5,1495466497.0
What diet should I do?,5evx1u,MotQ,https://www.reddit.com/r/nutrition/comments/5evx1u/what_diet_should_i_do/,0,3,1480109416.0
Best lemon juice for water? What're the true benefits of it?,3nys8q,None,https://www.reddit.com/r/nutrition/comments/3nys8q/best_lemon_juice_for_water_whatre_the_true/,0,7,1444308423.0
Nutella Protein Shake for Mass,2n928m,skinnynolonger,https://www.reddit.com/r/nutrition/comments/2n928m/nutella_protein_shake_for_mass/,1,7,1416822950.0
"Is it possible to healthily live off a diet of Coffee, Wine, Melon, Banana and various vegetable soups my wife makes in the evening with her blender.",2d1o9v,bluedunkie,https://www.reddit.com/r/nutrition/comments/2d1o9v/is_it_possible_to_healthily_live_off_a_diet_of/,0,5,1407558984.0
Doubling RDA Protein Intake Cuts Muscle Loss,1lglhq,alan2102,https://www.reddit.com/r/nutrition/comments/1lglhq/doubling_rda_protein_intake_cuts_muscle_loss/,0,19,1377956816.0
I am a 22 years old and need help with nutrition,16hxa9,BananaStandManager,https://www.reddit.com/r/nutrition/comments/16hxa9/i_am_a_22_years_old_and_need_help_with_nutrition/,0,7,1358097292.0
My tomato soup has 16 grams of sugar in it. Sixteen freaking grams!! WTF?,a77amv,Bluest_waters,https://www.reddit.com/r/nutrition/comments/a77amv/my_tomato_soup_has_16_grams_of_sugar_in_it/,191,214,1545104193.0
Need a New Years Resolution? Eat Less Meat,15mz7i,zenmushroom,https://www.reddit.com/r/nutrition/comments/15mz7i/need_a_new_years_resolution_eat_less_meat/,0,24,1356812676.0
Alcohol thoughts ,1dy745l,onlyreddragon,https://www.reddit.com/r/nutrition/comments/1dy745l/alcohol_thoughts/,5,85,1720440012.0
Hey guys save my life before I do something stupid ,1czhadc,Inwate,https://www.reddit.com/r/nutrition/comments/1czhadc/hey_guys_save_my_life_before_i_do_something_stupid/,0,53,1716545343.0
What is with fitness influencers using almond milk in every recipe?,19f9dfo,IcyCattle6374,https://www.reddit.com/r/nutrition/comments/19f9dfo/what_is_with_fitness_influencers_using_almond/,5,95,1706189429.0
Whats healthier: To be Obese on the world healthiest diet or to be very fit and exercise daily and eat bunch of processed food and junk food whenever u feel like?,11cqu97,GrapefruitBulky4306,https://www.reddit.com/r/nutrition/comments/11cqu97/whats_healthier_to_be_obese_on_the_world/,5,63,1677441245.0
