Title,ID,Author,URL,Score,Comment Count,Created
"Spinach is high in calcium, but it has very low bioavailability. What other foods might be tricking us into thinking we're getting enough of a certain nutrient?",b6fj8k,Bunyardz,https://www.reddit.com/r/nutrition/comments/b6fj8k/spinach_is_high_in_calcium_but_it_has_very_low/,313,136,1553755949.0
I think some people are under-value fiber here.,11kkacw,keenanbullington,https://www.reddit.com/r/nutrition/comments/11kkacw/i_think_some_people_are_undervalue_fiber_here/,312,202,1678150905.0
Blue Diamond almond milk stopped adding calcium and vitamin D to their products,rvg9fp,None,https://www.reddit.com/r/nutrition/comments/rvg9fp/blue_diamond_almond_milk_stopped_adding_calcium/,307,68,1641255275.0
Morgan Spurlock from “Super Size Me” dies.,1czovyw,notahouseflipper,https://www.reddit.com/r/nutrition/comments/1czovyw/morgan_spurlock_from_super_size_me_dies/,309,230,1716568214.0
"If we only need 500mg of salt a day, why did we evolve to find it so tasty?",z4fhgv,Statsfurnace,https://www.reddit.com/r/nutrition/comments/z4fhgv/if_we_only_need_500mg_of_salt_a_day_why_did_we/,303,118,1669388618.0
Do you drink the broth of Vietnamese noodle soup aka pho?,vmxhmc,thisisafullsentence,https://www.reddit.com/r/nutrition/comments/vmxhmc/do_you_drink_the_broth_of_vietnamese_noodle_soup/,312,205,1656449424.0
"Is eating 10,000 calories one day and 1000 for 6 days the same as eating 1571 calories 7 days?",hf5kbg,storyofmylifedude,https://www.reddit.com/r/nutrition/comments/hf5kbg/is_eating_10000_calories_one_day_and_1000_for_6/,309,111,1593020658.0
Most beneficial vitamin/supplement you’ve added to your diet?,vw5kwj,Substantial-Pie913,https://www.reddit.com/r/nutrition/comments/vw5kwj/most_beneficial_vitaminsupplement_youve_added_to/,308,338,1657500201.0
Which country's cuisine is the best from a nutritional standpoint?,ovu63q,ace8995,https://www.reddit.com/r/nutrition/comments/ovu63q/which_countrys_cuisine_is_the_best_from_a/,310,235,1627831776.0
Is overeating a learnt or acquired behavior or it is genetic and it is present in early childhood?,hk9c60,mayermail1977,https://www.reddit.com/r/nutrition/comments/hk9c60/is_overeating_a_learnt_or_acquired_behavior_or_it/,309,100,1593737190.0
Is there a list of foods that go together exceptionally well?,mkgpf8,rdvw,https://www.reddit.com/r/nutrition/comments/mkgpf8/is_there_a_list_of_foods_that_go_together/,308,145,1617615020.0
Will a diet high in vegetables compensate for lack of fruit consumption??,gwo1fr,butternutsquashs0up,https://www.reddit.com/r/nutrition/comments/gwo1fr/will_a_diet_high_in_vegetables_compensate_for/,304,110,1591298107.0
Added Sugars in Literally Everything,m6o6gw,HologramFam,https://www.reddit.com/r/nutrition/comments/m6o6gw/added_sugars_in_literally_everything/,299,152,1615942603.0
Was at a gym and had a free gym trainer session and he said something that I an not sure is true.,i8km1a,-Chrysoberl-,https://www.reddit.com/r/nutrition/comments/i8km1a/was_at_a_gym_and_had_a_free_gym_trainer_session/,303,130,1597261289.0
Do cravings reflect what you(r body) may be lacking in?,11py7pc,contemplatingabit666,https://www.reddit.com/r/nutrition/comments/11py7pc/do_cravings_reflect_what_your_body_may_be_lacking/,301,175,1678676372.0
Will drinking a lot of water offset the impacts of a high sodium meal?,l1uo2g,Bleepbloop3002,https://www.reddit.com/r/nutrition/comments/l1uo2g/will_drinking_a_lot_of_water_offset_the_impacts/,306,121,1611219096.0
"Are natural sweeteners such as honey, maple syrup, agave syrup etc. any healthier than regular sugar?",keidqv,daisy_darkacdemia,https://www.reddit.com/r/nutrition/comments/keidqv/are_natural_sweeteners_such_as_honey_maple_syrup/,305,131,1608153994.0
What are some underrated nutrient dense foods?,jc5iot,None,https://www.reddit.com/r/nutrition/comments/jc5iot/what_are_some_underrated_nutrient_dense_foods/,303,232,1602833387.0
How do you avoid added sugar in America?,11wuebb,NevermindWait,https://www.reddit.com/r/nutrition/comments/11wuebb/how_do_you_avoid_added_sugar_in_america/,298,252,1679343377.0
Who would live longer: Someone who only eats Big Macs or someone who only eats spinach for the rest of their lives?,vjpcz7,Mindless_Opposite_44,https://www.reddit.com/r/nutrition/comments/vjpcz7/who_would_live_longer_someone_who_only_eats_big/,300,233,1656079849.0
Canada Trans Fats Ban Starts Today,9girbb,Munninnu,https://www.reddit.com/r/nutrition/comments/9girbb/canada_trans_fats_ban_starts_today/,300,46,1537175581.0
What’s one food you won’t give up no matter what ?,1dswp1h,TheSeeker1000,https://www.reddit.com/r/nutrition/comments/1dswp1h/whats_one_food_you_wont_give_up_no_matter_what/,298,770,1719849846.0
"Who is the 'healthiest' person you know, and what are some of their habits?",apklmk,postpin,https://www.reddit.com/r/nutrition/comments/apklmk/who_is_the_healthiest_person_you_know_and_what/,302,175,1549916925.0
"if someone’s daily intake of water is 1L and they start drinking 2L of water for a entire month, what noticeable changes would they notice.  ",1dkyeg0,RoseAFreak,https://www.reddit.com/r/nutrition/comments/1dkyeg0/if_someones_daily_intake_of_water_is_1l_and_they/,299,243,1718955630.0
Why do we need to eat such a crazy amount of protein to gain muscle?,193ernp,Dances28,https://www.reddit.com/r/nutrition/comments/193ernp/why_do_we_need_to_eat_such_a_crazy_amount_of/,301,210,1704910149.0
Two recent studies show that you don't need to be in a caloric surplus to gain muscle and lose fat at the same time. One study involved overweight male participants and the other involved lean female participants. Men ate 2.4g of protein per kg. Women ate 2.5g of protein per kg.,cht21o,cangetenough,https://www.reddit.com/r/nutrition/comments/cht21o/two_recent_studies_show_that_you_dont_need_to_be/,298,47,1564086469.0
"Layne norton: “Less than 2% of the fat in adipose comes from carbohydrates”. Studies cited directly in the podcast, puts to bed the false assumption that carbs increase adipose fat storage",11o0iu3,dirtyculture808,https://www.reddit.com/r/nutrition/comments/11o0iu3/layne_norton_less_than_2_of_the_fat_in_adipose/,296,384,1678481587.0
"if calories = energy, why do some high calorie things not make you satiated and energized while low calorie things do?",messhn,stardustbasically,https://www.reddit.com/r/nutrition/comments/messhn/if_calories_energy_why_do_some_high_calorie/,297,51,1616899263.0
Should unit price be legally required and enforced on price tags in grocery stores?,t2equr,None,https://www.reddit.com/r/nutrition/comments/t2equr/should_unit_price_be_legally_required_and/,295,61,1645932380.0
What are some foods you just refuse to substitute?,lxps9w,ccgjin,https://www.reddit.com/r/nutrition/comments/lxps9w/what_are_some_foods_you_just_refuse_to_substitute/,296,221,1614878220.0
US baby-food firm Beech-Nut facing legal action over toxic metal claims,nugg1x,whitelightstorm,https://www.reddit.com/r/nutrition/comments/nugg1x/us_babyfood_firm_beechnut_facing_legal_action/,298,39,1623082536.0
Avocados 🥑 are one of natures superfoods. Why are they so expensive now?,uphb97,oakstreetgirl,https://www.reddit.com/r/nutrition/comments/uphb97/avocados_are_one_of_natures_superfoods_why_are/,290,187,1652535012.0
Are fruits really as unhealthy as normal sugar?,msxd32,None,https://www.reddit.com/r/nutrition/comments/msxd32/are_fruits_really_as_unhealthy_as_normal_sugar/,299,188,1618687889.0
What are some good brain food to incorporate to have good focus and memory?,kr0v8a,throawayz21,https://www.reddit.com/r/nutrition/comments/kr0v8a/what_are_some_good_brain_food_to_incorporate_to/,291,137,1609861546.0
Are dates healthy? They seem too sweet to be healthy,ndoo5m,None,https://www.reddit.com/r/nutrition/comments/ndoo5m/are_dates_healthy_they_seem_too_sweet_to_be/,290,161,1621172749.0
What is the healthiest way to drink alcohol?,mzq3ar,Hitaro9,https://www.reddit.com/r/nutrition/comments/mzq3ar/what_is_the_healthiest_way_to_drink_alcohol/,294,262,1619534828.0
Too much chia seeds,j3l2dx,burecky,https://www.reddit.com/r/nutrition/comments/j3l2dx/too_much_chia_seeds/,288,115,1601600065.0
Study: Artificial Sweeteners Have Toxic Effects on Gut Bacteria. Even at very low levels artificial sweeteners like aspartame caused the bacteria found in the digestive system to became toxic.,b383q8,Pollyhotpocketposts,https://www.reddit.com/r/HumanMicrobiome/comments/b2p7sd/study_artificial_sweeteners_have_toxic_effects_on/,293,84,1553059697.0
What are THE healthiest foods?,1bn20by,Fresh-Alternative910,https://www.reddit.com/r/nutrition/comments/1bn20by/what_are_the_healthiest_foods/,290,442,1711331399.0
"What is worse for you, drinking 1 can of regular Coke per day or drinking 1 can of Coke Zero per day?",19c6ek4,Legitimate_Bison3756,https://www.reddit.com/r/nutrition/comments/19c6ek4/what_is_worse_for_you_drinking_1_can_of_regular/,289,649,1705852550.0
What's the most beneficial thing to cut from a diet?,pt8kk6,BA2MADRID,https://www.reddit.com/r/nutrition/comments/pt8kk6/whats_the_most_beneficial_thing_to_cut_from_a_diet/,288,506,1632320531.0
What diets/food items are not nearly as unhealthy as the general public thinks?,p42n1c,Portalrules123,https://www.reddit.com/r/nutrition/comments/p42n1c/what_dietsfood_items_are_not_nearly_as_unhealthy/,291,381,1628921229.0
"If eating before bed is bad for you, why do people feel tired after eating a large meal?",kc5w0w,LifeInAction,https://www.reddit.com/r/nutrition/comments/kc5w0w/if_eating_before_bed_is_bad_for_you_why_do_people/,288,89,1607841295.0
Are we best off avoiding non-organic fruit and veg that are known to absorb pesticides such as blueberries if we can’t afford to buy them organic?,hyysz8,vegetable_companion,https://www.reddit.com/r/nutrition/comments/hyysz8/are_we_best_off_avoiding_nonorganic_fruit_and_veg/,292,148,1595877439.0
Do different ethnicities have slightly different nutritional needs?,vnnoa9,None,https://www.reddit.com/r/nutrition/comments/vnnoa9/do_different_ethnicities_have_slightly_different/,289,165,1656530056.0
What is a tip you wish you knew when beginning your health journey?,uh4jpp,ElderberryBusiness92,https://www.reddit.com/r/nutrition/comments/uh4jpp/what_is_a_tip_you_wish_you_knew_when_beginning/,288,248,1651539979.0
Why is there so much conflicting information regarding what types of diets are healthy?,f8wzp6,platypus_teeth,https://www.reddit.com/r/nutrition/comments/f8wzp6/why_is_there_so_much_conflicting_information/,285,176,1582574040.0
Can combining too many different foods make it toxic?,199gsvp,ComfyLyfe,https://www.reddit.com/r/nutrition/comments/199gsvp/can_combining_too_many_different_foods_make_it/,287,314,1705549872.0
"With cost of living rising significantly, what are some general 'Bang for buck' foods / Foods that should be prioritized?",tsut1c,None,https://www.reddit.com/r/nutrition/comments/tsut1c/with_cost_of_living_rising_significantly_what_are/,287,170,1648713555.0
Is sugar in fruit different from added sugar,ru7yuo,Noswad_gaymer,https://www.reddit.com/r/nutrition/comments/ru7yuo/is_sugar_in_fruit_different_from_added_sugar/,283,117,1641123548.0
"After endurance workouts you're supposed to eat, largely to replenish glycogen stores.",irzhvb,saltywithbutter,https://www.reddit.com/r/nutrition/comments/irzhvb/after_endurance_workouts_youre_supposed_to_eat/,289,120,1600008376.0
"Which frying oils are best? Smoke point actually isn't a good indicator. (Science discussion: ""Potential Adverse Public Health Effects Afforded by the Ingestion of Dietary Lipid Oxidation Product Toxins: Significance of Fried Food Sources"" Apr 2020)",hahelq,fhtagnfool,https://www.reddit.com/r/nutrition/comments/hahelq/which_frying_oils_are_best_smoke_point_actually/,288,141,1592357690.0
FDA to kill trans fat once and for all,dcm5y1,AntonJedno23533,https://www.reddit.com/r/nutrition/comments/dcm5y1/fda_to_kill_trans_fat_once_and_for_all/,288,113,1570078168.0
I've never been a fan of fad diets. A high-fat diet isn't an excuse to eat junk foods with low nutritional value.,d5zdr9,temple-monkey,https://www.reddit.com/r/nutrition/comments/d5zdr9/ive_never_been_a_fan_of_fad_diets_a_highfat_diet/,287,173,1568820360.0
What benefits did you notice after adopting a ‘Clean’ Diet ?,l36v31,kyle768,https://www.reddit.com/r/nutrition/comments/l36v31/what_benefits_did_you_notice_after_adopting_a/,289,189,1611383168.0
Why everyone thinks they are a nutrition expert. Interesting look at the psychology behind it,bciqae,oar2950,https://www.reddit.com/r/nutrition/comments/bciqae/why_everyone_thinks_they_are_a_nutrition_expert/,286,91,1555102596.0
Didn't eat for 4 days. My mind feels less cloudy and more alert. Why?,b8lm3w,None,https://www.reddit.com/r/nutrition/comments/b8lm3w/didnt_eat_for_4_days_my_mind_feels_less_cloudy/,286,98,1554223252.0
"Why do most people appear to completely ignore the scientifically proven health effects of phytonutrients from vegs, legumes, fruit and whole grain products and focus mainly on protein/fat/carb ratios?",13jx7yu,ego157,https://www.reddit.com/r/nutrition/comments/13jx7yu/why_do_most_people_appear_to_completely_ignore/,284,256,1684317359.0
What are some foods that are marketed as healthy but aren’t actually healthy for you?,lhbzf7,lordvoldemortisgay,https://www.reddit.com/r/nutrition/comments/lhbzf7/what_are_some_foods_that_are_marketed_as_healthy/,281,551,1613014672.0
"If you have a vitamin deficiency for example, why can’t you just take a lot of that specific vitamin at once and be done?",jdgzud,None,https://www.reddit.com/r/nutrition/comments/jdgzud/if_you_have_a_vitamin_deficiency_for_example_why/,288,93,1603030363.0
"So Broccoli is very low calorie even a large portion at 1 kg (2.2lbs) is only 350kcal and it gives you your daily recommended beta-Carotene, Folic Acid, Vitamins C, K, a lot of manganese, potassium, even Zinc...",14mj0ww,ego157,https://www.reddit.com/r/nutrition/comments/14mj0ww/so_broccoli_is_very_low_calorie_even_a_large/,284,122,1688078816.0
Do Bodies Really Revert to 'Preferred Weight'?,10as2zt,Chief_Whizz,https://www.reddit.com/r/nutrition/comments/10as2zt/do_bodies_really_revert_to_preferred_weight/,285,245,1673608718.0
Are there any benefits to complete abstinence from alcohol?,yvdvrb,HeyThereMrBrooks,https://www.reddit.com/r/nutrition/comments/yvdvrb/are_there_any_benefits_to_complete_abstinence/,282,258,1668462884.0
"Why can’t we eat chicken that’s not fully cooked, but can for beef?",ygh4gy,lipuss,https://www.reddit.com/r/nutrition/comments/ygh4gy/why_cant_we_eat_chicken_thats_not_fully_cooked/,281,119,1667042616.0
Stupid question: what exactly makes sugar bad?,m5v08l,kyleknightly,https://www.reddit.com/r/nutrition/comments/m5v08l/stupid_question_what_exactly_makes_sugar_bad/,278,178,1615842715.0
How to stop eating a lot of junk food?,lp3j8d,sweetswift,https://www.reddit.com/r/nutrition/comments/lp3j8d/how_to_stop_eating_a_lot_of_junk_food/,278,198,1613932924.0
What is the most underrated/overlooked foods that are very healthy?,ik2xmf,JSHFV222,https://www.reddit.com/r/nutrition/comments/ik2xmf/what_is_the_most_underratedoverlooked_foods_that/,279,390,1598896600.0
What are the least nutritious fruits and vegetables?,pefz23,Tom_The_Human,https://www.reddit.com/r/nutrition/comments/pefz23/what_are_the_least_nutritious_fruits_and/,278,217,1630321922.0
Foods for glowy skin?,obvusv,sweetswift,https://www.reddit.com/r/nutrition/comments/obvusv/foods_for_glowy_skin/,278,193,1625175384.0
"Does the amount of sodium listed on the nutrition label of canned goods (like pickles) refer to how much sodium someone actually eats, or does some of the sodium stay in the liquid that comes in the can (that you don’t eat)?",jyxui4,IdBuyIt,https://www.reddit.com/r/nutrition/comments/jyxui4/does_the_amount_of_sodium_listed_on_the_nutrition/,280,55,1606060516.0
Why is this so hard?,fctx4m,NetwerkErrer,https://www.reddit.com/r/nutrition/comments/fctx4m/why_is_this_so_hard/,283,145,1583238891.0
Do mushrooms have much nutritional value at all? Seems like they don't really do too much.,yfol23,LeftSquare1,https://www.reddit.com/r/nutrition/comments/yfol23/do_mushrooms_have_much_nutritional_value_at_all/,279,185,1666964673.0
Doesn’t the AMOUNT of food consumed massively influence the positive or negative health effects of a food?,xup1mc,Hot_Advance3592,https://www.reddit.com/r/nutrition/comments/xup1mc/doesnt_the_amount_of_food_consumed_massively/,278,58,1664816434.0
Is broccoli a good replacement if you dont eat a lot of dark leafy greens?,te5lva,Prnce_Chrmin,https://www.reddit.com/r/nutrition/comments/te5lva/is_broccoli_a_good_replacement_if_you_dont_eat_a/,275,144,1647286115.0
What is the most fattening terrible food in existence that you don't have to eat very much of to be eating unhealthy?,pvo89t,None,https://www.reddit.com/r/nutrition/comments/pvo89t/what_is_the_most_fattening_terrible_food_in/,277,424,1632637085.0
What happens to your body when you don’t eat enough?,o5wb3z,None,https://www.reddit.com/r/nutrition/comments/o5wb3z/what_happens_to_your_body_when_you_dont_eat_enough/,278,123,1624393236.0
"always tired, even with 10 hours of sleep",1aiusq5,Chance_Strike_8804,https://www.reddit.com/r/nutrition/comments/1aiusq5/always_tired_even_with_10_hours_of_sleep/,274,261,1707071617.0
Does a human equivalent of kibble exist?,12n2axl,Brrendon003214,https://www.reddit.com/r/nutrition/comments/12n2axl/does_a_human_equivalent_of_kibble_exist/,278,222,1681565060.0
What food surprised you with how healthy it is?,tunr9w,therealtobiw,https://www.reddit.com/r/nutrition/comments/tunr9w/what_food_surprised_you_with_how_healthy_it_is/,281,319,1648919204.0
Do you believe different people have very different dietary needs?,i0bc4h,None,https://www.reddit.com/r/nutrition/comments/i0bc4h/do_you_believe_different_people_have_very/,277,122,1596065801.0
"What foods are exactly 33% fat, carbs, and protein?",oyb3gp,froopla1,https://www.reddit.com/r/nutrition/comments/oyb3gp/what_foods_are_exactly_33_fat_carbs_and_protein/,274,170,1628141846.0
Misleading serving sizes,jrs5ka,demonman101,https://www.reddit.com/r/nutrition/comments/jrs5ka/misleading_serving_sizes/,276,84,1605038018.0
"My fellow nutrition and health nuts, what is your favorite food, how often do you eat it, and what makes it your favorite?",ozlqxp,rorypetersens,https://www.reddit.com/r/nutrition/comments/ozlqxp/my_fellow_nutrition_and_health_nuts_what_is_your/,274,325,1628306791.0
How is eating a bagel with 45g of carbs different from eating a muffin with 45g of carbs?,o14wuk,None,https://www.reddit.com/r/nutrition/comments/o14wuk/how_is_eating_a_bagel_with_45g_of_carbs_different/,272,92,1623850195.0
Does intermittent fasting have any fat loss advantage over typical calorie control?,nejli9,hi-Im-gosu,https://www.reddit.com/r/nutrition/comments/nejli9/does_intermittent_fasting_have_any_fat_loss/,271,192,1621266181.0
Cringy nutrition trends,11jjjo7,brookell27,https://www.reddit.com/r/nutrition/comments/11jjjo7/cringy_nutrition_trends/,272,671,1678064019.0
What would be the simplest but most nutritious diet humans could consume?,ilj41l,marioedy,https://www.reddit.com/r/nutrition/comments/ilj41l/what_would_be_the_simplest_but_most_nutritious/,272,297,1599092821.0
Hong Kong now has highest life expectancy in the world.,9cgeqg,AuLex456,https://www.reddit.com/r/nutrition/comments/9cgeqg/hong_kong_now_has_highest_life_expectancy_in_the/,271,66,1535929658.0
Is it accurate to say that added sugar is the main culprit behind obesity in the USA?,1au6ygk,None,https://www.reddit.com/r/nutrition/comments/1au6ygk/is_it_accurate_to_say_that_added_sugar_is_the/,266,336,1708295444.0
How long does it take for eating nutritious food to have an impact on your health,16qq6wb,None,https://www.reddit.com/r/nutrition/comments/16qq6wb/how_long_does_it_take_for_eating_nutritious_food/,269,155,1695536244.0
"What are some ""low hanging fruit"" regarding nutrition?",ijy1fe,killerbunny_00,https://www.reddit.com/r/nutrition/comments/ijy1fe/what_are_some_low_hanging_fruit_regarding/,272,298,1598880768.0
What’s a low calorie snack that people don’t think of? ,1cdbpql,Disastrous-Release86,https://www.reddit.com/r/nutrition/comments/1cdbpql/whats_a_low_calorie_snack_that_people_dont_think/,270,421,1714103551.0
Is honey actually any good?,lmtbzm,imabadguyduh,https://www.reddit.com/r/nutrition/comments/lmtbzm/is_honey_actually_any_good/,271,207,1613672459.0
"Brussel sprouts, even more nutritionally loaded than cabbage or kale?",jfahmf,None,https://www.reddit.com/r/nutrition/comments/jfahmf/brussel_sprouts_even_more_nutritionally_loaded/,274,114,1603277017.0
Rotten: A really good Netflix documentary series on the food industry,7ojnvn,None,https://www.reddit.com/r/nutrition/comments/7ojnvn/rotten_a_really_good_netflix_documentary_series/,270,66,1515250752.0
What makes people look 'healthy'?,wbenol,lunavicuna,https://www.reddit.com/r/nutrition/comments/wbenol/what_makes_people_look_healthy/,268,223,1659125921.0
Feel like this belongs here,97p18s,Elfanara,https://www.reddit.com/r/LifeProTips/comments/97m00g/lpt_nutritionistsnutritional_therapists_holistic/,270,20,1534391885.0
Are fruits and vegetables really that expensive?,11se0wx,sarah_gresham,https://www.reddit.com/r/nutrition/comments/11se0wx/are_fruits_and_vegetables_really_that_expensive/,269,306,1678925251.0
"Why do nutrition experts often say that if you are eating a ""healthy"" meal, but add butter/high-saturated fat sauce (e.g. hollandaise), then it essentially ruins the benefits from the other ingredients?",n0kah8,snippetnthyme,https://www.reddit.com/r/nutrition/comments/n0kah8/why_do_nutrition_experts_often_say_that_if_you/,268,157,1619631516.0
"If you have a lot of sugar in your diet, but it's mostly from fruit, does it carry similar risks to if you ate the same amount in added sugar?",vj78bg,DisastrousGarlic110,https://www.reddit.com/r/nutrition/comments/vj78bg/if_you_have_a_lot_of_sugar_in_your_diet_but_its/,268,126,1656018555.0
Is peanut butter healthy???,mus53t,Whatchuon,https://www.reddit.com/r/nutrition/comments/mus53t/is_peanut_butter_healthy/,267,232,1618930499.0
"Genuinely curious why hamburgers are considered the staple ""unhealthy food""",1cllqko,cyber1551,https://www.reddit.com/r/nutrition/comments/1cllqko/genuinely_curious_why_hamburgers_are_considered/,267,222,1715009009.0
What are some healthy foods people usually forget about?,f7tklg,tetrisyndrome,https://www.reddit.com/r/nutrition/comments/f7tklg/what_are_some_healthy_foods_people_usually_forget/,265,229,1582383526.0
"I've read recently that Coconut Oil (which I heard was a ""healthy fat"") has more saturated fat than butter or lard.",dwsu7r,KanataCitizen,https://www.reddit.com/r/nutrition/comments/dwsu7r/ive_read_recently_that_coconut_oil_which_i_heard/,267,161,1573834052.0
The Ecosystem Below Our Feet: Why Soil Matters for Nutrition,zd071v,Davi_2022,https://www.reddit.com/r/nutrition/comments/zd071v/the_ecosystem_below_our_feet_why_soil_matters_for/,266,25,1670225102.0
Why is Japanese food considered healthy whereas it is commonly known as rice-based?,wo8bbl,z6400,https://www.reddit.com/r/nutrition/comments/wo8bbl/why_is_japanese_food_considered_healthy_whereas/,263,200,1660489078.0
Are our bodies built to consume large amounts of carbohydrates that we consume today ?,s1bghz,None,https://www.reddit.com/r/nutrition/comments/s1bghz/are_our_bodies_built_to_consume_large_amounts_of/,267,145,1641902902.0
Which do you value more? The intake of 'good stuff' OR the avoidance of 'bad stuff'? leafy greens+candy VS. neither,ki85lm,SuddenSurplus,https://www.reddit.com/r/nutrition/comments/ki85lm/which_do_you_value_more_the_intake_of_good_stuff/,268,74,1608653194.0
Recommended Protein intake: A meta-analysis of multiple studies on how much protein to take (g/kg) per day for muscle building.,dljii6,mpurses,https://www.reddit.com/r/nutrition/comments/dljii6/recommended_protein_intake_a_metaanalysis_of/,265,99,1571758167.0
"""Nutrition matters for everybody, but you can't major in it at Harvard. Most top scientists go into other fields. Most of the big studies were done 30 or 40 years ago, and most are seriously flawed...we know more about the physics of faraway stars than we know about human nutrition."" - Peter Theil",3fuv74,Razaberry,https://www.reddit.com/r/nutrition/comments/3fuv74/nutrition_matters_for_everybody_but_you_cant/,264,38,1438767087.0
Why is fasting good for you?,1duzxld,Sufficient-Ad-3586,https://www.reddit.com/r/nutrition/comments/1duzxld/why_is_fasting_good_for_you/,266,172,1720073820.0
Watched “The NeverEnding Story” last night & the dad blends some Oj & a raw egg to make himself a drink for bfast. What’s this?,x77wrj,Fearless_Dinner4574,https://www.reddit.com/r/nutrition/comments/x77wrj/watched_the_neverending_story_last_night_the_dad/,268,146,1662462990.0
"Eat breakfast like a king, lunch like a prince and dinner like a pauper.",f96y7v,xynaxia,https://www.reddit.com/r/nutrition/comments/f96y7v/eat_breakfast_like_a_king_lunch_like_a_prince_and/,267,132,1582617584.0
"QUESTION: Doctors usually advise people to eat something every 3 hours, not too light, not too heavy. What about fasting, then?",ma0brs,None,https://www.reddit.com/r/nutrition/comments/ma0brs/question_doctors_usually_advise_people_to_eat/,264,168,1616344313.0
Calorie Requirements of an NFL Lineman,hm7vau,None,https://www.reddit.com/r/nutrition/comments/hm7vau/calorie_requirements_of_an_nfl_lineman/,261,52,1594042950.0
What are your favourite “healthier” desserts?,cvpoix,None,https://www.reddit.com/r/nutrition/comments/cvpoix/what_are_your_favourite_healthier_desserts/,265,208,1566833824.0
Where did “Kid Food” come from?,b4wwh4,ploopitywow,https://www.reddit.com/r/nutrition/comments/b4wwh4/where_did_kid_food_come_from/,263,84,1553437666.0
