Title,ID,Author,URL,Score,Comment Count,Created
"Brian Wansink, Cornell University professor and author of Mindless Eating - is selling a weight loss program (kickstarter)",2cbxwn,None,https://www.reddit.com/r/nutrition/comments/2cbxwn/brian_wansink_cornell_university_professor_and/,3,0,1406897566.0
Getting prescribed drugs out of my system quicker how?,22l7ij,overitbigtime,https://www.reddit.com/r/nutrition/comments/22l7ij/getting_prescribed_drugs_out_of_my_system_quicker/,1,10,1397025917.0
How does Vitamin B's work?,21vkav,Ogten,https://www.reddit.com/r/nutrition/comments/21vkav/how_does_vitamin_bs_work/,2,4,1396311150.0
Why do I need to eat fruits and veggies?,21u8qc,hotrod7262,https://www.reddit.com/r/nutrition/comments/21u8qc/why_do_i_need_to_eat_fruits_and_veggies/,0,17,1396284183.0
How can you eat that?,20ex03,casualchris56,https://www.reddit.com/r/nutrition/comments/20ex03/how_can_you_eat_that/,1,14,1394816092.0
Dairy Products and Brain Allergies,1plqcb,13005,https://www.reddit.com/r/nutrition/comments/1plqcb/dairy_products_and_brain_allergies/,2,7,1383209345.0
Juice fast: yay or nay?,162v5w,ibkiwi,https://www.reddit.com/r/nutrition/comments/162v5w/juice_fast_yay_or_nay/,0,8,1357507374.0
What's the perfect food that I can eat for three meals a day?,14eo3w,None,https://www.reddit.com/r/nutrition/comments/14eo3w/whats_the_perfect_food_that_i_can_eat_for_three/,1,60,1354831406.0
"Wanting to teat healthier, completely clueless about reading the labels/what to look for...",13nbud,ProfessorDoctorMF,https://www.reddit.com/r/nutrition/comments/13nbud/wanting_to_teat_healthier_completely_clueless/,0,13,1353636756.0
Do peanuts make anyone else ridicolously tired and fatiqued?,1ds8u0a,BeyondSubstantial159,https://www.reddit.com/r/nutrition/comments/1ds8u0a/do_peanuts_make_anyone_else_ridicolously_tired/,1,22,1719774251.0
"Comparatively speaking, which would have more Omega-3 content, grass-fed beef tallow or grass-fed butter?",1de9qqc,PowerfullyWeak,https://www.reddit.com/r/nutrition/comments/1de9qqc/comparatively_speaking_which_would_have_more/,0,11,1718206879.0
is this possible? almost no fat beef?,1d3k898,volcanopenguins,https://www.reddit.com/r/nutrition/comments/1d3k898/is_this_possible_almost_no_fat_beef/,0,15,1717009938.0
Can anyone attest to the health benefits of hot honey?,1amn4us,ShotStorm7678,https://www.reddit.com/r/nutrition/comments/1amn4us/can_anyone_attest_to_the_health_benefits_of_hot/,1,27,1707481976.0
What's the deal with Impossible foods?,194mqzb,Onarchboi,https://www.reddit.com/r/nutrition/comments/194mqzb/whats_the_deal_with_impossible_foods/,0,22,1705035466.0
Steak macros — if you remove the fat is the fat macros true?,18ped1b,footballman25,https://www.reddit.com/r/nutrition/comments/18ped1b/steak_macros_if_you_remove_the_fat_is_the_fat/,1,9,1703363560.0
Does dry brining destroy nutrition of meat?,17ctt43,telcoman,https://www.reddit.com/r/nutrition/comments/17ctt43/does_dry_brining_destroy_nutrition_of_meat/,0,10,1697860453.0
Are calories the same?,175kgzr,JohnFilipstad,https://www.reddit.com/r/nutrition/comments/175kgzr/are_calories_the_same/,0,15,1697047129.0
Confusion about how much protein chicken breast contains after cooking?,15d85j1,ign098,https://www.reddit.com/r/nutrition/comments/15d85j1/confusion_about_how_much_protein_chicken_breast/,1,9,1690678882.0
Is fat the least satiating macronutrient and leads to overeating and binging?,12yny5v,None,https://www.reddit.com/r/nutrition/comments/12yny5v/is_fat_the_least_satiating_macronutrient_and/,1,26,1682439267.0
Is vegetable fat unhealthy?,10i04wf,Xyphuz_,https://www.reddit.com/r/nutrition/comments/10i04wf/is_vegetable_fat_unhealthy/,1,48,1674331313.0
What’s the best fruit for snacking?,z3vmvh,pr3miere,https://www.reddit.com/r/nutrition/comments/z3vmvh/whats_the_best_fruit_for_snacking/,0,55,1669326688.0
What does protein do to our body with regular consumption?,ygvc4p,sobingupta,https://www.reddit.com/r/nutrition/comments/ygvc4p/what_does_protein_do_to_our_body_with_regular/,1,5,1667078930.0
anybody know where I can buy Rubidium as a mineral suitable for dietary supplements?,y19pmf,Intelligent-Way1288,https://www.reddit.com/r/nutrition/comments/y19pmf/anybody_know_where_i_can_buy_rubidium_as_a/,1,2,1665496547.0
Fresh Ginger tea low heart beat,wraivj,Ethem11,https://www.reddit.com/r/nutrition/comments/wraivj/fresh_ginger_tea_low_heart_beat/,0,12,1660798733.0
Calories in Garbanzo Beans,vj2iht,TailorLiving813,https://www.reddit.com/r/nutrition/comments/vj2iht/calories_in_garbanzo_beans/,3,4,1656006001.0
what would happen if a person took out all saturated fat from there diet,ubr4vf,blackfrankbarone,https://www.reddit.com/r/nutrition/comments/ubr4vf/what_would_happen_if_a_person_took_out_all/,3,43,1650909360.0
"Blending vegetables, do they lose nutritional value?",sorvn3,alexrevnold,https://www.reddit.com/r/nutrition/comments/sorvn3/blending_vegetables_do_they_lose_nutritional_value/,1,12,1644451196.0
5 a day fruit only?,s8dd23,captainofthememeteam,https://www.reddit.com/r/nutrition/comments/s8dd23/5_a_day_fruit_only/,1,26,1642663892.0
Health Differences Between Fried Onion And Raw Onion?,r3eypj,itaicool,https://www.reddit.com/r/nutrition/comments/r3eypj/health_differences_between_fried_onion_and_raw/,0,6,1638024351.0
Are artificial sweeteners safe to eat daily???,pexu0b,None,https://www.reddit.com/r/nutrition/comments/pexu0b/are_artificial_sweeteners_safe_to_eat_daily/,0,22,1630380483.0
Counting proteins for calories intake,p9dnjm,dincad,https://www.reddit.com/r/nutrition/comments/p9dnjm/counting_proteins_for_calories_intake/,0,26,1629643401.0
Why do people say sugar is bad for you,nl6yy9,lbn349,https://www.reddit.com/r/nutrition/comments/nl6yy9/why_do_people_say_sugar_is_bad_for_you/,2,17,1621998575.0
Why refined sugar is so bad?,mcae30,None,https://www.reddit.com/r/nutrition/comments/mcae30/why_refined_sugar_is_so_bad/,3,20,1616604244.0
"If consuming fat doesn't release insulin and thereby doesn't make you 'fat' , what's the point of adding it in the 'calories in' ?",m63t0e,Accomplished_Cod1099,https://www.reddit.com/r/nutrition/comments/m63t0e/if_consuming_fat_doesnt_release_insulin_and/,0,30,1615881008.0
"if the body can only use abt 25-30g of protein at one time, approx. how long until the body is 'reset' enough to utilize another 25g?",lfecmb,nickDNR,https://www.reddit.com/r/nutrition/comments/lfecmb/if_the_body_can_only_use_abt_2530g_of_protein_at/,0,24,1612798648.0
How about ultra-filtered milk like Fairlife?,kuc6d8,astraladventures,https://www.reddit.com/r/nutrition/comments/kuc6d8/how_about_ultrafiltered_milk_like_fairlife/,0,32,1610274573.0
Calling all nutrition experts; RD/RDN/MD; WHAT’S YOUR TAKE ON KETO?,jdb448,Jesuslover4ever,https://www.reddit.com/r/nutrition/comments/jdb448/calling_all_nutrition_experts_rdrdnmd_whats_your/,1,70,1603001105.0
What foods are known to cause colon cancer?,iadf65,i3ish,https://www.reddit.com/r/nutrition/comments/iadf65/what_foods_are_known_to_cause_colon_cancer/,0,23,1597518681.0
Fruits and berries,hmx8ya,ssides01,https://www.reddit.com/r/nutrition/comments/hmx8ya/fruits_and_berries/,0,8,1594137565.0
What is the best diet for optimum sports preformance?,g77d5m,KindaFrench,https://www.reddit.com/r/nutrition/comments/g77d5m/what_is_the_best_diet_for_optimum_sports/,0,12,1587730667.0
How do you not lose more fat on a keto diet than a regular diet?,g4kbf3,highsierra123,https://www.reddit.com/r/nutrition/comments/g4kbf3/how_do_you_not_lose_more_fat_on_a_keto_diet_than/,1,10,1587348721.0
What animal liver is best for vitamins?,f2jckv,None,https://www.reddit.com/r/nutrition/comments/f2jckv/what_animal_liver_is_best_for_vitamins/,1,14,1581472344.0
Is Panera Bread as healthy as they say they are?,e08wt8,MysticalChaos,https://www.reddit.com/r/nutrition/comments/e08wt8/is_panera_bread_as_healthy_as_they_say_they_are/,1,13,1574463440.0
"What is you favorite, most nutritious thing to cook using a burner and a frying pan?",cpesgf,mdeckert,https://www.reddit.com/r/nutrition/comments/cpesgf/what_is_you_favorite_most_nutritious_thing_to/,2,2,1565627568.0
Gorillas follow a high fat diet. Should humans too?,c4douc,lennonpaiva,https://www.reddit.com/r/nutrition/comments/c4douc/gorillas_follow_a_high_fat_diet_should_humans_too/,1,26,1561330078.0
Unpopular Opinion: Huel is Garbage,bwbu5y,None,https://www.reddit.com/r/nutrition/comments/bwbu5y/unpopular_opinion_huel_is_garbage/,0,33,1559575120.0
I hear that a glass of red wine or day is healthy. Why?,bqmxpo,NsfwOlive,https://www.reddit.com/r/nutrition/comments/bqmxpo/i_hear_that_a_glass_of_red_wine_or_day_is_healthy/,0,17,1558304426.0
Is there anything I can do to help my SO get to grips with her nutrition?,b9qxt4,philmcgroin_,https://www.reddit.com/r/nutrition/comments/b9qxt4/is_there_anything_i_can_do_to_help_my_so_get_to/,1,7,1554469374.0
"Hi I'm working at a fast food restaurant, so apparently I have one meal everyday from the restuart so what",86l7th,None,https://www.reddit.com/r/nutrition/comments/86l7th/hi_im_working_at_a_fast_food_restaurant_so/,0,10,1521816687.0
"Do you think people would buy personally customized multivitamins (e.g. by specific age, gender, health goals, etc.)?",5x81bq,NeverendingUniverse,https://www.reddit.com/r/nutrition/comments/5x81bq/do_you_think_people_would_buy_personally/,0,14,1488511406.0
"As a gamer, I'm a target for Energy drinks. I decided to look into them more",5lsp13,esportsfitnessorg,https://www.reddit.com/r/nutrition/comments/5lsp13/as_a_gamer_im_a_target_for_energy_drinks_i/,3,1,1483459707.0
Are fruity pebbles healthier than cocoa pebbles?,5kvm4p,None,https://www.reddit.com/r/nutrition/comments/5kvm4p/are_fruity_pebbles_healthier_than_cocoa_pebbles/,0,8,1482996505.0
"I eat a Quest bar for a snack at work 5 days a week, not sure if it's messing me up or not...",3l22w2,Runaway_5,https://www.reddit.com/r/nutrition/comments/3l22w2/i_eat_a_quest_bar_for_a_snack_at_work_5_days_a/,1,16,1442333692.0
is raw milk bad for you?,1c21y2w,CupcakeSignal5533,https://www.reddit.com/r/nutrition/comments/1c21y2w/is_raw_milk_bad_for_you/,0,88,1712902454.0
Are sweet potato fries unhealthy?,17si66k,Paulo-Dybala10,https://www.reddit.com/r/nutrition/comments/17si66k/are_sweet_potato_fries_unhealthy/,8,82,1699662386.0
Which one is more cancerous? Air-frying or oil-frying,tvcpsl,beepbeeepyousadfuck,https://www.reddit.com/r/nutrition/comments/tvcpsl/which_one_is_more_cancerous_airfrying_or_oilfrying/,89,89,1649002010.0
What are your thoughts on Sam suleks diet from a nutrition stand point?,18u2rqy,Ray_Trader,https://www.reddit.com/r/nutrition/comments/18u2rqy/what_are_your_thoughts_on_sam_suleks_diet_from_a/,0,51,1703898092.0
What health conditions were you able to improve by completely dropping bread from your diet?,arrva9,14MTH30n3,https://www.reddit.com/r/nutrition/comments/arrva9/what_health_conditions_were_you_able_to_improve/,7,42,1550455019.0
Gold standard 100% whey proteins,98s0r2,Tihrandel,https://www.reddit.com/r/nutrition/comments/98s0r2/gold_standard_100_whey_proteins/,8,51,1534755883.0
Paleo is dead. Long live Paleo.,5kplpg,Dominik_001,https://www.reddit.com/r/nutrition/comments/5kplpg/paleo_is_dead_long_live_paleo/,10,5,1482920648.0
3 keys to gym nutrition - it's less about what you eat and more about what you do,3peekt,lyfit,https://www.reddit.com/r/nutrition/comments/3peekt/3_keys_to_gym_nutrition_its_less_about_what_you/,7,13,1445287051.0
What's the verdict on gluten? Why are so many auto.immune di.seases affected by it?,17pdxqz,Inrga,https://www.reddit.com/r/nutrition/comments/17pdxqz/whats_the_verdict_on_gluten_why_are_so_many/,12,48,1699306861.0
Are there any fast foods/ junk foods that don't have cancer causing chemicals in it?,1akkpmk,omniscientmudsucker,https://www.reddit.com/r/nutrition/comments/1akkpmk/are_there_any_fast_foods_junk_foods_that_dont/,36,155,1707253748.0
Why is Kellogg's corn flakes considered bad for you?,1diucjx,FiveFishInABucket,https://www.reddit.com/r/nutrition/comments/1diucjx/why_is_kelloggs_corn_flakes_considered_bad_for_you/,0,81,1718726796.0
Is a caloric deficit required to lose fat?,1cd9rxh,Vaerano,https://www.reddit.com/r/nutrition/comments/1cd9rxh/is_a_caloric_deficit_required_to_lose_fat/,7,42,1714097599.0
Confused about breakfast,1b7e9yj,aspadora24,https://www.reddit.com/r/nutrition/comments/1b7e9yj/confused_about_breakfast/,0,61,1709667343.0
"Leaving sugar behind, doubts about protein",17lll9j,irritable_weasel,https://www.reddit.com/r/nutrition/comments/17lll9j/leaving_sugar_behind_doubts_about_protein/,9,76,1698870928.0
Lettuce water to aide sleep.,qcgi52,Zealousideal-Gas7657,https://www.reddit.com/r/nutrition/comments/qcgi52/lettuce_water_to_aide_sleep/,7,26,1634780580.0
Are carbs a no no?,1by4z2z,RetiredDuffer,https://www.reddit.com/r/nutrition/comments/1by4z2z/are_carbs_a_no_no/,0,144,1712497844.0
"What is more inflammatory: gluten, sugar, or dairy?",105e9eo,sqrmarbles,https://www.reddit.com/r/nutrition/comments/105e9eo/what_is_more_inflammatory_gluten_sugar_or_dairy/,11,70,1673061373.0
Is olive oil actually good for health?,183g528,fowie12a,https://www.reddit.com/r/nutrition/comments/183g528/is_olive_oil_actually_good_for_health/,38,171,1700904691.0
I changed my diet from eating rice and curries each day to my daily diet being eating half a pound of chicken and 4-6 boiled eggs. Why am I getting smaller?,5cnp27,JakeSkeptic,https://www.reddit.com/r/nutrition/comments/5cnp27/i_changed_my_diet_from_eating_rice_and_curries/,0,15,1479001009.0
Why are french fries bad for you?,4t60ib,None,https://www.reddit.com/r/nutrition/comments/4t60ib/why_are_french_fries_bad_for_you/,3,33,1468696763.0
Body Fat %,4lipqh,benamen1010,https://www.reddit.com/r/nutrition/comments/4lipqh/body_fat/,2,10,1464488884.0
"I've felt addicted to junk food since I was a kid, but I stay in shape and skinny despite...",405vi8,junkfoodlove,https://www.reddit.com/r/nutrition/comments/405vi8/ive_felt_addicted_to_junk_food_since_i_was_a_kid/,2,7,1452335593.0
Does anyone need help with Psoriasis?,3hkfoi,averagejoesnutrition,https://www.reddit.com/r/nutrition/comments/3hkfoi/does_anyone_need_help_with_psoriasis/,2,26,1439979587.0
Is keto a good way to burn fat while maintaining muscle mass?,2e0bf9,None,https://www.reddit.com/r/nutrition/comments/2e0bf9/is_keto_a_good_way_to_burn_fat_while_maintaining/,4,20,1408474441.0
How less healthy are we eating no meat?,29t3fm,None,https://www.reddit.com/r/nutrition/comments/29t3fm/how_less_healthy_are_we_eating_no_meat/,2,22,1404454757.0
The four best articles I've found that explain the negative effects of cow milk consumption.,1pwfgk,zlamhcsliroj,https://www.reddit.com/r/nutrition/comments/1pwfgk/the_four_best_articles_ive_found_that_explain_the/,3,6,1383599330.0
Spirulina Powder | In-Depth Information & Top Brand Product Reviews,1hyggw,ClaireOmeara,https://www.reddit.com/r/nutrition/comments/1hyggw/spirulina_powder_indepth_information_top_brand/,0,1,1373400260.0
Appetite Suppressants? Do or not?,160jpw,ThinkyandTheBrain,https://www.reddit.com/r/nutrition/comments/160jpw/appetite_suppressants_do_or_not/,1,9,1357408045.0
Let’s finalize it: baking soda or vinegar for cleaning produce?,1dxsbfe,littlemissFOB,https://www.reddit.com/r/nutrition/comments/1dxsbfe/lets_finalize_it_baking_soda_or_vinegar_for/,0,14,1720389865.0
Thoughts on cereal with broccoli?,1dvh1hp,Snoo59059,https://www.reddit.com/r/nutrition/comments/1dvh1hp/thoughts_on_cereal_with_broccoli/,0,23,1720126372.0
How do you use your greens powder?,1d8aswn,Betanumerus,https://www.reddit.com/r/nutrition/comments/1d8aswn/how_do_you_use_your_greens_powder/,4,41,1717541819.0
How much sugar is required for essential bodily function?,1d84fkh,JurshUrso,https://www.reddit.com/r/nutrition/comments/1d84fkh/how_much_sugar_is_required_for_essential_bodily/,0,40,1717525988.0
Fish vs Beef vs Chicken; which do you pick?,1cffewp,ohkaybodyrestart,https://www.reddit.com/r/nutrition/comments/1cffewp/fish_vs_beef_vs_chicken_which_do_you_pick/,1,44,1714334164.0
Multivitamins detrimental?,1bzhkhq,zugarrette,https://www.reddit.com/r/nutrition/comments/1bzhkhq/multivitamins_detrimental/,2,47,1712631398.0
Bodybuilding cereal,1ap8asx,j_k1991,https://www.reddit.com/r/nutrition/comments/1ap8asx/bodybuilding_cereal/,0,28,1707765615.0
Will only eating things I can make with raw ingredients benefit my health,18gwe2u,New-Pack-2404,https://www.reddit.com/r/nutrition/comments/18gwe2u/will_only_eating_things_i_can_make_with_raw/,2,15,1702415156.0
"Which is worse for one’s health**?Keto (aka high-sat.) desserts, like the ‘ice cream’ - or actual ice cream/very high sugary foods?",18cm55f,_PurpleSweetz,https://www.reddit.com/r/nutrition/comments/18cm55f/which_is_worse_for_ones_healthketo_aka_highsat/,2,38,1701919155.0
Are Traditional English Sausages (Pork Bangers) Healthy?,172bizg,Bobaguy025,https://www.reddit.com/r/nutrition/comments/172bizg/are_traditional_english_sausages_pork_bangers/,0,13,1696699009.0
McDonald's as endurance fuel,11adtxz,day__moon,https://www.reddit.com/r/nutrition/comments/11adtxz/mcdonalds_as_endurance_fuel/,0,32,1677199268.0
What is the difference between 100% homey and honey that isn’t 100%? Is pure honey better?,x5539e,Ok_Concern5444,https://www.reddit.com/r/nutrition/comments/x5539e/what_is_the_difference_between_100_homey_and/,2,19,1662239881.0
Which of these people are the “healthiest”,t5vngz,None,https://www.reddit.com/r/nutrition/comments/t5vngz/which_of_these_people_are_the_healthiest/,2,34,1646325565.0
Does eating more fruit help if you are not eating any less carbs?,s4te8v,maluvikca,https://www.reddit.com/r/nutrition/comments/s4te8v/does_eating_more_fruit_help_if_you_are_not_eating/,0,5,1642278476.0
What would happen if someone were to exclusively drink tomato juice as their source of hydration?,rzoee1,triiv_k,https://www.reddit.com/r/nutrition/comments/rzoee1/what_would_happen_if_someone_were_to_exclusively/,0,10,1641722263.0
"What has more of an overall effect; Eating Bad, or Eating Good?",q332ql,lunaticc,https://www.reddit.com/r/nutrition/comments/q332ql/what_has_more_of_an_overall_effect_eating_bad_or/,3,12,1633588330.0
Is water overrated?,pyqc31,None,https://www.reddit.com/r/nutrition/comments/pyqc31/is_water_overrated/,2,20,1633028125.0
What are some of the best planet friendly recipes you've tried?,p5c9dw,RYVIASofficial,https://www.reddit.com/r/nutrition/comments/p5c9dw/what_are_some_of_the_best_planet_friendly_recipes/,1,11,1629104179.0
Is Farmed Atlantic Salmon safe to eat now?,ntikyv,None,https://www.reddit.com/r/nutrition/comments/ntikyv/is_farmed_atlantic_salmon_safe_to_eat_now/,3,10,1622974418.0
You are invited to participate in a study entitled “Do dietary choices impact mood stability?” If you are 18 years of age and older click the link below to complete our survey.,mbjhb8,MSU-MSStudent,https://www.reddit.com/r/nutrition/comments/mbjhb8/you_are_invited_to_participate_in_a_study/,2,2,1616519336.0
"For how long after consuming a meal does it become ""okay"" or appropriate to drink a caffeinated beverage, to avoid losing any nutrients?",l8q5f3,skippzee,https://www.reddit.com/r/nutrition/comments/l8q5f3/for_how_long_after_consuming_a_meal_does_it/,0,3,1612026403.0
Has anyone tried oil pulling?,k9d8vk,Snoo-9973,https://www.reddit.com/r/nutrition/comments/k9d8vk/has_anyone_tried_oil_pulling/,2,26,1607462207.0
"If you could only live on five foods, what would they be?",i4iv8d,sunnyyatt761,https://www.reddit.com/r/nutrition/comments/i4iv8d/if_you_could_only_live_on_five_foods_what_would/,0,20,1596678996.0
Is full fat milk healthy?,hsvvkf,0ndmgpyfl,https://www.reddit.com/r/nutrition/comments/hsvvkf/is_full_fat_milk_healthy/,0,21,1594993276.0
How to wash corona virus off a tomato?,fes4kw,JordanMencel,https://www.reddit.com/r/nutrition/comments/fes4kw/how_to_wash_corona_virus_off_a_tomato/,0,29,1583567653.0
Is a healthy fruitarian diet possible? What would it look like?,cdw8h7,NicolasName,https://www.reddit.com/r/nutrition/comments/cdw8h7/is_a_healthy_fruitarian_diet_possible_what_would/,2,73,1563279207.0
Saturated Fat: Part of a Healthy Diet.,95vboa,None,https://www.reddit.com/r/ketoscience/comments/95oc65/saturated_fat_part_of_a_healthy_diet/,2,4,1533811206.0
How much since does sequential eating make?,8tlhnr,lukasfreely,https://www.reddit.com/r/nutrition/comments/8tlhnr/how_much_since_does_sequential_eating_make/,0,6,1529879377.0
"I found a good video describing how nutrition works from the ground up. ""Nutrition Boot Camp"" by Sensei Strategies",76mhad,dem0n0cracy,https://www.reddit.com/r/nutrition/comments/76mhad/i_found_a_good_video_describing_how_nutrition/,0,1,1508109408.0
I found today a can of pam spray oil that expired on july 2016. It is safe to consume it now?,6vlm99,axido,https://www.reddit.com/r/nutrition/comments/6vlm99/i_found_today_a_can_of_pam_spray_oil_that_expired/,2,8,1503518736.0
Can you crush B12 pills and take it nasally?,6pzxad,VanillaVegan,https://www.reddit.com/r/nutrition/comments/6pzxad/can_you_crush_b12_pills_and_take_it_nasally/,0,13,1501198133.0
Whoever said eating healthy is cheaper lied.,69m41a,hashtagdeadlift,https://www.reddit.com/r/nutrition/comments/69m41a/whoever_said_eating_healthy_is_cheaper_lied/,1,32,1494088672.0
Some foods have a “negative” caloric content?,5oanlh,Virus4762,https://www.reddit.com/r/nutrition/comments/5oanlh/some_foods_have_a_negative_caloric_content/,2,10,1484570875.0
Soy - (can be) Harmful for your health....?,1jzgul,shadowandlight,https://www.reddit.com/r/nutrition/comments/1jzgul/soy_can_be_harmful_for_your_health/,5,17,1375998491.0
Is fried food harmful even if consumed once in a while?,1cjfpm8,gluemamma,https://www.reddit.com/r/nutrition/comments/1cjfpm8/is_fried_food_harmful_even_if_consumed_once_in_a/,5,36,1714760707.0
Do bad Saturated fats get offset by good unsaturated fats.,17goe4n,WeirdCry7899,https://www.reddit.com/r/nutrition/comments/17goe4n/do_bad_saturated_fats_get_offset_by_good/,6,22,1698294645.0
What's the shortest list of ingredients needed to live a long and happy life?,15zl3xw,SumFriesWithThatSalt,https://www.reddit.com/r/nutrition/comments/15zl3xw/whats_the_shortest_list_of_ingredients_needed_to/,7,60,1692834553.0
How healthy is it to drink fat that came out of meat that was panfried?,ws6efo,faye2164,https://www.reddit.com/r/nutrition/comments/ws6efo/how_healthy_is_it_to_drink_fat_that_came_out_of/,0,19,1660889654.0
Why do people say Diet Soda is unhealthy,w9jrdi,Adventurous_Mail5120,https://www.reddit.com/r/nutrition/comments/w9jrdi/why_do_people_say_diet_soda_is_unhealthy/,0,97,1658940610.0
"I Can't Believe It's Not Butter should be forced to have the word ""margarine"" on its label.",5mk4jp,garbonzo607,https://www.reddit.com/r/nutrition/comments/5mk4jp/i_cant_believe_its_not_butter_should_be_forced_to/,49,40,1483789490.0
What’s the “no white foods” diet? ,1baoke1,None,https://www.reddit.com/r/nutrition/comments/1baoke1/whats_the_no_white_foods_diet/,37,139,1710009089.0
Losing 8 pounds in 15days.,1cpmt8z,hmoaa,https://www.reddit.com/r/nutrition/comments/1cpmt8z/losing_8_pounds_in_15days/,5,44,1715449114.0
Beef Protein (Gelatin) - Complimentary Amino Acids?,cd4bmw,Logiebear59,https://www.reddit.com/r/nutrition/comments/cd4bmw/beef_protein_gelatin_complimentary_amino_acids/,4,15,1563118473.0
I Reversed My Disease The Inexpensive Way,5etodr,wickster1,https://www.reddit.com/r/nutrition/comments/5etodr/i_reversed_my_disease_the_inexpensive_way/,7,5,1480082267.0
Sweetners that aren't terrible for you?,4n2lg0,GeoResearchRedditor,https://www.reddit.com/r/nutrition/comments/4n2lg0/sweetners_that_arent_terrible_for_you/,5,18,1465349856.0
Has anyone tried a diet based on what Vikings ate?,4b6yvj,watsonseansw,https://www.reddit.com/r/nutrition/comments/4b6yvj/has_anyone_tried_a_diet_based_on_what_vikings_ate/,6,8,1458466157.0
How to STOP feeling drained of energy at work,3ct02s,None,https://www.reddit.com/r/nutrition/comments/3ct02s/how_to_stop_feeling_drained_of_energy_at_work/,17,30,1436540930.0
"Contrary to common misconception, eating soy doesn't cause hormonal imbalance.",az6u9h,benjaminikuta,https://www.reddit.com/r/nutrition/comments/az6u9h/contrary_to_common_misconception_eating_soy/,190,98,1552158319.0
Why does carnivore help with autoimmune issues?,1cmpsix,0Tungence,https://www.reddit.com/r/nutrition/comments/1cmpsix/why_does_carnivore_help_with_autoimmune_issues/,0,63,1715123734.0
How much weight can you lose from a 500 deficit?,tukm4c,None,https://www.reddit.com/r/nutrition/comments/tukm4c/how_much_weight_can_you_lose_from_a_500_deficit/,11,23,1648911090.0
If you only workout on muscle does that equal less calories?,1dxs3f5,SolamenteBns,https://www.reddit.com/r/nutrition/comments/1dxs3f5/if_you_only_workout_on_muscle_does_that_equal/,4,10,1720389292.0
So what's the go with protein and longetivity,1cf6bf2,CableAutomatic8949,https://www.reddit.com/r/nutrition/comments/1cf6bf2/so_whats_the_go_with_protein_and_longetivity/,5,49,1714310608.0
Is saturated fat essential if the human body already creates it? What is the benefit?,1bux9mu,khoawala,https://www.reddit.com/r/nutrition/comments/1bux9mu/is_saturated_fat_essential_if_the_human_body/,3,47,1712162326.0
Do ramen noodles really have so few calories?,190bpt5,a_lot_of_babies,https://www.reddit.com/r/nutrition/comments/190bpt5/do_ramen_noodles_really_have_so_few_calories/,0,46,1704579121.0
Do you think eating once a day is a good way to lose fat?,111mfs2,Fun-Bodybuilder8246,https://www.reddit.com/r/nutrition/comments/111mfs2/do_you_think_eating_once_a_day_is_a_good_way_to/,3,36,1676328273.0
Inverse correlation between SFA and NCD,zvkxl7,Naghite,https://www.reddit.com/r/nutrition/comments/zvkxl7/inverse_correlation_between_sfa_and_ncd/,0,13,1672052543.0
