Title,ID,Author,URL,Score,Comment Count,Created
"Is eating 200,000 mg of protein a day too much? How much protein is too much protein?",1aoqyso,skycake23,https://www.reddit.com/r/nutrition/comments/1aoqyso/is_eating_200000_mg_of_protein_a_day_too_much_how/,36,166,1707710555.0
Why is meat necessary for a healthy diet?,18rogjs,RemarkableReason3172,https://www.reddit.com/r/nutrition/comments/18rogjs/why_is_meat_necessary_for_a_healthy_diet/,1,275,1703641422.0
Paleolithic high meat diets were probable not sustainable and decimated the population.,1ak5kld,Brain_FoodSeeker,https://www.reddit.com/r/nutrition/comments/1ak5kld/paleolithic_high_meat_diets_were_probable_not/,1,45,1707210265.0
How does someone that’s vegan get enough protein in a day? ,1bldp2v,princesscorgi2,https://www.reddit.com/r/nutrition/comments/1bldp2v/how_does_someone_thats_vegan_get_enough_protein/,0,173,1711150532.0
Why does this sub have so many ppl promoting not drinking milk,1cqfejo,NoDrama3756,https://www.reddit.com/r/nutrition/comments/1cqfejo/why_does_this_sub_have_so_many_ppl_promoting_not/,0,296,1715541021.0
Just Found Superfoods that Fight Depression (List),z47fna,nikhonit,https://www.reddit.com/r/nutrition/comments/z47fna/just_found_superfoods_that_fight_depression_list/,1,27,1669362247.0
Why Do People Still Think Red Meat Is Bad For You?,11fqox5,Kaizen_Healthy,https://www.reddit.com/r/nutrition/comments/11fqox5/why_do_people_still_think_red_meat_is_bad_for_you/,0,132,1677725429.0
Why do people fail to track calories?,1cifktk,FlexingOnThem777,https://www.reddit.com/r/nutrition/comments/1cifktk/why_do_people_fail_to_track_calories/,0,223,1714656236.0
How come Lettuce is Considered Such a Health Food when it has 0 nutritional value?,1727t75,None,https://www.reddit.com/r/nutrition/comments/1727t75/how_come_lettuce_is_considered_such_a_health_food/,0,60,1696689252.0
Where did the conspiracy theory that “seed oils are bad” start?,yk8skt,mikasakoa,https://www.reddit.com/r/nutrition/comments/yk8skt/where_did_the_conspiracy_theory_that_seed_oils/,0,107,1667404215.0
Is it true that eating something like white Jasmine rice is like eating cake?,1bcb3iy,LordRevanofDarkness,https://www.reddit.com/r/nutrition/comments/1bcb3iy/is_it_true_that_eating_something_like_white/,0,78,1710183578.0
What is the real problem of eating dog kibble?,1b9si70,AGKJAGFH,https://www.reddit.com/r/nutrition/comments/1b9si70/what_is_the_real_problem_of_eating_dog_kibble/,0,75,1709915911.0
Egg Whites: Any Health Downsides to Multiple Per Day to Supplement Protein?,1arhn9z,wildswalker,https://www.reddit.com/r/nutrition/comments/1arhn9z/egg_whites_any_health_downsides_to_multiple_per/,4,94,1708009996.0
Is there even a point to eating mushrooms?,1bjgyd2,RevolutionaryLion384,https://www.reddit.com/r/nutrition/comments/1bjgyd2/is_there_even_a_point_to_eating_mushrooms/,0,62,1710950420.0
How affective is a no carb diet ,1c5ug5k,lowbentz,https://www.reddit.com/r/nutrition/comments/1c5ug5k/how_affective_is_a_no_carb_diet/,0,84,1713309252.0
Is the carnivore diet here to stay? ,1bqvbgz,Rude_Economist9099,https://www.reddit.com/r/nutrition/comments/1bqvbgz/is_the_carnivore_diet_here_to_stay/,0,271,1711734178.0
Do you HAVE to eat protein to gain muscle?,1dmx4io,TBA1222,https://www.reddit.com/r/nutrition/comments/1dmx4io/do_you_have_to_eat_protein_to_gain_muscle/,0,157,1719179056.0
It's protein per Kilogram gram for anabolism not pound. Where did the pound trend come from?,194hy5o,NoDrama3756,https://www.reddit.com/r/nutrition/comments/194hy5o/its_protein_per_kilogram_gram_for_anabolism_not/,0,101,1705021034.0
Grilled cheese sandwiches arent that unhealthy,15sievv,SweatyArgument5835,https://www.reddit.com/r/nutrition/comments/15sievv/grilled_cheese_sandwiches_arent_that_unhealthy/,1,50,1692169746.0
Red meat consumption,16xckso,Most-Telephone-5580,https://www.reddit.com/r/nutrition/comments/16xckso/red_meat_consumption/,3,172,1696193697.0
Alternatives for Oreos? ,1br61a6,Happielemur,https://www.reddit.com/r/nutrition/comments/1br61a6/alternatives_for_oreos/,2,77,1711763468.0
Why is modern processed wheat considered healthy?,16smvtz,i_shoot_guns_321s,https://www.reddit.com/r/nutrition/comments/16smvtz/why_is_modern_processed_wheat_considered_healthy/,0,97,1695732187.0
"How is it possible that Eskimos do not have an excess of vitamin D, given that their diet is mainly composed of fish? A 100 gram wild salmon fillet contains approximately 1000 IU of vitamin D, and exceeding that value is not recommended for the general population",1c7a0r1,StefanoPetrini,https://www.reddit.com/r/nutrition/comments/1c7a0r1/how_is_it_possible_that_eskimos_do_not_have_an/,1,53,1713463401.0
Living on supplements and protein half the month,1c3ztn5,ChefEspen,https://www.reddit.com/r/nutrition/comments/1c3ztn5/living_on_supplements_and_protein_half_the_month/,1,73,1713117921.0
Why are so many expensive ‘posh’ foods actually junk?,18a5bvi,labellafigura3,https://www.reddit.com/r/nutrition/comments/18a5bvi/why_are_so_many_expensive_posh_foods_actually_junk/,30,74,1701642714.0
True of false : croissants are terrible for you,18tz7eu,None,https://www.reddit.com/r/nutrition/comments/18tz7eu/true_of_false_croissants_are_terrible_for_you/,0,103,1703888556.0
"If Mongolians have been primarily eating meat and milk for centuries, why aren't they taller? ",1c2fsyj,Jahoda22,https://www.reddit.com/r/nutrition/comments/1c2fsyj/if_mongolians_have_been_primarily_eating_meat_and/,0,42,1712944860.0
Why are vegetables associated with nutrients but meat isn’t?,198wjjb,mmmsplendid,https://www.reddit.com/r/nutrition/comments/198wjjb/why_are_vegetables_associated_with_nutrients_but/,75,299,1705498106.0
How is there a debate about whether or not humans were meant to eat meat,17t86sb,nico_bridge,https://www.reddit.com/r/nutrition/comments/17t86sb/how_is_there_a_debate_about_whether_or_not_humans/,99,499,1699748746.0
Is a calorie REALLY just a calorie?,18ouw2s,bsoliman2005,https://www.reddit.com/r/nutrition/comments/18ouw2s/is_a_calorie_really_just_a_calorie/,0,64,1703296602.0
Vienna Sausages are underestimated.,1c8haac,luisangel44,https://www.reddit.com/r/nutrition/comments/1c8haac/vienna_sausages_are_underestimated/,0,64,1713587673.0
Why isnt eating sugarfree ketchup viewed as healthy as eating tomatoes?,18e7bdf,Paulo-Dybala10,https://www.reddit.com/r/nutrition/comments/18e7bdf/why_isnt_eating_sugarfree_ketchup_viewed_as/,0,118,1702103115.0
Will Paleo be considered mostly plantbased eventually?,1cht83x,khoawala,https://www.reddit.com/r/nutrition/comments/1cht83x/will_paleo_be_considered_mostly_plantbased/,0,70,1714587698.0
"I want to discuss if raw milk is dangerous, unhealthy or healthy.",13wzmfc,angusstew,https://www.reddit.com/r/nutrition/comments/13wzmfc/i_want_to_discuss_if_raw_milk_is_dangerous/,0,118,1685570702.0
Interesting new healthy snack item...,939x0x,notad0ctor,https://www.reddit.com/r/nutrition/comments/939x0x/interesting_new_healthy_snack_item/,0,7,1532998935.0
Is the grilled sandwich from Chick-Fil-A somewhat healthy?,vx0df0,None,https://www.reddit.com/r/nutrition/comments/vx0df0/is_the_grilled_sandwich_from_chickfila_somewhat/,26,128,1657593749.0
An artistic view(.gif) on how junk food is made!,270puu,tefozon,https://www.reddit.com/r/nutrition/comments/270puu/an_artistic_viewgif_on_how_junk_food_is_made/,0,4,1401614169.0
But protein though...,1cg762y,AmerigoBriedis,https://www.reddit.com/r/nutrition/comments/1cg762y/but_protein_though/,0,97,1714416985.0
Is Canadian food regulated badly like the USA or like the EU,178o2j2,Bulky_Bison_4921,https://www.reddit.com/r/nutrition/comments/178o2j2/is_canadian_food_regulated_badly_like_the_usa_or/,0,21,1697401250.0
Apple Cider Vinegar,g2edp2,marziafucini,https://www.reddit.com/r/nutrition/comments/g2edp2/apple_cider_vinegar/,0,29,1587041757.0
Why is Red Meat Bad for Us?,pe31ta,sanman,https://www.reddit.com/r/nutrition/comments/pe31ta/why_is_red_meat_bad_for_us/,0,75,1630268940.0
Is it true that Asian cultures eat white and not brown rice due to the phytates and lectins present?,17rjxgt,Humble-Worker7044,https://www.reddit.com/r/nutrition/comments/17rjxgt/is_it_true_that_asian_cultures_eat_white_and_not/,3,75,1699555528.0
What do you eat when you're stoned?,1mbetc,kasserolepoop,https://www.reddit.com/r/nutrition/comments/1mbetc/what_do_you_eat_when_youre_stoned/,4,29,1379083066.0
If saturated fat is bad for the gut how do we explain success on a carnivore diet?,1bgosn0,None,https://www.reddit.com/r/nutrition/comments/1bgosn0/if_saturated_fat_is_bad_for_the_gut_how_do_we/,0,125,1710648717.0
Is tofu good or bad?,1ckrmif,Sirius1995,https://www.reddit.com/r/nutrition/comments/1ckrmif/is_tofu_good_or_bad/,1,50,1714916750.0
Keto vs Dash vs Mediterranean diets? What's the story?,1apvxpe,Drunk_Redneck,https://www.reddit.com/r/nutrition/comments/1apvxpe/keto_vs_dash_vs_mediterranean_diets_whats_the/,1,64,1707837661.0
Are Vegan diets safe? Could a majority of the population survive on a vegan diet?,1922cwp,Crazybunnygirl666,https://www.reddit.com/r/nutrition/comments/1922cwp/are_vegan_diets_safe_could_a_majority_of_the/,17,180,1704763982.0
"Is it better to eat liver once or twice a week for Vitamin A, instead of eating carrots?",17zdbu3,None,https://www.reddit.com/r/nutrition/comments/17zdbu3/is_it_better_to_eat_liver_once_or_twice_a_week/,0,72,1700445232.0
Thoughts on Carnivore Diet,1c3osfq,OcelotLogical5320,https://www.reddit.com/r/nutrition/comments/1c3osfq/thoughts_on_carnivore_diet/,9,193,1713083691.0
"Are Omnivorous diets more Nutritious than Vegan diets, and Why?",17no206,None,https://www.reddit.com/r/nutrition/comments/17no206/are_omnivorous_diets_more_nutritious_than_vegan/,6,112,1699111713.0
How bad is a midnight cookie?,1dgsibk,northerntouch,https://www.reddit.com/r/nutrition/comments/1dgsibk/how_bad_is_a_midnight_cookie/,0,46,1718488119.0
Why does society have no nutrition info for tall people?,1b1db9w,Bribr223,https://www.reddit.com/r/nutrition/comments/1b1db9w/why_does_society_have_no_nutrition_info_for_tall/,0,88,1709044521.0
How much salt do Americans ACTUALLY eat a day?,16o3ax1,SweatyArgument5835,https://www.reddit.com/r/nutrition/comments/16o3ax1/how_much_salt_do_americans_actually_eat_a_day/,17,123,1695261375.0
How healthy is a cheeseburger?,13jojne,SweatyArgument5835,https://www.reddit.com/r/nutrition/comments/13jojne/how_healthy_is_a_cheeseburger/,2,166,1684289921.0
"Did Steve Jobs die from his fruitarian diet, or did he survive his pancreatic cancer for 15 years because of his fruitarian diet?",13gbxea,ego157,https://www.reddit.com/r/nutrition/comments/13gbxea/did_steve_jobs_die_from_his_fruitarian_diet_or/,0,19,1683967302.0
Why do most people have a lot more energy from ditching their vegetarian food and eating steak again?,89sdej,PM_ME_UR_JETPACK,https://www.reddit.com/r/nutrition/comments/89sdej/why_do_most_people_have_a_lot_more_energy_from/,2,41,1522868102.0
Carnivore diet opinions?,qz4cns,Independent_Way8128,https://www.reddit.com/r/nutrition/comments/qz4cns/carnivore_diet_opinions/,5,204,1637528527.0
Rhonda Patrick may not be as reliable as we thought she was :(,i3o9se,None,https://www.reddit.com/r/nutrition/comments/i3o9se/rhonda_patrick_may_not_be_as_reliable_as_we/,6,80,1596564128.0
"Is it me, or do a lot of vegetarians/vegans look older and weaker?",51o68s,None,https://www.reddit.com/r/nutrition/comments/51o68s/is_it_me_or_do_a_lot_of_vegetariansvegans_look/,1,41,1473289614.0
Since when has poison been normalised?,1d6g73s,shivammmmmm,https://www.reddit.com/r/nutrition/comments/1d6g73s/since_when_has_poison_been_normalised/,0,36,1717343177.0
Is it really possible to get enough protein with a vegetarian diet?,1blnkab,Various-Program-950,https://www.reddit.com/r/nutrition/comments/1blnkab/is_it_really_possible_to_get_enough_protein_with/,0,56,1711183568.0
Interesting considerations about Fiber being healthy or not,12aqrx3,Ucross,https://www.reddit.com/r/nutrition/comments/12aqrx3/interesting_considerations_about_fiber_being/,1,66,1680541761.0
Healthier: whole wheat wrap or gluten free wrap?,10g529i,miamigirl101,https://www.reddit.com/r/nutrition/comments/10g529i/healthier_whole_wheat_wrap_or_gluten_free_wrap/,0,22,1674143460.0
Is the sausage mcmuffin healthy?,wc8xgg,Superior_20,https://www.reddit.com/r/nutrition/comments/wc8xgg/is_the_sausage_mcmuffin_healthy/,21,100,1659219380.0
"Why does Dr. Michael Greger so often ignore the issues of protein quality and bioavailability, and the need for more g/kg/day when the protein is from plant-based sources?",1afh5kv,Effective-Baker-8353,https://www.reddit.com/r/nutrition/comments/1afh5kv/why_does_dr_michael_greger_so_often_ignore_the/,0,88,1706705537.0
Why Eating Healthy is Actually Really Cheap,2t7e7k,honeydothis,https://www.reddit.com/r/nutrition/comments/2t7e7k/why_eating_healthy_is_actually_really_cheap/,9,24,1421870296.0
"Q: Which would kill you first? A diet of only bacon, or a diet of only cheese?",2ix01x,dangersquirrel,https://www.reddit.com/r/nutrition/comments/2ix01x/q_which_would_kill_you_first_a_diet_of_only_bacon/,1,11,1412996541.0
Are animal products harmful in small amounts?,1bv7tby,Brain_FoodSeeker,https://www.reddit.com/r/nutrition/comments/1bv7tby/are_animal_products_harmful_in_small_amounts/,1,70,1712186766.0
Is drinking raw milk good or not?,1959gaq,strawberry-11,https://www.reddit.com/r/nutrition/comments/1959gaq/is_drinking_raw_milk_good_or_not/,0,69,1705102770.0
Is it true to drink 8 cups of water?,1cvbbb9,Radiant-Ad7100,https://www.reddit.com/r/nutrition/comments/1cvbbb9/is_it_true_to_drink_8_cups_of_water/,2,70,1716077863.0
Is it possible to live a healthy life without vegetables,1dq1ypy,aaconitum,https://www.reddit.com/r/nutrition/comments/1dq1ypy/is_it_possible_to_live_a_healthy_life_without/,21,274,1719521864.0
"What’s healthiest: half spring chicken, broiled salmon, New York sirloin, or prime rib?  Going to a restaurant and torn between these 4 - which is going to be the lowest in calories and lightest?",1czzv1y,bluebutterfly1446,https://www.reddit.com/r/nutrition/comments/1czzv1y/whats_healthiest_half_spring_chicken_broiled/,0,27,1716597506.0
I've always wondered about stevia,1885q4n,coolnavigator,https://www.reddit.com/r/nutrition/comments/1885q4n/ive_always_wondered_about_stevia/,0,41,1701414411.0
Anyone try Metavo for metabolism boost?,14io6fv,loop511,https://www.reddit.com/r/nutrition/comments/14io6fv/anyone_try_metavo_for_metabolism_boost/,0,14,1687704660.0
Is there any point to eating leafy greens except for vitamin K?,126z2ib,andreasdagen,https://www.reddit.com/r/nutrition/comments/126z2ib/is_there_any_point_to_eating_leafy_greens_except/,1,47,1680209892.0
How can you eat less than a pound of fat and put on a pound of body weight?,11x5a5b,SakarPhone,https://www.reddit.com/r/nutrition/comments/11x5a5b/how_can_you_eat_less_than_a_pound_of_fat_and_put/,0,13,1679368618.0
Controversial thoughts,upj4wk,None,https://www.reddit.com/r/nutrition/comments/upj4wk/controversial_thoughts/,0,14,1652540733.0
"What's the healthiest cuisine (Chinese, Russian, American, Indian, etc)?",s15sdq,TheRoyalDon,https://www.reddit.com/r/nutrition/comments/s15sdq/whats_the_healthiest_cuisine_chinese_russian/,0,18,1641880680.0
"No brosience please, there are some studies which puts soy reducing testo is that a myth or not?",15wkxfc,WingedKnuckles,https://www.reddit.com/r/nutrition/comments/15wkxfc/no_brosience_please_there_are_some_studies_which/,0,24,1692560839.0
REALLY INTERESTING WHAT ARE YOUR THOUGHTS ON THIS,11upbpt,Shanks_akigame,https://www.reddit.com/r/nutrition/comments/11upbpt/really_interesting_what_are_your_thoughts_on_this/,0,46,1679148149.0
How healthy/safe is it to eat jellied/dried pigs blood?,zw3ny7,andrew2018022,https://www.reddit.com/r/nutrition/comments/zw3ny7/how_healthysafe_is_it_to_eat_jellieddried_pigs/,4,48,1672106696.0
Why almost every whey protien powders have so much cholesterol (60-80mg/36g) and sodium (180-250mg/36g) when it is so dangerous for the health?,162rh5c,procrastinator_eng,https://www.reddit.com/r/nutrition/comments/162rh5c/why_almost_every_whey_protien_powders_have_so/,2,46,1693145570.0
Pork consumption,12crhcg,None,https://www.reddit.com/r/nutrition/comments/12crhcg/pork_consumption/,4,105,1680715366.0
Hamburger good or bad,17gnyu4,hawkmanredeye,https://www.reddit.com/r/nutrition/comments/17gnyu4/hamburger_good_or_bad/,6,121,1698293109.0
why don’t gyms provide the nutritious meals to their members according to their fitness goal?,1b704cx,undauntedcurious,https://www.reddit.com/r/nutrition/comments/1b704cx/why_dont_gyms_provide_the_nutritious_meals_to/,0,48,1709626167.0
Wouldn't cookies be one of the most unhealthy foods out there?,18ieg9a,PandaKindly234,https://www.reddit.com/r/nutrition/comments/18ieg9a/wouldnt_cookies_be_one_of_the_most_unhealthy/,0,42,1702576685.0
What nutrients are high in Pork and Beef? How often should one consume them?,1971xfs,reddit-snorter,https://www.reddit.com/r/nutrition/comments/1971xfs/what_nutrients_are_high_in_pork_and_beef_how/,0,56,1705299651.0
CMV: Worrying about the details of your nutrition is completely pointless.,5ret20,None,https://www.reddit.com/r/nutrition/comments/5ret20/cmv_worrying_about_the_details_of_your_nutrition/,0,12,1485945810.0
"If there were a way to plan your diet to promote energy, would you do it?",373gun,mikegross1990,https://www.reddit.com/r/nutrition/comments/373gun/if_there_were_a_way_to_plan_your_diet_to_promote/,0,13,1432479551.0
All About Calories  |  What are they & how many do I really need?!,p8nhc,joeinstereo,https://www.reddit.com/r/nutrition/comments/p8nhc/all_about_calories_what_are_they_how_many_do_i/,0,20,1328235348.0
Why are McDonald’s cheeseburgers bad for you,152kixl,SuitStain,https://www.reddit.com/r/nutrition/comments/152kixl/why_are_mcdonalds_cheeseburgers_bad_for_you/,6,159,1689644138.0
"Is Gluten, casein, corn and soy really bad for everyone?",1ay3zqz,Poyntersb,https://www.reddit.com/r/nutrition/comments/1ay3zqz/is_gluten_casein_corn_and_soy_really_bad_for/,0,35,1708703926.0
"Omega 6 fatty acids are not inflammatory, but saturated fats are",99ocd0,Only8livesleft,https://www.reddit.com/r/nutrition/comments/99ocd0/omega_6_fatty_acids_are_not_inflammatory_but/,4,71,1535038109.0
Afraid to eat chia seeds.,12gjb9u,antonis013,https://www.reddit.com/r/nutrition/comments/12gjb9u/afraid_to_eat_chia_seeds/,0,31,1681046527.0
"Why We Get Fat, with National Bestselling author, Gary Taubes",bdfzrv,BradCTucker,https://www.reddit.com/r/nutrition/comments/bdfzrv/why_we_get_fat_with_national_bestselling_author/,1,27,1555335009.0
Help with becoming Vegan,3kz3zg,mattdonnelly,https://www.reddit.com/r/nutrition/comments/3kz3zg/help_with_becoming_vegan/,0,25,1442273372.0
Butter is not healthier than margarine or vegetable oil,1tb49v,genoflash,https://www.reddit.com/r/nutrition/comments/1tb49v/butter_is_not_healthier_than_margarine_or/,0,31,1387520046.0
Veganism and it's effect on brain? ,1cpmj3y,r099ie,https://www.reddit.com/r/nutrition/comments/1cpmj3y/veganism_and_its_effect_on_brain/,0,50,1715448312.0
How nutritious is blood?,19byvmw,BananaBeach007,https://www.reddit.com/r/nutrition/comments/19byvmw/how_nutritious_is_blood/,2,25,1705825910.0
How do you make meats more easy to eat?,18n0xky,shardmare1,https://www.reddit.com/r/nutrition/comments/18n0xky/how_do_you_make_meats_more_easy_to_eat/,3,54,1703095463.0
vegan salami from a nutritional perspective?,11itftp,chatxx,https://www.reddit.com/r/nutrition/comments/11itftp/vegan_salami_from_a_nutritional_perspective/,4,27,1678010547.0
Why is American Table Salt Iodized but European Salt is Not?,1bmiibg,GiraffeWeevil,https://www.reddit.com/r/nutrition/comments/1bmiibg/why_is_american_table_salt_iodized_but_european/,6,62,1711279473.0
Study says: Dairy kills - low and no-fat dairy to be precise! - Suppversity Facebook post,1oaol3,StuWard,https://www.reddit.com/r/nutrition/comments/1oaol3/study_says_dairy_kills_low_and_nofat_dairy_to_be/,4,8,1381594986.0
Chips or pastries what is worse?,1b8j1go,pimdre,https://www.reddit.com/r/nutrition/comments/1b8j1go/chips_or_pastries_what_is_worse/,4,102,1709778959.0
eating toast without toasting?,1b5ulo4,AMBR05IA,https://www.reddit.com/r/nutrition/comments/1b5ulo4/eating_toast_without_toasting/,42,74,1709506084.0
Is magnesium the best vitamin to take? ,1dbu3zm,AlmalexiasBF,https://www.reddit.com/r/nutrition/comments/1dbu3zm/is_magnesium_the_best_vitamin_to_take/,1,57,1717940799.0
"Which is healthier of the two , refined palm oil vs butter",16pxjke,Imaginary_Squash_198,https://www.reddit.com/r/nutrition/comments/16pxjke/which_is_healthier_of_the_two_refined_palm_oil_vs/,0,16,1695452369.0
What are healthy beverage options for people that need a taste and struggle with pure water?  ,1b2x5dx,felix_using_reddit,https://www.reddit.com/r/nutrition/comments/1b2x5dx/what_are_healthy_beverage_options_for_people_that/,0,95,1709202239.0
What's your take on extreme diets like vegan or carnivore. ,1bcbax4,DrPsychi,https://www.reddit.com/r/nutrition/comments/1bcbax4/whats_your_take_on_extreme_diets_like_vegan_or/,0,230,1710184049.0
Why the obsession with “industry funding” of science relating to food and health?,sgkmia,Beginning-Sport9217,https://www.reddit.com/r/nutrition/comments/sgkmia/why_the_obsession_with_industry_funding_of/,4,35,1643581165.0
Half of a small Digiorno's frozen pizza is 380 calories yet the whole pizza is 750 calories. Where do the extra 10 calories go?,285u51,itsjimbolol,https://www.reddit.com/r/nutrition/comments/285u51/half_of_a_small_digiornos_frozen_pizza_is_380/,0,8,1402785304.0
Chemicals in our food,1dwtz2f,RevelationWorks,https://www.reddit.com/r/nutrition/comments/1dwtz2f/chemicals_in_our_food/,1,26,1720284582.0
Whats the deal with sugar?,1bp114j,Confident-Till8952,https://www.reddit.com/r/nutrition/comments/1bp114j/whats_the_deal_with_sugar/,0,67,1711543692.0
Seeking diet options to enhance libido beyond restrictive Keto diet.,182rqpo,general_Purple134,https://www.reddit.com/r/nutrition/comments/182rqpo/seeking_diet_options_to_enhance_libido_beyond/,1,55,1700831325.0
Salt will hydrate me?,16m7url,Omegleh,https://www.reddit.com/r/nutrition/comments/16m7url/salt_will_hydrate_me/,1,50,1695072336.0
What Grocery Store Chicken Is ACTUALLY Good?,16ldmvq,Several-Attitude-950,https://www.reddit.com/r/nutrition/comments/16ldmvq/what_grocery_store_chicken_is_actually_good/,0,21,1694988257.0
So what the hell is a vegetarian supposed to eat for protein?,ax2ssc,berkadurk,https://www.reddit.com/r/nutrition/comments/ax2ssc/so_what_the_hell_is_a_vegetarian_supposed_to_eat/,0,22,1551672891.0
9 Nutrition & Health Experts You HAVE to Follow in 2014,2bkb5w,straightaway1,https://www.reddit.com/r/nutrition/comments/2bkb5w/9_nutrition_health_experts_you_have_to_follow_in/,0,11,1406173760.0
Contrive opinion; I don’t think hamburgers are “bad for you”,r69mv2,piebalddacshund,https://www.reddit.com/r/nutrition/comments/r69mv2/contrive_opinion_i_dont_think_hamburgers_are_bad/,6,61,1638345488.0
Detoxing/Cleans after big cheat meal,4h4gy6,kelseyhuds,https://www.reddit.com/r/nutrition/comments/4h4gy6/detoxingcleans_after_big_cheat_meal/,2,18,1462023484.0
Daily red meat Is bad ?,1day04o,MrHonzanoss,https://www.reddit.com/r/nutrition/comments/1day04o/daily_red_meat_is_bad/,4,167,1717834419.0
"Hi - Is there a supplement or food, which will only kick in and give energy 8 hours later? ",1bsgnl7,Logical_Sea2630,https://www.reddit.com/r/nutrition/comments/1bsgnl7/hi_is_there_a_supplement_or_food_which_will_only/,0,41,1711908305.0
Wine: Good or Bad?,17i3o3b,nico_bridge,https://www.reddit.com/r/nutrition/comments/17i3o3b/wine_good_or_bad/,3,50,1698459028.0
What do yall think about frugivore/fruitarian diets?,13fybbi,NbuuDaDon11,https://www.reddit.com/r/nutrition/comments/13fybbi/what_do_yall_think_about_frugivorefruitarian_diets/,3,81,1683928464.0
Is breastfeeding my husband healthy?,2c1u8r,Nurturing_wife,https://www.reddit.com/r/nutrition/comments/2c1u8r/is_breastfeeding_my_husband_healthy/,11,56,1406648488.0
"An MIT researcher has linked the use of Roundup (glyphosate) to Autism, Alzheimers, over-eating (loss of appetite control)...and the list goes on.",24vcnp,thedenver5700,https://www.reddit.com/r/nutrition/comments/24vcnp/an_mit_researcher_has_linked_the_use_of_roundup/,36,93,1399390640.0
If canola oil is healthy why is fried food unhealthy?,1dqp033,GarbageWorried1474,https://www.reddit.com/r/nutrition/comments/1dqp033/if_canola_oil_is_healthy_why_is_fried_food/,0,75,1719595125.0
Benefits of Eating Starch in the Evening,181kkh7,VMH-SCR-Coach,https://www.reddit.com/r/nutrition/comments/181kkh7/benefits_of_eating_starch_in_the_evening/,1,19,1700689309.0
Does this nuts and fruits diet come with a risk of nutritional deficiencies?,10c3i2v,srikat,https://www.reddit.com/r/nutrition/comments/10c3i2v/does_this_nuts_and_fruits_diet_come_with_a_risk/,0,26,1673737463.0
"Wrote to General Mills about my concern for glyphosate about 3 weeks ago. To-date, I have not received a response",xwp5ox,Fuller_McCallister,https://www.reddit.com/r/nutrition/comments/xwp5ox/wrote_to_general_mills_about_my_concern_for/,0,13,1665010809.0
"Does Butterfly Pea Flower Tea Really ""Kill"" Cancer Cells?",scm4of,Roaring_Tiddy,https://www.reddit.com/r/nutrition/comments/scm4of/does_butterfly_pea_flower_tea_really_kill_cancer/,1,8,1643139965.0
We can only process 20g of protein at a time,f4rgmu,DanielSmith8446,https://www.reddit.com/r/nutrition/comments/f4rgmu/we_can_only_process_20g_of_protein_at_a_time/,0,26,1581863971.0
Is this safe?,7l14t7,00OK,https://www.reddit.com/r/nutrition/comments/7l14t7/is_this_safe/,0,11,1513773505.0
Chia emergency?,7ahsdf,rci22,https://www.reddit.com/r/nutrition/comments/7ahsdf/chia_emergency/,0,5,1509692493.0
