Title,ID,Author,URL,Score,Comment Count,Created
Do all types of fiber react similarly in the gut?,kp55h7,gorillaz0e,https://www.reddit.com/r/nutrition/comments/kp55h7/do_all_types_of_fiber_react_similarly_in_the_gut/,191,36,1609619673.0
How many servings of fruit and veggies are recommended per day for active individuals? (Everywhere this number varies from 2-5 servings) Is more = bad?,j9acra,-zanran-,https://www.reddit.com/r/nutrition/comments/j9acra/how_many_servings_of_fruit_and_veggies_are/,191,108,1602440055.0
Are egg yolks actually bad for you?,gfxlwl,None,https://www.reddit.com/r/nutrition/comments/gfxlwl/are_egg_yolks_actually_bad_for_you/,194,346,1588959409.0
Could you recommend me a book suited for people wanting to learn about nutrition?,e3zjrf,FutureMeIsBetter,https://www.reddit.com/r/nutrition/comments/e3zjrf/could_you_recommend_me_a_book_suited_for_people/,190,64,1575133370.0
Step-by-step guide to quitting sugar for good?,b6vi9y,Vespura,https://www.reddit.com/r/nutrition/comments/b6vi9y/stepbystep_guide_to_quitting_sugar_for_good/,193,125,1553854798.0
"When you eat chunks of fat (attached to meat, bacon, butter, etc.), does your body just redirect that fat to other spots in your body to store as fat, or is it metabolized to produce calories and then treated like calories from any other macronutrient?",zqcxkn,OffSeason2091,https://www.reddit.com/r/nutrition/comments/zqcxkn/when_you_eat_chunks_of_fat_attached_to_meat_bacon/,194,130,1671506747.0
Does drinking plain water with meal really spike your blood glucose level?,uv52zv,goodlikeH2O,https://www.reddit.com/r/nutrition/comments/uv52zv/does_drinking_plain_water_with_meal_really_spike/,194,122,1653200559.0
Why is Canola Oil harmful to consume?,q1tp2n,purblugre,https://www.reddit.com/r/nutrition/comments/q1tp2n/why_is_canola_oil_harmful_to_consume/,192,303,1633430105.0
How long do you have before energy is stored as fat? When is this done? Overnight? Constantly?,ibavw3,Bro_miscuous,https://www.reddit.com/r/nutrition/comments/ibavw3/how_long_do_you_have_before_energy_is_stored_as/,192,78,1597656300.0
What sport's athlete has the highest and the lowest calorie intake requirement if their body stats (weight/height/etc) are similar?,gygeu1,mayermail1977,https://www.reddit.com/r/nutrition/comments/gygeu1/what_sports_athlete_has_the_highest_and_the/,192,70,1591550679.0
Is plant based milk a better option than cows milk?,e03a2g,nefifty,https://www.reddit.com/r/nutrition/comments/e03a2g/is_plant_based_milk_a_better_option_than_cows_milk/,191,185,1574439981.0
Are ramen noodles really that bad?,10ab0wo,walgreens567,https://www.reddit.com/r/nutrition/comments/10ab0wo/are_ramen_noodles_really_that_bad/,191,151,1673558315.0
Is there any real evidence that fats or carbohydrates are more likely to be stored as fat tissue on a diet with the same amount of calories?,o88d03,saminator1002,https://www.reddit.com/r/nutrition/comments/o88d03/is_there_any_real_evidence_that_fats_or/,190,84,1624703814.0
OMAD = one meal a day,mtxw2r,Dina_jr95,https://www.reddit.com/r/nutrition/comments/mtxw2r/omad_one_meal_a_day/,189,154,1618828961.0
Matthew McConaughey Wine Diet?,k9g4zm,JewishJawnz,https://www.reddit.com/r/nutrition/comments/k9g4zm/matthew_mcconaughey_wine_diet/,187,110,1607471339.0
What is the best nutritional thing you can add to your dinner without changing the taste?,auod42,lllIIIIIIIlIIIIIlll,https://www.reddit.com/r/nutrition/comments/auod42/what_is_the_best_nutritional_thing_you_can_add_to/,190,131,1551118761.0
My tomato soup has 16 grams of sugar in it. Sixteen freaking grams!! WTF?,a77amv,Bluest_waters,https://www.reddit.com/r/nutrition/comments/a77amv/my_tomato_soup_has_16_grams_of_sugar_in_it/,189,214,1545104193.0
Why is every post full of carnivore advocates?,1bx73f6,None,https://www.reddit.com/r/nutrition/comments/1bx73f6/why_is_every_post_full_of_carnivore_advocates/,189,586,1712394200.0
how come I feel and look much better when I eat more?,18m9c3y,Substantial-Yam-2826,https://www.reddit.com/r/nutrition/comments/18m9c3y/how_come_i_feel_and_look_much_better_when_i_eat/,187,69,1703011948.0
What happens if a vegetarian from birth eats something non vegetarian?,rtixik,THENERDYPI,https://www.reddit.com/r/nutrition/comments/rtixik/what_happens_if_a_vegetarian_from_birth_eats/,186,169,1641041835.0
New meta-analysis revealing dose-response relationship of protein intake with lean mass in healthy adults,mmnami,TheRealSMTV,https://www.reddit.com/r/nutrition/comments/mmnami/new_metaanalysis_revealing_doseresponse/,190,58,1617870592.0
How bad is basic peanut butter like JIF or Peter Pan? I bought some all natural peanut butter and it’s super annoying having to stir it before every sandwich,dzlhmq,None,https://www.reddit.com/r/nutrition/comments/dzlhmq/how_bad_is_basic_peanut_butter_like_jif_or_peter/,190,219,1574352585.0
Keto? Vegan? Mediterranean - why are there so many contradicting diets each with evidence as to why they work,dxnz1y,None,https://www.reddit.com/r/nutrition/comments/dxnz1y/keto_vegan_mediterranean_why_are_there_so_many/,188,227,1574005168.0
"My issue with the ""omnivore"" vs ""vegan"" debate",c7qlpo,vrswell,https://www.reddit.com/r/nutrition/comments/c7qlpo/my_issue_with_the_omnivore_vs_vegan_debate/,192,207,1561974353.0
Question about chia seeds- are the nutrients inside actually digested and absorbed?,8tzqwe,GreenStrong,https://www.reddit.com/r/nutrition/comments/8tzqwe/question_about_chia_seeds_are_the_nutrients/,190,42,1530017454.0
Bill Nye's episode on diets was very disapointing,67ozar,djdadi,https://www.reddit.com/r/nutrition/comments/67ozar/bill_nyes_episode_on_diets_was_very_disapointing/,189,140,1493221649.0
A blog/website where they post about health and nutrition with scientifically-backed links?,kxacyw,cami142,https://www.reddit.com/r/nutrition/comments/kxacyw/a_blogwebsite_where_they_post_about_health_and/,187,71,1610645637.0
Why digestion is hard for the body?,in250l,fsociety1111,https://www.reddit.com/r/nutrition/comments/in250l/why_digestion_is_hard_for_the_body/,187,39,1599316587.0
A randomized crossover trial on the effect of plant-based compared with animal-based meat on trimethylamine-N-oxide and cardiovascular disease risk factors in generally healthy adults: Study With Appetizing Plantfood—Meat Eating Alternative Trial (SWAP-MEAT),i8ifwo,Only8livesleft,https://www.reddit.com/r/nutrition/comments/i8ifwo/a_randomized_crossover_trial_on_the_effect_of/,188,97,1597254573.0
"Are people’s metabolisms really that fast, or is there something else going on?",ccr3ku,imaginearagog,https://www.reddit.com/r/nutrition/comments/ccr3ku/are_peoples_metabolisms_really_that_fast_or_is/,187,117,1563034585.0
“Too much fat is bad for you”,a1vudb,grschigvft,https://www.reddit.com/r/nutrition/comments/a1vudb/too_much_fat_is_bad_for_you/,190,107,1543607797.0
"Is oatmeal the ultimate healthy breakfast, or are there alternatives?",1aetaao,fancyzoidberg,https://www.reddit.com/r/nutrition/comments/1aetaao/is_oatmeal_the_ultimate_healthy_breakfast_or_are/,184,457,1706634118.0
3 day water fast - Can it be healthy?,17wmcrn,RuisseauXVII,https://www.reddit.com/r/nutrition/comments/17wmcrn/3_day_water_fast_can_it_be_healthy/,189,422,1700139789.0
Why don’t we build muscle from carbohydrates?,zwyskz,philokitty,https://www.reddit.com/r/nutrition/comments/zwyskz/why_dont_we_build_muscle_from_carbohydrates/,188,101,1672197433.0
"How is it possible that we need about 3,500-4,500 mg potassium per day?",ywarqk,Psychological-Touch1,https://www.reddit.com/r/nutrition/comments/ywarqk/how_is_it_possible_that_we_need_about_35004500_mg/,190,151,1668549242.0
Should we not enjoy the food we eat?,rp629a,Shootreadyaim,https://www.reddit.com/r/nutrition/comments/rp629a/should_we_not_enjoy_the_food_we_eat/,188,87,1640553707.0
/r/Nutrition sub update - addressing anti-science misinformation,pcrwjw,soundeziner,https://www.reddit.com/r/nutrition/comments/pcrwjw/rnutrition_sub_update_addressing_antiscience/,186,48,1630085218.0
Has anyone experienced a sudden boost in brain function after taking an omega 3 capsule?,gs1kil,vegetable_companion,https://www.reddit.com/r/nutrition/comments/gs1kil/has_anyone_experienced_a_sudden_boost_in_brain/,187,147,1590650558.0
What are the best foods for great skin?,dfxnjd,kcapr,https://www.reddit.com/r/nutrition/comments/dfxnjd/what_are_the_best_foods_for_great_skin/,185,197,1570712351.0
What are some food brands that claim to be healthy but are actually really bad for you?,16i08z5,Rainy_skys,https://www.reddit.com/r/nutrition/comments/16i08z5/what_are_some_food_brands_that_claim_to_be/,186,337,1694642409.0
Have nutrition labels in the US been silently updated to be more accurate?,10g6a2u,piexil,https://www.reddit.com/r/nutrition/comments/10g6a2u/have_nutrition_labels_in_the_us_been_silently/,187,43,1674146275.0
Inexpensive vegetarian food for protein without dairy?,zbmsdu,Learnmoretalkless,https://www.reddit.com/r/nutrition/comments/zbmsdu/inexpensive_vegetarian_food_for_protein_without/,188,148,1670091779.0
Why has the average body temperature in the US decreased over time?,undpys,thesiegetooktoulon,https://www.reddit.com/r/nutrition/comments/undpys/why_has_the_average_body_temperature_in_the_us/,186,75,1652286306.0
What are foods that promote gut health?,t7p391,Pearl-33,https://www.reddit.com/r/nutrition/comments/t7p391/what_are_foods_that_promote_gut_health/,189,138,1646534258.0
How do you eat healthy with picky kids?,rsv898,c3clark1,https://www.reddit.com/r/nutrition/comments/rsv898/how_do_you_eat_healthy_with_picky_kids/,187,119,1640961435.0
Can consuming too much sugar cause fat gain in a calorie deficit? Thanks.,qwxq8x,ryan3972,https://www.reddit.com/r/nutrition/comments/qwxq8x/can_consuming_too_much_sugar_cause_fat_gain_in_a/,187,175,1637264329.0
List of foods that contain highest nutritional value?,pjbkhx,Adventurer0599,https://www.reddit.com/r/nutrition/comments/pjbkhx/list_of_foods_that_contain_highest_nutritional/,186,44,1630972549.0
Who can share strategies about how you optimize the positive impact of your diet on your microbiome (and thus your health)?,dhq295,supersystemic-ly,https://www.reddit.com/r/nutrition/comments/dhq295/who_can_share_strategies_about_how_you_optimize/,184,73,1571057148.0
"If you were to only eat up to 3 very cheap ingredients for a period up to 6 months, what would they be?",znmmc7,myceliumfriend,https://www.reddit.com/r/nutrition/comments/znmmc7/if_you_were_to_only_eat_up_to_3_very_cheap/,184,369,1671218296.0
Is the Stew the healthiest meal?,ok65ew,behonestbeu,https://www.reddit.com/r/nutrition/comments/ok65ew/is_the_stew_the_healthiest_meal/,185,85,1626274941.0
Why are fats in a diet important? What does the body use fat for?,ljf4dd,Mr-Batmann,https://www.reddit.com/r/nutrition/comments/ljf4dd/why_are_fats_in_a_diet_important_what_does_the/,185,157,1613269104.0
What could one do to make their oatmeal the most nutritious possible?,jxz72j,rutgersmanitjink,https://www.reddit.com/r/nutrition/comments/jxz72j/what_could_one_do_to_make_their_oatmeal_the_most/,185,228,1605912007.0
"What really are artificial sweeteners? Just don't understand how they are ""sugars"" but ""not sugars""",crdq1u,Captain_of_Skene,https://www.reddit.com/r/nutrition/comments/crdq1u/what_really_are_artificial_sweeteners_just_dont/,186,60,1565995333.0
Crispy oven baked potatoes better than fried,b9a4kz,None,https://www.reddit.com/r/nutrition/comments/b9a4kz/crispy_oven_baked_potatoes_better_than_fried/,188,40,1554366430.0
TIL that one serving of Oreo's is three measly cookies. Cruel.,7xhmuj,danijay1,https://www.reddit.com/r/nutrition/comments/7xhmuj/til_that_one_serving_of_oreos_is_three_measly/,184,52,1518611126.0
People who have found ways to eat healthy without focusing on calories: What did you do to shift your thinking?,1dbpve0,sandoloo,https://www.reddit.com/r/nutrition/comments/1dbpve0/people_who_have_found_ways_to_eat_healthy_without/,183,253,1717925426.0
What healthy food has really good fat?,12zabiu,Silveraindays,https://www.reddit.com/r/nutrition/comments/12zabiu/what_healthy_food_has_really_good_fat/,187,259,1682495523.0
Do you lose muscle when you eat enough protein but don’t work out?,u1zcs9,22chainz,https://www.reddit.com/r/nutrition/comments/u1zcs9/do_you_lose_muscle_when_you_eat_enough_protein/,185,79,1649770761.0
What is the most optimal meal?,mox67v,Dragonfire45,https://www.reddit.com/r/nutrition/comments/mox67v/what_is_the_most_optimal_meal/,182,261,1618168346.0
"Question about relationship between calories, hunger, and stomach fulness",iv5j6w,Dangitbill23,https://www.reddit.com/r/nutrition/comments/iv5j6w/question_about_relationship_between_calories/,183,59,1600433674.0
Why is nutrition not yet an exact science?,dnsvvc,bradcroteau,https://www.reddit.com/r/nutrition/comments/dnsvvc/why_is_nutrition_not_yet_an_exact_science/,184,76,1572181181.0
What were some of the first changes you made when you decided to live a healthier lifestyle?,aqm9il,EnsignFrilly,https://www.reddit.com/r/nutrition/comments/aqm9il/what_were_some_of_the_first_changes_you_made_when/,185,216,1550165709.0
Good YouTube resources to learn about nutrition,z8m0yo,nuvoldenovembre,https://www.reddit.com/r/nutrition/comments/z8m0yo/good_youtube_resources_to_learn_about_nutrition/,180,121,1669796787.0
Healthy Eating in the Real World,rhtus9,telemachus10,https://www.reddit.com/r/nutrition/comments/rhtus9/healthy_eating_in_the_real_world/,183,100,1639670850.0
Does frozen vegetables have the same amount of nutrients as fresh vegetables?,r2hvum,lushpink_,https://www.reddit.com/r/nutrition/comments/r2hvum/does_frozen_vegetables_have_the_same_amount_of/,183,83,1637912435.0
"if a steak (100g) has 25g of protein and 19g of fat, what is the other 56g ???",nr2532,AkiraAkiraFudo,https://www.reddit.com/r/nutrition/comments/nr2532/if_a_steak_100g_has_25g_of_protein_and_19g_of_fat/,183,67,1622685310.0
Eating to be full,nj2azz,None,https://www.reddit.com/r/nutrition/comments/nj2azz/eating_to_be_full/,182,88,1621753711.0
Does eating a variety of foods help with creating a healthier gut microbiome?,g1b4ky,eva1588,https://www.reddit.com/r/nutrition/comments/g1b4ky/does_eating_a_variety_of_foods_help_with_creating/,183,60,1586889433.0
"Is there a food you continue to eat deemed ""healthy"" despite you not feeling well when you eat it?",e54jgp,ghabexxa,https://www.reddit.com/r/nutrition/comments/e54jgp/is_there_a_food_you_continue_to_eat_deemed/,185,272,1575316889.0
Are carbonated drinks unhealthy or is it a myth? (Specifically Coke Zero since it’s 0 calorie 0 sugar),194ez52,CityRuinsRoL,https://www.reddit.com/r/nutrition/comments/194ez52/are_carbonated_drinks_unhealthy_or_is_it_a_myth/,181,368,1705013315.0
Is diet soda really bad for us?,1802zvm,Ok_Fruit_Consumer,https://www.reddit.com/r/nutrition/comments/1802zvm/is_diet_soda_really_bad_for_us/,182,300,1700524275.0
is it true that some oils are really unhealthy?,zfj65e,howevertheory98968,https://www.reddit.com/r/nutrition/comments/zfj65e/is_it_true_that_some_oils_are_really_unhealthy/,185,300,1670458926.0
At what point does a snack become a meal?,qlr2gh,ErrorOk1384,https://www.reddit.com/r/nutrition/comments/qlr2gh/at_what_point_does_a_snack_become_a_meal/,180,76,1635933020.0
"If charring can be avoided, is lightly roasting veggies a healthy way to cook them?",odcdm6,gettinhaahd,https://www.reddit.com/r/nutrition/comments/odcdm6/if_charring_can_be_avoided_is_lightly_roasting/,182,81,1625369430.0
Daily requirements seem very unrealistic,jh858n,None,https://www.reddit.com/r/nutrition/comments/jh858n/daily_requirements_seem_very_unrealistic/,183,123,1603542770.0
Blueberries vs Mixed Berries,ixkt1l,JohnnyJacksonJnr,https://www.reddit.com/r/nutrition/comments/ixkt1l/blueberries_vs_mixed_berries/,185,64,1600770542.0
French emphasis on twelve fruits/vegetables a day,h8ibrb,None,https://www.reddit.com/r/nutrition/comments/h8ibrb/french_emphasis_on_twelve_fruitsvegetables_a_day/,183,60,1592090543.0
Is sugar really that bad?,enswl4,Meii345,https://www.reddit.com/r/nutrition/comments/enswl4/is_sugar_really_that_bad/,180,175,1578860942.0
How to get accurate and verified info about nutrition?,clhnvd,InnoSang,https://www.reddit.com/r/nutrition/comments/clhnvd/how_to_get_accurate_and_verified_info_about/,184,135,1564831045.0
Minimal vegetables required to supply all vitamins and minerals,zp5l6v,bitbythecron,https://www.reddit.com/r/nutrition/comments/zp5l6v/minimal_vegetables_required_to_supply_all/,179,103,1671390167.0
Why are so many of our foods carcinogenic?,tvxulu,Large-Beans,https://www.reddit.com/r/nutrition/comments/tvxulu/why_are_so_many_of_our_foods_carcinogenic/,182,154,1649064748.0
Are vegetable oils actually bad for you?,rxq1y7,Huskyy23,https://www.reddit.com/r/nutrition/comments/rxq1y7/are_vegetable_oils_actually_bad_for_you/,178,232,1641506074.0
"Does Collagen have the same nutritional values as Gelatin, since Gelatin is its degraded form? Wondering if its consumption would be good for Joint health as Gelatin is",n2yqh6,TheMaslankaDude,https://www.reddit.com/r/nutrition/comments/n2yqh6/does_collagen_have_the_same_nutritional_values_as/,179,41,1619928477.0
What is the best website to find the most accurate nutrition facts for various foods?,k238ql,rabbitsketch,https://www.reddit.com/r/nutrition/comments/k238ql/what_is_the_best_website_to_find_the_most/,180,37,1606491206.0
Meta-Analysis of RCTs finds Substituting healthy plant proteins for red meat lowers risk for heart disease,bisrrk,Only8livesleft,https://www.reddit.com/r/nutrition/comments/bisrrk/metaanalysis_of_rcts_finds_substituting_healthy/,180,150,1556561848.0
What is “processed meat” and why is it carcinogenic?,agwupl,Myco_Crazy,https://www.reddit.com/r/nutrition/comments/agwupl/what_is_processed_meat_and_why_is_it_carcinogenic/,179,86,1547724527.0
"Do we have ""toxins"" in our bodies or not?",ye0z4p,PEN-15-CLUB,https://www.reddit.com/r/nutrition/comments/ye0z4p/do_we_have_toxins_in_our_bodies_or_not/,181,97,1666798332.0
What are the cons of imitation crab meat.,qmy6ox,Tangentkoala,https://www.reddit.com/r/nutrition/comments/qmy6ox/what_are_the_cons_of_imitation_crab_meat/,180,67,1636069882.0
How important is a daily probiotic supplement?,o1ulgc,New_Collar_5855,https://www.reddit.com/r/nutrition/comments/o1ulgc/how_important_is_a_daily_probiotic_supplement/,184,163,1623927904.0
"Is animal protein and ""alternative"" protein the same for muscle building?",jb9hlx,lunaticc,https://www.reddit.com/r/nutrition/comments/jb9hlx/is_animal_protein_and_alternative_protein_the/,180,104,1602709207.0
Audiobooks or Podcasts for an absolute beginner,isn3ru,the3rdNotch,https://www.reddit.com/r/nutrition/comments/isn3ru/audiobooks_or_podcasts_for_an_absolute_beginner/,181,59,1600097438.0
Why are dried fruits packed with nutrients their fresh form isn't?,i7p0x0,None,https://www.reddit.com/r/nutrition/comments/i7p0x0/why_are_dried_fruits_packed_with_nutrients_their/,180,51,1597139997.0
"Healthy, calorie-dense foods?",fbu03r,cousinOatmeal,https://www.reddit.com/r/nutrition/comments/fbu03r/healthy_caloriedense_foods/,182,120,1583069119.0
Preventable Cancer Burden Associated with Poor Diet in the United States,bsbcib,Only8livesleft,https://www.reddit.com/r/nutrition/comments/bsbcib/preventable_cancer_burden_associated_with_poor/,179,49,1558663706.0
"Brad Schoenfeld, Ph.D., discusses his research on how there is a protein anabolic window but it is not much, how people who resistance train need roughly double the protein RDA for optimal muscle protein synthesis, and how 30-40 grams of protein per meal is optimal for muscle protein synthesis.",zegzr5,Farnectarine4825,https://www.reddit.com/r/nutrition/comments/zegzr5/brad_schoenfeld_phd_discusses_his_research_on_how/,177,20,1670358214.0
Can you eat too much protein in one meal where your body doesn’t utilize it all for muscle growth?,yfa55q,yuh_boi_wassap_,https://www.reddit.com/r/nutrition/comments/yfa55q/can_you_eat_too_much_protein_in_one_meal_where/,179,128,1666921348.0
Where does the fear of chemicals in food originate from?,rm699i,None,https://www.reddit.com/r/nutrition/comments/rm699i/where_does_the_fear_of_chemicals_in_food/,182,152,1640183074.0
What benefits of clean eating did you experience?,ku9eb2,BanjoZone,https://www.reddit.com/r/nutrition/comments/ku9eb2/what_benefits_of_clean_eating_did_you_experience/,180,155,1610260916.0
For those who've improved in some manner after giving up dairy - what kind?,j419a7,slothtrop6,https://www.reddit.com/r/nutrition/comments/j419a7/for_those_whove_improved_in_some_manner_after/,180,122,1601667055.0
What’s the real deal with lemon water?,gnw65c,potplant1985,https://www.reddit.com/r/nutrition/comments/gnw65c/whats_the_real_deal_with_lemon_water/,180,100,1590065010.0
"What are some nutrition concepts that have not been proven by science (yet), but you deem to be true based on your personal experience and reasoning?",er4vwu,Bijzettafeltje,https://www.reddit.com/r/nutrition/comments/er4vwu/what_are_some_nutrition_concepts_that_have_not/,179,311,1579479260.0
What's good to know about vitamin absorptions/interactions?,awfyj4,None,https://www.reddit.com/r/nutrition/comments/awfyj4/whats_good_to_know_about_vitamin/,181,79,1551517761.0
Best addition to your diet?,an58h4,None,https://www.reddit.com/r/nutrition/comments/an58h4/best_addition_to_your_diet/,178,354,1549308436.0
What foods truly have zero negative health benefits to eating them?,108thay,None,https://www.reddit.com/r/nutrition/comments/108thay/what_foods_truly_have_zero_negative_health/,180,282,1673405651.0
Creatine pros and cons,y2vzqc,Flat-Ad1599,https://www.reddit.com/r/nutrition/comments/y2vzqc/creatine_pros_and_cons/,179,172,1665659673.0
Any major difference between Rolled oats and Steel cut oats?,v4u0u1,wolfeofark,https://www.reddit.com/r/nutrition/comments/v4u0u1/any_major_difference_between_rolled_oats_and/,180,112,1654364912.0
"Study comparing the effect of sugar, saturated and unsaturated fats on fatty liver disease (and diabetes risk)",jvawd4,ExtraDebit,https://www.reddit.com/r/nutrition/comments/jvawd4/study_comparing_the_effect_of_sugar_saturated_and/,179,95,1605547743.0
"Is all processed meat carcinogenic, or just processed red meat?",ivn7ze,marco_polo_2020,https://www.reddit.com/r/nutrition/comments/ivn7ze/is_all_processed_meat_carcinogenic_or_just/,175,94,1600496320.0
Vitamin D Deficiency Treatment: How long did it take you to feel anything?,f5vh6h,Highwayman1717,https://www.reddit.com/r/nutrition/comments/f5vh6h/vitamin_d_deficiency_treatment_how_long_did_it/,177,87,1582047487.0
Why can’t you “front load” all your calories in the morning,1b24lws,borealvalley1,https://www.reddit.com/r/nutrition/comments/1b24lws/why_cant_you_front_load_all_your_calories_in_the/,179,105,1709122298.0
How are you getting enough fiber? 30g just feels unattainable.,14h81n9,Momoselfie,https://www.reddit.com/r/nutrition/comments/14h81n9/how_are_you_getting_enough_fiber_30g_just_feels/,179,347,1687550183.0
What are some good protein sources to add to oatmeal?,wuojda,None,https://www.reddit.com/r/nutrition/comments/wuojda/what_are_some_good_protein_sources_to_add_to/,178,235,1661159160.0
White rice as a staple food,sirdmy,samanime,https://www.reddit.com/r/nutrition/comments/sirdmy/white_rice_as_a_staple_food/,175,114,1643815678.0
Who is the 2000kcal a day based off of,qz9wk6,Vehemonth,https://www.reddit.com/r/nutrition/comments/qz9wk6/who_is_the_2000kcal_a_day_based_off_of/,174,98,1637545202.0
"""Fructose is the same as ethanol"" An but old informative talk from Robert H. Lustig",jp2lvs,Etzello,https://www.reddit.com/r/nutrition/comments/jp2lvs/fructose_is_the_same_as_ethanol_an_but_old/,174,72,1604657306.0
Scientific Panel on New Dietary Guidelines Draws Criticism From Health Advocates,hc79fd,grh55,https://www.reddit.com/r/nutrition/comments/hc79fd/scientific_panel_on_new_dietary_guidelines_draws/,173,32,1592595502.0
Daily Foods to Eat for Maximum Micro-nutrient Intake,ex73xi,Xurin_Tech,https://www.reddit.com/r/nutrition/comments/ex73xi/daily_foods_to_eat_for_maximum_micronutrient/,175,123,1580568492.0
Why You Should Be Skeptical of the Lastest Nutrition Headlines,9md60x,zyrnil,https://www.reddit.com/r/nutrition/comments/9md60x/why_you_should_be_skeptical_of_the_lastest/,176,70,1538988328.0
WHO: Massive 10x increase in childhood and adolescent obesity in only four decades,75ojwu,dragonm3,https://www.reddit.com/r/nutrition/comments/75ojwu/who_massive_10x_increase_in_childhood_and/,178,75,1507722909.0
"why we can eat raw carrots but not raw potatoes,beets, sweet potato etc?",103oykh,Aviv352,https://www.reddit.com/r/nutrition/comments/103oykh/why_we_can_eat_raw_carrots_but_not_raw/,177,165,1672891378.0
Why is saffron so expensive? Do you think it's worth it?,shtfas,Amber_Chucko,https://www.reddit.com/r/nutrition/comments/shtfas/why_is_saffron_so_expensive_do_you_think_its/,177,65,1643717100.0
What are the most common micronutrients missed/under-consumed by vegetarians/vegans?,satuz1,horlen1234,https://www.reddit.com/r/nutrition/comments/satuz1/what_are_the_most_common_micronutrients/,179,164,1642945164.0
Standard American Diet Disordered Eating,qkf087,iamlionheart,https://www.reddit.com/r/nutrition/comments/qkf087/standard_american_diet_disordered_eating/,175,75,1635776371.0
Does eating to little calories daily over time make u lose appetite?,p176jy,DongerRektNoob420,https://www.reddit.com/r/nutrition/comments/p176jy/does_eating_to_little_calories_daily_over_time/,177,57,1628533186.0
Is salt actually bad for you?,12f5dyk,Glittering_Extent_12,https://www.reddit.com/r/nutrition/comments/12f5dyk/is_salt_actually_bad_for_you/,179,248,1680913889.0
