Title,ID,Author,URL,Score,Comment Count,Created
Is vitamin D still awesome?,fpi7rc,approachpattern,https://www.reddit.com/r/nutrition/comments/fpi7rc/is_vitamin_d_still_awesome/,239,162,1585251978.0
Foods with surprisingly good nutritional content? ,1biywjf,mors-vincit_omnia,https://www.reddit.com/r/nutrition/comments/1biywjf/foods_with_surprisingly_good_nutritional_content/,236,271,1710891031.0
Are vegetables from a garden healthier than (most) vegetables from a store?,ob8onk,None,https://www.reddit.com/r/nutrition/comments/ob8onk/are_vegetables_from_a_garden_healthier_than_most/,234,90,1625093770.0
Are there any books on nutrition that really inspired you / changed your life?,qya13f,None,https://www.reddit.com/r/nutrition/comments/qya13f/are_there_any_books_on_nutrition_that_really/,235,144,1637428404.0
Are Beyond Burgers Actually Healthy?,qa66a1,thewintermood,https://www.reddit.com/r/nutrition/comments/qa66a1/are_beyond_burgers_actually_healthy/,237,212,1634500096.0
"Jan. 1, 2021 is the remaining compliance date for the FDA trans fat ban",k2n1al,mmortal03,https://www.reddit.com/r/nutrition/comments/k2n1al/jan_1_2021_is_the_remaining_compliance_date_for/,233,10,1606567338.0
What changes have you noticed after becoming health-conscious and adopting a nutritious diet?,1ayzoe3,Unhappy-Document-386,https://www.reddit.com/r/nutrition/comments/1ayzoe3/what_changes_have_you_noticed_after_becoming/,231,178,1708794726.0
In a sense is Nutrition science the most flawed science we have today? So many of the nutrition guidelines are based off epidemiology and rarely are they tied controlled long-term clinical trials to real a conclusion on causation.,r5p6m6,None,https://www.reddit.com/r/nutrition/comments/r5p6m6/in_a_sense_is_nutrition_science_the_most_flawed/,234,116,1638284659.0
What are the best foods for eye health?,jzkxps,sultan_2020,https://www.reddit.com/r/nutrition/comments/jzkxps/what_are_the_best_foods_for_eye_health/,233,135,1606149295.0
Has anyone had positive effects from quitting artificial sweeteners?,hj8n94,sadderall123,https://www.reddit.com/r/nutrition/comments/hj8n94/has_anyone_had_positive_effects_from_quitting/,237,143,1593603894.0
Persimmons are like natures jelly,qvzr4n,CuddleFishPix,https://www.reddit.com/r/nutrition/comments/qvzr4n/persimmons_are_like_natures_jelly/,235,79,1637157190.0
Opinion: we really need to start supporting pure monk fruit extract,nvi9yc,Ok_Replacement_8801,https://www.reddit.com/r/nutrition/comments/nvi9yc/opinion_we_really_need_to_start_supporting_pure/,231,121,1623196612.0
"Better to eat more, smaller meals throughout the day or eat fewer, bigger meals?",nq28k0,thumsyy,https://www.reddit.com/r/nutrition/comments/nq28k0/better_to_eat_more_smaller_meals_throughout_the/,233,123,1622575476.0
What are good substitutes for craving sugar?i,gdy8h6,laughinghyena688,https://www.reddit.com/r/nutrition/comments/gdy8h6/what_are_good_substitutes_for_craving_sugari/,233,234,1588687215.0
Why is there not a pill you can take instead of eating?,10or7dl,astrohighh,https://www.reddit.com/r/nutrition/comments/10or7dl/why_is_there_not_a_pill_you_can_take_instead_of/,231,184,1675048571.0
"If your brain requires sugar for energy, what would happen if you cut sugar?",s8pj1l,None,https://www.reddit.com/r/nutrition/comments/s8pj1l/if_your_brain_requires_sugar_for_energy_what/,228,149,1642703239.0
"Are there any cultures that lack a carb-y staple? If so, how do they fare health wise compared to other culture?",wkb33h,andrew2018022,https://www.reddit.com/r/nutrition/comments/wkb33h/are_there_any_cultures_that_lack_a_carby_staple/,228,215,1660070418.0
Can someone who understands nutrition explain to me realistically why a can of Sugar Free Monster Energy Drink is bad for you?,lzyyzx,Shalashascar,https://www.reddit.com/r/nutrition/comments/lzyyzx/can_someone_who_understands_nutrition_explain_to/,228,166,1615149034.0
How will I know when I’m physically “healthy”?,gv7ncz,projecthealthy,https://www.reddit.com/r/nutrition/comments/gv7ncz/how_will_i_know_when_im_physically_healthy/,232,97,1591105680.0
"Best way to know if you are deficient in certain nutrients (vitamins, minerals, etc.)?",getlbb,r-bitcoin,https://www.reddit.com/r/nutrition/comments/getlbb/best_way_to_know_if_you_are_deficient_in_certain/,231,95,1588802408.0
what is the minimum selection of foods that would guarantee no nutrient deficiencies?,xaeixs,bopopob,https://www.reddit.com/r/nutrition/comments/xaeixs/what_is_the_minimum_selection_of_foods_that_would/,232,150,1662779626.0
Why do some foods like mustard say they provide 0 calories? Wouldn't there be at least 1 even at the tiniest serving size?,qc2jbr,morkani,https://www.reddit.com/r/nutrition/comments/qc2jbr/why_do_some_foods_like_mustard_say_they_provide_0/,232,54,1634741249.0
"Americans are eating healthier, but not healthy",da2od2,Only8livesleft,https://www.reddit.com/r/nutrition/comments/da2od2/americans_are_eating_healthier_but_not_healthy/,231,47,1569600992.0
"Fascinating Study: Those who eat fruits and veggies live 3+ years longer than those who dont. Eating ONLY fruits helps you live 19 months longer, eating ONLY veggies helps you live 32 months longer.",95x2q7,Bluest_waters,https://www.reddit.com/r/nutrition/comments/95x2q7/fascinating_study_those_who_eat_fruits_and/,229,94,1533826190.0
Is there any comprehensive lists of quacks who are active in the online nutrition space so I know who to avoid?,104zc38,Icy_Adeptness1160,https://www.reddit.com/r/nutrition/comments/104zc38/is_there_any_comprehensive_lists_of_quacks_who/,231,307,1673024578.0
"when people say corn is unhealthy, what exactly do they mean?",uaujnh,None,https://www.reddit.com/r/nutrition/comments/uaujnh/when_people_say_corn_is_unhealthy_what_exactly_do/,229,174,1650806060.0
Are frozen fruits as healthy as fresh fruits?,rzztoy,EuphoricEchos,https://www.reddit.com/r/nutrition/comments/rzztoy/are_frozen_fruits_as_healthy_as_fresh_fruits/,232,69,1641757804.0
Healthy ways to flavor white rice,rzag9w,bopoff-entirely,https://www.reddit.com/r/nutrition/comments/rzag9w/healthy_ways_to_flavor_white_rice/,227,234,1641677136.0
How healthy is smoked salmon?,kfn1ik,sammyd829,https://www.reddit.com/r/nutrition/comments/kfn1ik/how_healthy_is_smoked_salmon/,232,77,1608304908.0
Salt at the bottom of the pretzel bag,ho4rh7,stmcvallin,https://www.reddit.com/r/nutrition/comments/ho4rh7/salt_at_the_bottom_of_the_pretzel_bag/,228,92,1594307431.0
What’s your favorite nutritious meal that always makes you happy after eating it? ,1bygz4x,princesscorgi2,https://www.reddit.com/r/nutrition/comments/1bygz4x/whats_your_favorite_nutritious_meal_that_always/,225,236,1712527741.0
The man with the SLOWEST pace of aging in the World - Siim Land,195ktpp,None,https://www.reddit.com/r/nutrition/comments/195ktpp/the_man_with_the_slowest_pace_of_aging_in_the/,227,134,1705140444.0
What do you think is the best vitamin/supplement everyone should take/consider?,lk8qgs,Adrianbnvntra,https://www.reddit.com/r/nutrition/comments/lk8qgs/what_do_you_think_is_the_best_vitaminsupplement/,229,285,1613375200.0
Is Clif Bar evidence of some sort of Vitamin C shortage or price squeeze?,jxb3ye,msucorey,https://www.reddit.com/r/nutrition/comments/jxb3ye/is_clif_bar_evidence_of_some_sort_of_vitamin_c/,232,41,1605819419.0
What is more important for muscle growth? Calorie surplus or attaining protein target?,idugxe,mt_winston,https://www.reddit.com/r/nutrition/comments/idugxe/what_is_more_important_for_muscle_growth_calorie/,226,131,1598006693.0
Is it healthy to eat vegetables that are fried in olive oil or avocado oil?,n8wyke,Olga_foroga420,https://www.reddit.com/r/nutrition/comments/n8wyke/is_it_healthy_to_eat_vegetables_that_are_fried_in/,224,191,1620625106.0
What are the top 3-5 vegetables with the most fiber?,ke37i5,SilverRule,https://www.reddit.com/r/nutrition/comments/ke37i5/what_are_the_top_35_vegetables_with_the_most_fiber/,231,81,1608096718.0
"Why is goats milk seemingly to be better overall for people than cows milk, yet we have more of the former versus the other?",hdyf2h,MrSnootybooty,https://www.reddit.com/r/nutrition/comments/hdyf2h/why_is_goats_milk_seemingly_to_be_better_overall/,228,90,1592852323.0
Is there a maximum amount of calories your body can absorb from a meal?,gu1p6q,surfsupbra,https://www.reddit.com/r/nutrition/comments/gu1p6q/is_there_a_maximum_amount_of_calories_your_body/,227,97,1590941307.0
Boiling kale: at what point does it just become a lump of vitaminless fiber?,mxqtsl,SweetPickleRelish,https://www.reddit.com/r/nutrition/comments/mxqtsl/boiling_kale_at_what_point_does_it_just_become_a/,225,114,1619291852.0
Why do big time fitness trainers eat mountains of brown rice and chicken?,pf81xk,OrdinaryCow,https://www.reddit.com/r/nutrition/comments/pf81xk/why_do_big_time_fitness_trainers_eat_mountains_of/,226,142,1630423384.0
what does a perfect day of eating look like to you?,b3jdrq,None,https://www.reddit.com/r/nutrition/comments/b3jdrq/what_does_a_perfect_day_of_eating_look_like_to_you/,225,276,1553125812.0
Swedish study shows 44% reduced fatty liver after 2 weeks of low carb eating,8kbkzc,1345834,https://www.reddit.com/r/nutrition/comments/8kbkzc/swedish_study_shows_44_reduced_fatty_liver_after/,225,92,1526631608.0
Is steaming vegetables really better than boiling them?,jatdgx,beenpimpin,https://www.reddit.com/r/nutrition/comments/jatdgx/is_steaming_vegetables_really_better_than_boiling/,228,92,1602647646.0
What foods can properly satiate you?,j0qkbb,None,https://www.reddit.com/r/nutrition/comments/j0qkbb/what_foods_can_properly_satiate_you/,224,183,1601210998.0
"What would be healthier to give up, alcohol or sugary soda? ",1dtith9,mafternoonshyamalan,https://www.reddit.com/r/nutrition/comments/1dtith9/what_would_be_healthier_to_give_up_alcohol_or/,224,402,1719917182.0
Why is body fat lost or gained unevenly?,p0dsja,doctor_bun,https://www.reddit.com/r/nutrition/comments/p0dsja/why_is_body_fat_lost_or_gained_unevenly/,222,53,1628425806.0
Is whole wheat pasta that much better for you?,l845ga,not_cinderella,https://www.reddit.com/r/nutrition/comments/l845ga/is_whole_wheat_pasta_that_much_better_for_you/,222,139,1611954231.0
Are 100% of the calories given in nutrition facts absorbed?,jk2rbs,coltcarnevale,https://www.reddit.com/r/nutrition/comments/jk2rbs/are_100_of_the_calories_given_in_nutrition_facts/,223,54,1603941968.0
"Is there a comprehensive ""cheat sheet"" of food combos to maximize nutrient absorption and those to avoid?",fwegom,sunstah,https://www.reddit.com/r/nutrition/comments/fwegom/is_there_a_comprehensive_cheat_sheet_of_food/,223,110,1586235779.0
How fast does caloric surplus translate into extra weight?,hklaj7,coolotaku32,https://www.reddit.com/r/nutrition/comments/hklaj7/how_fast_does_caloric_surplus_translate_into/,221,51,1593790956.0
"The sugar conspiracy: In 1972, a British scientist sounded the alarm that sugar – and not fat – was the greatest danger to our health. But his findings were ridiculed and his reputation ruined.",4dqvmw,hex010,https://www.reddit.com/r/nutrition/comments/4dqvmw/the_sugar_conspiracy_in_1972_a_british_scientist/,221,21,1460033474.0
I keep seeing sourdough bread recommended as a probiotic. Surely all the bacteria would die during the baking process.,taumb0,concretepigeon,https://www.reddit.com/r/nutrition/comments/taumb0/i_keep_seeing_sourdough_bread_recommended_as_a/,217,92,1646902791.0
Has what you buy and eat changed due to inflation?,szi567,None,https://www.reddit.com/r/nutrition/comments/szi567/has_what_you_buy_and_eat_changed_due_to_inflation/,223,141,1645624777.0
"If most of the hunter gatherers thrived and survived on ketosis, how did they manage to get away with low sodium and magnesium?",owbiqs,dokkblarr,https://www.reddit.com/r/nutrition/comments/owbiqs/if_most_of_the_hunter_gatherers_thrived_and/,222,139,1627898834.0
Is red Meat really as bad as they say it is?,ldaitn,None,https://www.reddit.com/r/nutrition/comments/ldaitn/is_red_meat_really_as_bad_as_they_say_it_is/,222,280,1612541639.0
Why is the American food system built so poorly? ,1dneqt3,Lekrebs,https://www.reddit.com/r/nutrition/comments/1dneqt3/why_is_the_american_food_system_built_so_poorly/,223,277,1719239101.0
What are the 5 foods you eat the most of?,17c1gmi,fittyjitty,https://www.reddit.com/r/nutrition/comments/17c1gmi/what_are_the_5_foods_you_eat_the_most_of/,221,647,1697771718.0
[Research Discussion] Dairy intake is not associated with improvements in bone mineral density or risk of fractures across the menopause transition,gxzwmj,avivi_,https://www.reddit.com/r/nutrition/comments/gxzwmj/research_discussion_dairy_intake_is_not/,222,22,1591480723.0
Why is do so many people have gut issues?,d5ax24,Jennybunny-,https://www.reddit.com/r/nutrition/comments/d5ax24/why_is_do_so_many_people_have_gut_issues/,221,167,1568688360.0
What are some non-bullshit YouTubers regarding nutrition health?,a7s7af,bjorken22,https://www.reddit.com/r/nutrition/comments/a7s7af/what_are_some_nonbullshit_youtubers_regarding/,219,188,1545264338.0
"Inflammation, not Cholesterol, Is a Cause of Chronic Disease",8jby67,Grok22,https://www.reddit.com/r/nutrition/comments/8jby67/inflammation_not_cholesterol_is_a_cause_of/,220,105,1526301980.0
Consumer Reports just tested a variety of tuna for mercury again,10yhg9n,thaw4188,https://www.reddit.com/r/nutrition/comments/10yhg9n/consumer_reports_just_tested_a_variety_of_tuna/,221,63,1676007618.0
What exactly makes fast food bad for you?,rwh3ni,Da_SnowLeopard,https://www.reddit.com/r/nutrition/comments/rwh3ni/what_exactly_makes_fast_food_bad_for_you/,219,203,1641367526.0
"If you were lost in the wilderness with only a bottle of liquor, no food or water, would it be worth drinking at any point to gain calories?",rs25jf,okiedokieday,https://www.reddit.com/r/nutrition/comments/rs25jf/if_you_were_lost_in_the_wilderness_with_only_a/,220,93,1640871960.0
Are there any foods that are so high in nutrients that they are poisonous?,oss0s7,None,https://www.reddit.com/r/nutrition/comments/oss0s7/are_there_any_foods_that_are_so_high_in_nutrients/,221,87,1627409347.0
What are some of your favorite sugar free foods?,jzb8fe,None,https://www.reddit.com/r/nutrition/comments/jzb8fe/what_are_some_of_your_favorite_sugar_free_foods/,222,170,1606107401.0
What advice would you give to your younger self?,i6gx5j,PappyTheSnackDaddy,https://www.reddit.com/r/nutrition/comments/i6gx5j/what_advice_would_you_give_to_your_younger_self/,219,274,1596967269.0
Is vegan health documentaries biased?,hef103,felixborelius,https://www.reddit.com/r/nutrition/comments/hef103/is_vegan_health_documentaries_biased/,220,259,1592920496.0
Low and high carb diets increase mortality. Diets with 50-55% carbs and lowest in animal products appear optimal,984k7l,Only8livesleft,https://www.reddit.com/r/nutrition/comments/984k7l/low_and_high_carb_diets_increase_mortality_diets/,219,193,1534529380.0
Study: blueberries increase brain activity and improve working memory. Researchers used fMRI to measure real time changes in brain function and blood brain flow with blueberry consumption.,84qcc8,Bluest_waters,https://www.reddit.com/r/nutrition/comments/84qcc8/study_blueberries_increase_brain_activity_and/,218,29,1521150804.0
Why are protein powders so popular these days? Is it good for you?,1b7gmw5,None,https://www.reddit.com/r/nutrition/comments/1b7gmw5/why_are_protein_powders_so_popular_these_days_is/,218,242,1709672875.0
"Did you see any differences, adding more veggies in your diet?",1akr813,CheeseBurgerFriesYum,https://www.reddit.com/r/nutrition/comments/1akr813/did_you_see_any_differences_adding_more_veggies/,214,154,1707270447.0
"What would happen if some person keeps lifting heavy, without consuming enough protein?",t0g71p,None,https://www.reddit.com/r/nutrition/comments/t0g71p/what_would_happen_if_some_person_keeps_lifting/,217,67,1645723113.0
Do different types nutrition determine abdominal fat or it is just extra calories stored as fat ?,nbitv0,abduelangote,https://www.reddit.com/r/nutrition/comments/nbitv0/do_different_types_nutrition_determine_abdominal/,215,130,1620918547.0
"What nutrients should vegetarians or vegans be careful about getting enough of, and what are some ways of getting those nutrients within those diets?",gme0s9,Cyaney,https://www.reddit.com/r/nutrition/comments/gme0s9/what_nutrients_should_vegetarians_or_vegans_be/,217,134,1589848385.0
"If a drink states it's ""sugar free"", what compunds are most likely to be in it in order to make it sweet? Also, are they better or worse than the sugar they have replaced?",elkbix,HealthfulDrago,https://www.reddit.com/r/nutrition/comments/elkbix/if_a_drink_states_its_sugar_free_what_compunds/,217,157,1578442078.0
"Glutamine and whey protein improve intestinal permeability and morphology in patients with Crohn's disease. Intestinal permeability has been implicated in the etiopathogenesis, disease activity and relapse of Crohn's disease.",ejwme4,Antichr0st,https://www.reddit.com/r/nutrition/comments/ejwme4/glutamine_and_whey_protein_improve_intestinal/,217,29,1578144439.0
Does Stevia cause the same harm to gut bacteria as other sweeteners like Aspartame?,nv4kv7,None,https://www.reddit.com/r/nutrition/comments/nv4kv7/does_stevia_cause_the_same_harm_to_gut_bacteria/,213,119,1623160544.0
Why is that nitrates in processed meats are carcinogenic but nitrates in vegetables beets are supposedly beneficial eg in athletic performance?,k6kgge,mutantsloth,https://www.reddit.com/r/nutrition/comments/k6kgge/why_is_that_nitrates_in_processed_meats_are/,218,93,1607086858.0
what’s the deal with sweet potato,hsgdzg,chaoticsirenity,https://www.reddit.com/r/nutrition/comments/hsgdzg/whats_the_deal_with_sweet_potato/,218,120,1594927447.0
How much does the nutritional content of a banana change as it ripens?,hdf6m5,sweetnspicychilichip,https://www.reddit.com/r/nutrition/comments/hdf6m5/how_much_does_the_nutritional_content_of_a_banana/,213,45,1592775720.0
"If you could only eat one vegetable for the rest of your life, which would it be, and why?",flpdjg,cohen5250,https://www.reddit.com/r/nutrition/comments/flpdjg/if_you_could_only_eat_one_vegetable_for_the_rest/,215,298,1584681575.0
What is something unhealthy that most people don't realize is?,e65bd5,continuousbit,https://www.reddit.com/r/nutrition/comments/e65bd5/what_is_something_unhealthy_that_most_people_dont/,221,498,1575491308.0
Some foods ranked by protein/calorie,ayx95c,ohnoivesaid2much,https://www.reddit.com/r/nutrition/comments/ayx95c/some_foods_ranked_by_proteincalorie/,219,32,1552089755.0
What are the most nutrient dense foods?,vupuil,BigOblivion,https://www.reddit.com/r/nutrition/comments/vupuil/what_are_the_most_nutrient_dense_foods/,217,204,1657328765.0
AAP Study Shows That Growing Children Eating a Vegetarian Diet Show No “Evidence of Clinically Meaningful Differences in Growth”,uxeiwq,None,https://www.reddit.com/r/nutrition/comments/uxeiwq/aap_study_shows_that_growing_children_eating_a/,215,50,1653475201.0
Whats the deal with oatmeal?,ry84fc,driveanywhere,https://www.reddit.com/r/nutrition/comments/ry84fc/whats_the_deal_with_oatmeal/,216,245,1641564345.0
What are truly successful diet methods to cut fat?,iw29ud,jw9010382,https://www.reddit.com/r/nutrition/comments/iw29ud/what_are_truly_successful_diet_methods_to_cut_fat/,218,192,1600555162.0
Why do some kids never gain fat from eating junk food?,ih3wtj,Polishrevolution32,https://www.reddit.com/r/nutrition/comments/ih3wtj/why_do_some_kids_never_gain_fat_from_eating_junk/,215,140,1598465053.0
Does your body evolve and get skilled processing foods you continuously eat?,hoyu4w,JonathonSnow,https://www.reddit.com/r/nutrition/comments/hoyu4w/does_your_body_evolve_and_get_skilled_processing/,216,67,1594420767.0
Is red meat actually bad? I’m seeing mixed info.,12rx0jj,moremushroomsplease,https://www.reddit.com/r/nutrition/comments/12rx0jj/is_red_meat_actually_bad_im_seeing_mixed_info/,216,383,1681917495.0
How long could someone survive off of multivitamins and protein shakes?,zj0l5j,soberbabyduck,https://www.reddit.com/r/nutrition/comments/zj0l5j/how_long_could_someone_survive_off_of/,216,124,1670779559.0
Do protein drinks really help with muscle development?,sfwtdy,Celeste02monique,https://www.reddit.com/r/nutrition/comments/sfwtdy/do_protein_drinks_really_help_with_muscle/,216,115,1643504675.0
Is there a cheatsheet or summary of when and with what foods to take your vitamin supplements?,lqtnpy,sunstah,https://www.reddit.com/r/nutrition/comments/lqtnpy/is_there_a_cheatsheet_or_summary_of_when_and_with/,214,58,1614115956.0
What vitamins do you take daily?,s4yma2,None,https://www.reddit.com/r/nutrition/comments/s4yma2/what_vitamins_do_you_take_daily/,211,273,1642292598.0
How Much Sun Exposure is Needed to Meet Our Vitamin D Requirements?,qevazz,VeganPhilosopher,https://www.reddit.com/r/nutrition/comments/qevazz/how_much_sun_exposure_is_needed_to_meet_our/,213,64,1635092096.0
How much tea do you need to drink to see the respective health benefits?,jiix2c,Flippiewulf,https://www.reddit.com/r/nutrition/comments/jiix2c/how_much_tea_do_you_need_to_drink_to_see_the/,214,62,1603733374.0
"Maybe time to stop eating turmeric, researchers find it could contain lead",d9h5sq,bluediavolo,https://www.reddit.com/r/nutrition/comments/d9h5sq/maybe_time_to_stop_eating_turmeric_researchers/,214,46,1569489596.0
What are the best podcasts on nutrition?,bbrtqs,maverica15,https://www.reddit.com/r/nutrition/comments/bbrtqs/what_are_the_best_podcasts_on_nutrition/,215,76,1554932703.0
Why does the vegan community (including its doctors) not take failure to thrive seriously?,b320nr,dissolved_remainder,https://www.reddit.com/r/nutrition/comments/b320nr/why_does_the_vegan_community_including_its/,212,285,1553025258.0
Dietary factors are the single most significant risk factor for disability and premature death in the United States. Are medical professionals trained to give nutritional advice to their patients?,8di75y,jasonking,https://www.reddit.com/r/nutrition/comments/8di75y/dietary_factors_are_the_single_most_significant/,214,62,1524172326.0
Is water mixed with other stuff still considered water as a means of “drinking water”?,11dhich,mooreba2,https://www.reddit.com/r/nutrition/comments/11dhich/is_water_mixed_with_other_stuff_still_considered/,215,141,1677519083.0
Shocked to learn about daily reccomended amount of sugar,wdg66k,Various_Ad_2327,https://www.reddit.com/r/nutrition/comments/wdg66k/shocked_to_learn_about_daily_reccomended_amount/,211,175,1659356613.0
Things the whole nutrition community can agree on,fa0f3p,None,https://www.reddit.com/r/nutrition/comments/fa0f3p/things_the_whole_nutrition_community_can_agree_on/,215,318,1582751758.0
Can you just eat high fiber foods right before sweets to minimze the negative effects of the sugar?,f4am68,None,https://www.reddit.com/r/nutrition/comments/f4am68/can_you_just_eat_high_fiber_foods_right_before/,209,105,1581779424.0
Vitamin D and the changing seasons,dvbwkk,wholesomefiddleblues,https://www.reddit.com/r/nutrition/comments/dvbwkk/vitamin_d_and_the_changing_seasons/,211,99,1573574371.0
Is getting 1g of protein per pound of body weight actually realistic,18y4si1,FitConsideration714,https://www.reddit.com/r/nutrition/comments/18y4si1/is_getting_1g_of_protein_per_pound_of_body_weight/,216,247,1704344333.0
Joe Rogan says white rice is better than brown…,j79qkv,jameskable,https://www.reddit.com/r/nutrition/comments/j79qkv/joe_rogan_says_white_rice_is_better_than_brown/,215,430,1602147653.0
"Why doesn’t it say all the nutrients that are supposed to be in different foods on the nutrition facts, but when u look online it tells u “this is a good source of (blank)”?",gne2yq,experiencedaddict,https://www.reddit.com/r/nutrition/comments/gne2yq/why_doesnt_it_say_all_the_nutrients_that_are/,208,34,1589990653.0
Inflammatory foods: Why do they cause inflammation? What’s happening in the body? Why are some people more sensitive ?,eil6dv,kittenbox123,https://www.reddit.com/r/nutrition/comments/eil6dv/inflammatory_foods_why_do_they_cause_inflammation/,212,79,1577901047.0
Federal court again blocks San Francisco warning on soda ads,am3d3q,cybersecp,https://www.reddit.com/r/nutrition/comments/am3d3q/federal_court_again_blocks_san_francisco_warning/,210,102,1549036243.0
Nutrition should be a mandatory credit in schools,193irsq,None,https://www.reddit.com/r/nutrition/comments/193irsq/nutrition_should_be_a_mandatory_credit_in_schools/,209,120,1704919798.0
Any downside to soy milk?,qujyij,jack_hof,https://www.reddit.com/r/nutrition/comments/qujyij/any_downside_to_soy_milk/,210,282,1636992903.0
Nutrition Facts (No not that kind),npkgfx,skittlesandsunshine,https://www.reddit.com/r/nutrition/comments/npkgfx/nutrition_facts_no_not_that_kind/,211,189,1622517417.0
Is fasting better than decreasing calories to maintain muscle mass?,l019cn,saminator1002,https://www.reddit.com/r/nutrition/comments/l019cn/is_fasting_better_than_decreasing_calories_to/,211,112,1610996714.0
Brown Sugar In Oatmeal: Yay or Nay?,kq36r8,AlarmingCompetition5,https://www.reddit.com/r/nutrition/comments/kq36r8/brown_sugar_in_oatmeal_yay_or_nay/,211,116,1609742365.0
Collagen peptide supplements - plenty of anecdotal success stories but my basic understanding of the science implies that it wont work,kn2lt6,ghroat,https://www.reddit.com/r/nutrition/comments/kn2lt6/collagen_peptide_supplements_plenty_of_anecdotal/,213,64,1609336244.0
What foods would make up a “perfect day” of eating?,g6yn2z,throwaway229113,https://www.reddit.com/r/nutrition/comments/g6yn2z/what_foods_would_make_up_a_perfect_day_of_eating/,213,195,1587688884.0
